"id","Review","Sentence Component","aspect_text","aspect","sentiment_text","sentiment"
"75","giảng viên nhiệt tình giảng dạy , luôn đúng giờ , luôn giúp đỡ sinh viên ."," luôn đúng giờ"," luôn đúng giờ","Organization and management"," luôn đúng giờ","Positive"
"75","giảng viên nhiệt tình giảng dạy , luôn đúng giờ , luôn giúp đỡ sinh viên ."," luôn giúp đỡ sinh viên","giúp đỡ sinh viên","Support from lecturers","luôn giúp đỡ","Positive"
"76","hiểu biết rõ hơn về các ngành học trong trường , được gặp những giáo viên hướng dẫn giỏi từ các khoa khác nhau .","hiểu biết rõ hơn về các ngành học trong trường","về các ngành học trong trường","General review","hiểu biết rõ hơn","Positive"
"76","hiểu biết rõ hơn về các ngành học trong trường , được gặp những giáo viên hướng dẫn giỏi từ các khoa khác nhau .","được gặp những giáo viên hướng dẫn giỏi từ các khoa khác nhau "," gặp những giáo viên hướng dẫn giỏi từ các khoa khác nhau","General review","được gặp","Positive"
"77","nhiệt tình , trình bày dễ hiểu , giúp đỡ sinh viên .","nhiệt tình","nhiệt tình","General review","nhiệt tình","Positive"
"77","nhiệt tình , trình bày dễ hiểu , giúp đỡ sinh viên .","trình bày dễ hiểu","trình bày","Teaching quality","dễ hiểu","Positive"
"77","nhiệt tình , trình bày dễ hiểu , giúp đỡ sinh viên .","giúp đỡ sinh viên","giúp đỡ sinh viên","Support from lecturers","giúp đỡ sinh viên","Positive"
"78","giảng dạy dễ hiểu , linh hoạt .","giảng dạy dễ hiểu , linh hoạt","giảng dạy","Teaching quality","dễ hiểu , linh hoạt","Positive"
"79","đèn và quạt .","đèn và quạt","đèn và quạt","Learning environment","đèn và quạt","Neutral"
"80","thầy giảng bài hay và rất dễ hiểu .","thầy giảng bài hay và rất dễ hiểu","thầy giảng bài","Teaching quality","hay và rất dễ hiểu","Positive"
"81","cô nhiệt tình , chu đáo .","cô nhiệt tình , chu đáo","cô ","Support from lecturers","nhiệt tình , chu đáo","Positive"
"82","giảng viên rất nhiệt tình , đúng giờ và nghiêm túc trong giảng dạy .","giảng viên rất nhiệt tình ","giảng viên","Teaching quality","rất nhiệt tình","Positive"
"82","giảng viên rất nhiệt tình , đúng giờ và nghiêm túc trong giảng dạy .","đúng giờ","đúng giờ","Organization and management","đúng giờ","Positive"
"82","giảng viên rất nhiệt tình , đúng giờ và nghiêm túc trong giảng dạy .","nghiêm túc trong giảng dạy","giảng dạy","Teaching quality","nghiêm túc ","Positive"
"83","giảng dạy không tập trung vào chuyên môn .","giảng dạy không tập trung vào chuyên môn","giảng dạy","Teaching quality","không tập trung vào chuyên môn","Negative"
"84","gần gũi , nhiệt tình .","gần gũi , nhiệt tình","gần gũi , nhiệt tình","Support from lecturers","gần gũi , nhiệt tình","Positive"
"85","giảng dạy tập trung .","giảng dạy tập trung","giảng dạy","Teaching quality"," tập trung","Positive"
"86","bài tập thầy ra hơi khó .","bài tập thầy ra hơi khó","bài tập ","Workload"," hơi khó","Negative"
"87","giảng viên giảng và chiếu slide đôi khi nhanh nên chậm lại .","giảng viên giảng và chiếu slide đôi khi nhanh nên chậm lại ","giảng viên giảng và chiếu slide","Teaching quality","nhanh nên chậm lại","Negative"
"88","tạo nhiều điều kiện để học sinh lấy điểm cộng , giáo án ngắn gọn , dễ hiểu .","tạo nhiều điều kiện để học sinh lấy điểm cộng","tạo nhiều điều kiện","Support from lecturers","tạo nhiều điều kiện ","Positive"
"88","tạo nhiều điều kiện để học sinh lấy điểm cộng , giáo án ngắn gọn , dễ hiểu ."," giáo án ngắn gọn , dễ hiểu","giáo án ","Course information","ngắn gọn , dễ hiểu","Positive"
"89","thầy rất vui tính , nhiệt tình giải đáp các thắc mắc của sinh viên !","thầy rất vui tính , nhiệt tình giải đáp các thắc mắc của sinh viên","thầy ","Support from lecturers","rất vui tính , nhiệt tình giải đáp các thắc mắc của sinh viên","Positive"
"90","ít bài tập nâng cao .","ít bài tập nâng cao","bài tập","Workload","ít bài tập nâng cao","Negative"
"91","dễ tiếp cận kiến thức .","dễ tiếp cận kiến thức","dễ tiếp cận kiến thức","General review","dễ tiếp cận","Positive"
"92","hiện có quá nhiều kiến thức , quá rộng , không tập trung chuyên sâu nên gây khó khăn trong tiếp thu .","hiện có quá nhiều kiến thức , quá rộng , không tập trung chuyên sâu nên gây khó khăn trong tiếp thu","hiện có quá nhiều kiến thức , quá rộng , không tập trung chuyên sâu","Course information","không tập trung chuyên sâu nên gây khó khăn trong tiếp thu","Negative"
"93","thầy dạy dễ hiểu và rõ ràng .","thầy dạy dễ hiểu và rõ ràng","thầy dạy","Teaching quality","dễ hiểu và rõ ràng","Positive"
"94","thầy giảng dạy rất tận tâm , có khả năng truyền đạt tốt , sử dụng giờ lên lớp hiệu quả .","thầy giảng dạy rất tận tâm","thầy giảng dạy","Teaching quality"," rất tận tâm","Positive"
"94","thầy giảng dạy rất tận tâm , có khả năng truyền đạt tốt , sử dụng giờ lên lớp hiệu quả .","có khả năng truyền đạt tốt ","có khả năng truyền đạt ","Teaching quality","tốt ","Positive"
"94","thầy giảng dạy rất tận tâm , có khả năng truyền đạt tốt , sử dụng giờ lên lớp hiệu quả ."," sử dụng giờ lên lớp hiệu quả","sử dụng giờ lên lớp","Organization and management","hiệu quả","Positive"
"95","thầy cho nhiều bài tập hay .","thầy cho nhiều bài tập hay","nhiều bài tập","Workload","hay","Positive"
"96","cô nói nhanh quá , em nghe không kịp .","cô nói nhanh quá , em nghe không kịp","cô nói ","Teaching quality"," nhanh quá , em nghe không kịp","Negative"
"97","cải thiện cơ sở vật chất và thiết bị dạy học .","cải thiện cơ sở vật chất và thiết bị dạy học "," cơ sở vật chất và thiết bị dạy học","Learning environment","cải thiện","Negative"
"98","năng nổ , nhiệt tình chỉ bảo .","năng nổ , nhiệt tình chỉ bảo","chỉ bảo","Teaching quality","năng nổ , nhiệt tình ","Positive"
"99","cô dạy truyền cảm .","cô dạy truyền cảm","cô dạy","Teaching quality","truyền cảm","Positive"
"100","thầy nhiệt tình tới nỗi mỗi lần xong tiết học áo thấy đều ướt đẫm mồ hôi .","thầy nhiệt tình tới nỗi mỗi lần xong tiết học áo thấy đều ướt đẫm mồ hôi","thầy ","Teaching quality","nhiệt tình tới nỗi mỗi lần xong tiết học áo thấy đều ướt đẫm mồ hôi","Positive"