"id","Review","Sentence Component","aspect_text","aspect","sentiment_text","sentiment"
"1","lớp học thụ động , giảng viên chưa biết cách tạo sự sôi nổi cho sinh viên có hứng học .","lớp học thụ động","lớp học","Learning environment","thụ động","Negative"
"1","lớp học thụ động , giảng viên chưa biết cách tạo sự sôi nổi cho sinh viên có hứng học ."," giảng viên chưa biết cách tạo sự sôi nổi cho sinh viên có hứng học"," giảng viên","Teaching quality","chưa biết cách tạo sự sôi nổi","Negative"
"2","hệ thống giảng dạy trên wecode dễ hiểu .","hệ thống giảng dạy trên wecode dễ hiểu","hệ thống giảng dạy trên wecode","Course information","dễ hiểu","Positive"
"3","giảng dạy nhiệt tình , hiệu quả , tốt .","giảng dạy nhiệt tình , hiệu quả , tốt","giảng dạy","Teaching quality","nhiệt tình , hiệu quả , tốt","Positive"
"4","phương pháp giảng dạy hay và dễ hiểu .","phương pháp giảng dạy hay và dễ hiểu","phương pháp giảng dạy","Teaching quality","hay và dễ hiểu","Positive"
"5","dạy chậm , chiếu thêm slide , thêm bài tập .","dạy chậm","dạy ","Teaching quality","chậm","Negative"
"5","dạy chậm , chiếu thêm slide , thêm bài tập .","chiếu thêm slide"," slide","Course information","chiếu thêm","Neutral"
"5","dạy chậm , chiếu thêm slide , thêm bài tập .","thêm bài tập "," bài tập","Test and evaluation","thêm","Neutral"
"6","vì theo em thầy mọi người đi học rất đầy đủ .","vì theo em thầy mọi người đi học rất đầy đủ","mọi người đi học rất đầy đủ","Organization and management","rất đầy đủ","Positive"
"7","cô rất tận tình , nghiêm khắc trong giờ học .","cô rất tận tình , nghiêm khắc trong giờ học","cô ","Teaching quality","rất tận tình , nghiêm khắc","Positive"
"8","giáo viên dạy dễ hiểu và các bài thực hành phù hợp với chương trình và cấp độ sinh viên .","giáo viên dạy dễ hiểu","giáo viên dạy","Teaching quality"," dễ hiểu","Positive"
"8","giáo viên dạy dễ hiểu và các bài thực hành phù hợp với chương trình và cấp độ sinh viên ."," các bài thực hành phù hợp với chương trình và cấp độ sinh viên","các bài thực hành","Test and evaluation"," phù hợp với chương trình và cấp độ sinh viên","Positive"
"9","giảng viên tận tình , hay giúp đỡ sinh viên !","giảng viên tận tình","giảng viên","Teaching quality","tận tình","Positive"
"9","giảng viên tận tình , hay giúp đỡ sinh viên !","hay giúp đỡ sinh viên"," giúp đỡ sinh viên","Support from lecturers"," hay giúp đỡ","Positive"
"10","tâm huyết .","tâm huyết","tâm huyết","Teaching quality","tâm huyết","Positive"
"11","cô dạy nhiệt tình .","cô dạy nhiệt tình","cô dạy","Teaching quality","nhiệt tình","Positive"
"12","nội dung môn học mang tính cập nhật , mới mẻ .","nội dung môn học mang tính cập nhật , mới mẻ ","nội dung môn học","Course information","cập nhật , mới mẻ","Positive"
"13","cô vui vẻ .","cô vui vẻ","cô ","General review","vui vẻ","Positive"
"14","bài thực hành được xây dựng phù hợp với nội dung lý thuyết .","bài thực hành được xây dựng phù hợp với nội dung lý thuyết","bài thực hành","Test and evaluation"," phù hợp với nội dung lý thuyết","Positive"
"15","cô giảng rất hay .","cô giảng rất hay","cô giảng ","Teaching quality","rất hay","Positive"
"16","quan tâm giúp đỡ sinh viên .","quan tâm giúp đỡ sinh viên","quan tâm giúp đỡ sinh viên","Support from lecturers","quan tâm giúp đỡ","Positive"
"17","em nghĩ là cơ sở vật chất của trường còn yếu kém , máy chiếu rất mờ , rất ít khi nhìn rõ được chữ trên slide bài giảng .","em nghĩ là cơ sở vật chất của trường còn yếu kém","cơ sở vật chất của trường","Learning environment"," còn yếu kém","Positive"
"17","em nghĩ là cơ sở vật chất của trường còn yếu kém , máy chiếu rất mờ , rất ít khi nhìn rõ được chữ trên slide bài giảng .","máy chiếu rất mờ , rất ít khi nhìn rõ được chữ trên slide bài giảng","máy chiếu","Learning environment","rất mờ","Negative"
"18","không truyền đạt tốt các kiến thức , rắt mơ hồ và khó áp dụng trong việc thi cử .","không truyền đạt tốt các kiến thức","ruyền đạt","Teaching quality","không truyền đạt tốt","Negative"
"18","không truyền đạt tốt các kiến thức , rắt mơ hồ và khó áp dụng trong việc thi cử ."," rắt mơ hồ và khó áp dụng trong việc thi cử"," rắt mơ hồ và khó áp dụng trong việc thi cử","Course information","rắt mơ hồ và khó áp dụng trong việc thi cử","Negative"
"19","thầy dạy rất là chi tiết và tận tâm với sinh viên .","thầy dạy rất là chi tiết","thầy dạy","Teaching quality","chi tiết","Positive"
"19","thầy dạy rất là chi tiết và tận tâm với sinh viên .","tận tâm với sinh viên","tận tâm","Teaching quality","tận tâm","Positive"
"20","mong thầy sẽ lại dạy lớp z một lần nữa !","mong thầy sẽ lại dạy lớp z một lần nữa","mong thầy sẽ lại dạy lớp z một lần nữa","General review","mong","Positive"
"21","đề thầy ra rất hay và thiết thực với đời sống sinh viên ( bài , game , chat ) .","đề thầy ra rất hay và thiết thực với đời sống sinh viên ( bài , game , chat )","đề thầy ra","Test and evaluation","rất hay và thiết thực","Positive"
"22","thầy lên lớp đúng giờ , bài tập dễ hiểu , giảng dạy thoải mái ít gây nhiều áp lực cho sinh viên .","thầy lên lớp đúng giờ","thầy lên lớp","Organization and management","đúng giờ","Positive"
"22","thầy lên lớp đúng giờ , bài tập dễ hiểu , giảng dạy thoải mái ít gây nhiều áp lực cho sinh viên ."," bài tập dễ hiểu","bài tập","Test and evaluation"," dễ hiểu","Positive"
"22","thầy lên lớp đúng giờ , bài tập dễ hiểu , giảng dạy thoải mái ít gây nhiều áp lực cho sinh viên .","giảng dạy thoải mái","giảng dạy ","Teaching quality","thoải mái","Positive"
"22","thầy lên lớp đúng giờ , bài tập dễ hiểu , giảng dạy thoải mái ít gây nhiều áp lực cho sinh viên .","ít gây nhiều áp lực cho sinh viên","ít gây nhiều áp lực cho sinh viên","Support from lecturers","ít gây nhiều áp lực","Positive"
"23","cô dậy rất nhiệt tình .","cô dậy rất nhiệt tình","cô dậy","Teaching quality","rất nhiệt tình","Positive"
"24","nên có đồ án môn học .","nên có đồ án môn học ","đồ án môn học","Test and evaluation","nên có","Neutral"
"25","nội dung của môn học hiện tại chỉ ở mức lý thuyết khá nhiều , ít thực hành .","nội dung của môn học hiện tại chỉ ở mức lý thuyết khá nhiều , ít thực hành","nội dung của môn học hiện tại ","Course information","chỉ ở mức lý thuyết khá nhiều , ít thực hành","Negative"
"26","thầy dạy rất hay và cuốn hút .","thầy dạy rất hay và cuốn hút","thầy dạy","Teaching quality","rất hay và cuốn hút","Positive"
"27","thầy dạy kỹ , tận tâm , vui tính .","thầy dạy kỹ , tận tâm","thầy dạy","Teaching quality","kỹ , tận tâm","Positive"
"27","thầy dạy kỹ , tận tâm , vui tính ."," vui tính","vui tính","General review","vui tính","Positive"
"28","bài tập nên thiết thực .","bài tập nên thiết thực","bài tập ","Test and evaluation","nên thiết thực","Negative"
"29","giảng viên vui tính , hay liên hệ với thực tế giúp cho sinh viên dễ nắm bắt vấn đề .","giảng viên vui tính","giảng viên ","General review","vui tính","Positive"
"29","giảng viên vui tính , hay liên hệ với thực tế giúp cho sinh viên dễ nắm bắt vấn đề ."," hay liên hệ với thực tế giúp cho sinh viên dễ nắm bắt vấn đề","hay liên hệ với thực tế","Teaching quality","giúp cho sinh viên dễ nắm bắt vấn đề","Positive"
"30","phương pháp giảng dạy hiệu quả , giúp sinh viên tiếp cận kiến thức mới linh hoạt , nhiệt tình tận tâm giải đáp , trả lời câu hỏi từ sinh viên .","phương pháp giảng dạy hiệu quả ","phương pháp giảng dạy","Teaching quality","hiệu quả","Positive"
"30","phương pháp giảng dạy hiệu quả , giúp sinh viên tiếp cận kiến thức mới linh hoạt , nhiệt tình tận tâm giải đáp , trả lời câu hỏi từ sinh viên .","giúp sinh viên tiếp cận kiến thức mới linh hoạt","giúp sinh viên tiếp cận kiến thức mới ","Support from lecturers","linh hoạt","Positive"
"30","phương pháp giảng dạy hiệu quả , giúp sinh viên tiếp cận kiến thức mới linh hoạt , nhiệt tình tận tâm giải đáp , trả lời câu hỏi từ sinh viên .","nhiệt tình tận tâm giải đáp , trả lời câu hỏi từ sinh viên","giải đáp , trả lời câu hỏi từ sinh viên","Support from lecturers","nhiệt tình tận tâm","Positive"
"31","dạy chậm kết hợp với bài tập , ví dụ .","dạy chậm kết hợp với bài tập , ví dụ ","dạy","Teaching quality","chậm kết hợp với bài tập , ví dụ","Neutral"
"32","thầy dạy rất chi tiết .","thầy dạy rất chi tiết","thầy dạy ","Teaching quality","rất chi tiết","Positive"
"33","thầy dạy rất dễ hiểu qua các ví dụ thực tế mà thầy demo trên lớp .","thầy dạy rất dễ hiểu qua các ví dụ thực tế mà thầy demo trên lớp","thầy dạy rất dễ hiểu qua các ví dụ thực tế","Teaching quality","rất dễ hiểu","Positive"
"34","phương pháp giảng dạy phù hợp , lôi cuốn vào bài học .","phương pháp giảng dạy phù hợp","phương pháp giảng dạy","Teaching quality"," phù hợp","Positive"
"34","phương pháp giảng dạy phù hợp , lôi cuốn vào bài học .","lôi cuốn vào bài học"," lôi cuốn ","Teaching quality","lôi cuốn","Positive"
"35","học được rất nhiều kiến thức từ thầy .","học được rất nhiều kiến thức từ thầy"," từ thầy","Teaching quality","học được rất nhiều kiến thức","Positive"
"36","thầy rất teen và cập nhật từ ngữ teen rất nhanh .","thầy rất teen và cập nhật từ ngữ teen rất nhanh","thầy","General review","rất teen và cập nhật từ ngữ teen rất nhanh","Positive"
"37","ít khi trình bày trọn vẹn .","ít khi trình bày trọn vẹn","trình bày","Teaching quality","ít khi trình bày trọn vẹn","Negative"
"38","máy chiếu rất mờ , ngồi học lớp 100 người những bạn ngồi cuối hoàn toàn không thấy slide .","máy chiếu rất mờ","máy chiếu","Learning environment","rất mờ","Negative"
"38","máy chiếu rất mờ , ngồi học lớp 100 người những bạn ngồi cuối hoàn toàn không thấy slide .","ngồi học lớp 100 người những bạn ngồi cuối hoàn toàn không thấy slide","ngồi học lớp 100 người những bạn ngồi cuối hoàn toàn không thấy slide","General review","hoàn toàn không thấy slide","Negative"
"39","thầy giảng có tâm huyết và thân thiện .","thầy giảng có tâm huyết","thầy giảng","Teaching quality","có tâm huyết","Positive"
"39","thầy giảng có tâm huyết và thân thiện ."," thân thiện","thân thiện","General review","thân thiện","Positive"
"40","giảng viên dạy rất tận tâm và giảng bài hay dễ hiểu .","giảng viên dạy rất tận tâm","giảng viên dạy","Teaching quality","rất tận tâm","Positive"
"40","giảng viên dạy rất tận tâm và giảng bài hay dễ hiểu ."," giảng bài hay dễ hiểu","giảng bài","Teaching quality","hay dễ hiểu","Positive"
"41","giảng viên rất giỏi .","giảng viên rất giỏi","giảng viên","General review","rất giỏi","Positive"
"42","giảng viên đến đúng giờ và luôn điểm danh sau đó khoảng 5 phút .","giảng viên đến đúng giờ ","đến đúng giờ","Organization and management","đúng giờ","Positive"
"42","giảng viên đến đúng giờ và luôn điểm danh sau đó khoảng 5 phút .","luôn điểm danh sau đó khoảng 5 phút ","điểm danh","Teaching quality","luôn điểm danh sau đó khoảng 5 phút","Neutral"
"43","giảng bài dễ hiểu .","giảng bài dễ hiểu","giảng bài","Teaching quality"," dễ hiểu","Positive"
"44","thầy nói to , rõ .","thầy nói to , rõ","thầy nói","Teaching quality","to , rõ","Positive"
"45","giáo viên cần tham khảo khung chương trình của khoa trước khi ra bài tập .","giáo viên cần tham khảo khung chương trình của khoa trước khi ra bài tập","giáo viên cần tham khảo khung chương trình của khoa trước khi ra bài tập","Teaching quality","giáo viên cần tham khảo ","Negative"
"46","quan tâm đến sinh viên rất nhiều , có bày nhiều trò chơi hỗ trợ giảng dạy .","quan tâm đến sinh viên rất nhiều","quan tâm đến sinh viên","Support from lecturers","rất nhiều","Positive"
"46","quan tâm đến sinh viên rất nhiều , có bày nhiều trò chơi hỗ trợ giảng dạy ."," có bày nhiều trò chơi hỗ trợ giảng dạy","có bày nhiều trò chơi hỗ trợ giảng dạy","Organization and management"," có bày nhiều trò chơi ","Positive"
"47","giảng viên có khả năng truyền đạt .","giảng viên có khả năng truyền đạt","giảng viên","Teaching quality","có khả năng truyền đạt","Positive"
"48","cô nên sắp xếp lịch làm việc chính xác hơn .","cô nên sắp xếp lịch làm việc chính xác hơn ","sắp xếp lịch làm việc","Organization and management","chính xác hơn","Neutral"
"49","phòng học số lượng sinh viên nhiều , nhưng chỉ có quạt trần , cần trang bị thêm máy lạnh .","phòng học số lượng sinh viên nhiều","số lượng sinh viên ","Learning environment","nhiều","Neutral"
"49","phòng học số lượng sinh viên nhiều , nhưng chỉ có quạt trần , cần trang bị thêm máy lạnh .","nhưng chỉ có quạt trần","chỉ có quạt trần","Learning environment","nhưng chỉ có","Negative"
"49","phòng học số lượng sinh viên nhiều , nhưng chỉ có quạt trần , cần trang bị thêm máy lạnh .","cần trang bị thêm máy lạnh"," cần trang bị thêm máy lạnh","Learning environment","cần","Neutral"
"50","thiết bị và dụng cụ thí nghiệm tại phòng lab còn nhiều hạn chê , hư hỏng nhiều , không đáp ứng được nội dung thực hành .","thiết bị và dụng cụ thí nghiệm tại phòng lab còn nhiều hạn chê","thiết bị và dụng cụ thí nghiệm tại phòng lab","Learning environment","còn nhiều hạn chê","Negative"
"50","thiết bị và dụng cụ thí nghiệm tại phòng lab còn nhiều hạn chê , hư hỏng nhiều , không đáp ứng được nội dung thực hành ."," hư hỏng nhiều","hư hỏng nhiều","General review","hư hỏng nhiều","Negative"
"50","thiết bị và dụng cụ thí nghiệm tại phòng lab còn nhiều hạn chê , hư hỏng nhiều , không đáp ứng được nội dung thực hành ."," không đáp ứng được nội dung thực hành","nội dung thực hành","Organization and management"," không đáp ứng được","Negative"
"51","em mong thầy sẽ chỉ bảo cho các lớp sau nhiều hơn về vấn đề này .","em mong thầy sẽ chỉ bảo cho các lớp sau nhiều hơn về vấn đề này","em mong thầy sẽ chỉ bảo cho các lớp sau nhiều hơn về vấn đề này","General review","em mong","Neutral"
"52","thầy giảng khó hiểu .","thầy giảng khó hiểu","thầy giảng","Teaching quality","khó hiểu","Negative"
"53","em nghĩ môn này rất khó , nên cần có cách học riêng .","em nghĩ môn này rất khó","môn này","Support from lecturers"," rất khó","Negative"
"53","em nghĩ môn này rất khó , nên cần có cách học riêng ."," nên cần có cách học riêng","cách học riêng","Organization and management","cần có ","Neutral"
"54","được làm seminar nên sinh viên nghiên cứu nhiều hơn .","được làm seminar nên sinh viên nghiên cứu nhiều hơn","được làm seminar","Course information"," sinh viên nghiên cứu nhiều hơn","Positive"
"55","thầy dạy khá hay và dễ hiểu , thầy vui tính , em rất hài lòng về môn học do thầy wzjwz116 dạy , em xin cảm ơn .","thầy dạy khá hay và dễ hiểu","thầy dạy","Teaching quality","khá hay và dễ hiểu","Positive"
"55","thầy dạy khá hay và dễ hiểu , thầy vui tính , em rất hài lòng về môn học do thầy wzjwz116 dạy , em xin cảm ơn ."," thầy vui tính","thầy","General review","vui tính","Positive"
"55","thầy dạy khá hay và dễ hiểu , thầy vui tính , em rất hài lòng về môn học do thầy wzjwz116 dạy , em xin cảm ơn .","em rất hài lòng về môn học do thầy wzjwz116 dạy","môn học do thầy wzjwz116 dạy","Teaching quality","em rất hài lòng","Positive"
"55","thầy dạy khá hay và dễ hiểu , thầy vui tính , em rất hài lòng về môn học do thầy wzjwz116 dạy , em xin cảm ơn ."," em xin cảm ơn","em xin cảm ơn","General review","em xin cảm ơn","Positive"
"56","cô giảng lý thuyết còn quá chi là khó hiểu ạ .","cô giảng lý thuyết còn quá chi là khó hiểu ạ","cô giảng lý thuyết","Teaching quality","khó hiểu","Negative"
"57","có ví dụ và bài tập nhỏ hàng tuần để nắm vững kiến thức hơn .","có ví dụ và bài tập nhỏ hàng tuần để nắm vững kiến thức hơn","có ví dụ và bài tập nhỏ hàng tuần","Organization and management","nắm vững kiến thức hơn","Neutral"
"58","giảng viên giảng nhiệt tình .","giảng viên giảng nhiệt tình","giảng viên giảng","Teaching quality","nhiệt tình","Positive"
"59","đề thi cuối kỳ quá khó và cấu trúc đề quá kỳ lạ .","đề thi cuối kỳ quá khó và cấu trúc đề quá kỳ lạ","đề thi cuối kỳ","Test and evaluation","quá khó và cấu trúc đề quá kỳ lạ","Negative"
"60","bài học rất có ích .","bài học rất có ích","bài học ","Course information","rất có ích","Positive"
"61","giảng viên liên hệ nhiều đến thực tế .","giảng viên liên hệ nhiều đến thực tế ","giảng viên ","Teaching quality"," liên hệ nhiều đến thực tế ","Positive"
"62","giảng viên vui vẻ hòa đồng với sinh viên .","giảng viên vui vẻ hòa đồng với sinh viên","giảng viên","General review"," vui vẻ hòa đồng ","Positive"
"63","còn một vài chỗ cô dạy hơi khó hiểu nhưng cô không giải thích kỹ lắm .","còn một vài chỗ cô dạy hơi khó hiểu nhưng cô không giải thích kỹ lắm"," cô dạy","Teaching quality","khó hiểu nhưng cô không giải thích kỹ","Negative"
"64","thầy giảng chi tiết , có hướng dẫn thêm kiến thức phong phú .","thầy giảng chi tiết","thầy giảng","Teaching quality","chi tiết","Positive"
"64","thầy giảng chi tiết , có hướng dẫn thêm kiến thức phong phú ."," có hướng dẫn thêm kiến thức phong phú","hướng dẫn","Teaching quality","kiến thức phong phú","Positive"
"65","thầy dạy dễ hiểu , bài học hiệu quả , liên hệ thực tiễn .","thầy dạy dễ hiểu","thầy dạy","Teaching quality","dễ hiểu","Positive"
"65","thầy dạy dễ hiểu , bài học hiệu quả , liên hệ thực tiễn ."," bài học hiệu quả"," bài học","Course information","hiệu quả","Positive"
"65","thầy dạy dễ hiểu , bài học hiệu quả , liên hệ thực tiễn .","liên hệ thực tiễn","liên hệ ","Teaching quality","thực tiễn","Positive"
"66","chu đáo , nhiệt tình .","chu đáo , nhiệt tình","chu đáo , nhiệt tình","General review","chu đáo , nhiệt tình","Positive"
"67","trình bày rất chi tiết .","trình bày rất chi tiết","trình bày","Course information","rất chi tiết","Positive"
"68","thầy dạy hơi chậm , tạo cảm giác buồn ngủ .","thầy dạy hơi chậm , tạo cảm giác buồn ngủ","thầy dạy","Teaching quality","hơi chậm , tạo cảm giác buồn ngủ","Negative"
"69","không tạo được không khí vui vẻ trong lớp .","không tạo được không khí vui vẻ trong lớp","không khí vui vẻ trong lớp","Support from lecturers","không tạo được","Negative"
"70","giảng nhanh quá , nói quá nhanh , không giúp học sinh hiểu bài .","giảng nhanh quá","giảng","Teaching quality","nhanh quá","Negative"
"70","giảng nhanh quá , nói quá nhanh , không giúp học sinh hiểu bài .","nói quá nhanh","nói ","Teaching quality","quá nhanh","Negative"
"70","giảng nhanh quá , nói quá nhanh , không giúp học sinh hiểu bài ."," không giúp học sinh hiểu bài","học sinh hiểu bài","Teaching quality","không giúp ","Negative"
"71","có tâm huyết .","có tâm huyết","có tâm huyết","Teaching quality","tâm huyết","Positive"
"72","luôn sử dụng những ví dụ có tính thực tế .","luôn sử dụng những ví dụ có tính thực tế","sử dụng những ví dụ","Teaching quality","có tính thực tế","Positive"
"73","thầy khá là nhiệt tình trong khi giảng bài , khi sinh viên hỏi bài , giáo viên rất nhiệt tình .","thầy khá là nhiệt tình trong khi giảng bài"," trong khi giảng bài","Teaching quality","khá là nhiệt tình","Positive"
"73","thầy khá là nhiệt tình trong khi giảng bài , khi sinh viên hỏi bài , giáo viên rất nhiệt tình .","khi sinh viên hỏi bài , giáo viên rất nhiệt tình","sinh viên hỏi bài , giáo viên","Support from lecturers","rất nhiệt tình","Positive"
"74","nếu nghỉ nên thông báo với lớp sớm hơn .","nếu nghỉ nên thông báo với lớp sớm hơn","nếu nghỉ nên thông báo","Organization and management"," nên ","Neutral"
"75","em có thể sử dụng kiến thức đã học để vọc một số trang web , cách dạy và đồ án của thầy thực tế dù thầy có trí tưởng tượng hơi bị phong phú .","em có thể sử dụng kiến thức đã học để vọc một số trang web","sử dụng kiến thức đã học","Course information"," để vọc một số trang web","Positive"
"75","em có thể sử dụng kiến thức đã học để vọc một số trang web , cách dạy và đồ án của thầy thực tế dù thầy có trí tưởng tượng hơi bị phong phú .","cách dạy và đồ án của thầy thực tế","cách dạy và đồ án của thầy","Teaching quality","thực tế","Positive"
"75","em có thể sử dụng kiến thức đã học để vọc một số trang web , cách dạy và đồ án của thầy thực tế dù thầy có trí tưởng tượng hơi bị phong phú .","dù thầy có trí tưởng tượng hơi bị phong phú "," thầy ","General review","có trí tưởng tượng hơi bị phong phú","Neutral"
"76","nội dung thi khó đối với sinh viên không chuyên .","nội dung thi khó đối với sinh viên không chuyên","nội dung thi","Test and evaluation","khó","Negative"
"77","có thêm đồ án mang tính chất sáng tạo .","có thêm đồ án mang tính chất sáng tạo","có thêm đồ án mang tính chất sáng tạo","General review","có thêm đồ án","Positive"
"78","thực sự thầy sử dụng giời lên lớp chưa hiệu quả .","thực sự thầy sử dụng giời lên lớp chưa hiệu quả"," sử dụng giời lên lớp","Organization and management","chưa hiệu quả","Negative"
"79","giảng viên tận tâm với sinh viên .","giảng viên tận tâm với sinh viên","giảng viên","Teaching quality","tận tâm","Positive"
"80","sự nghiêm khắc của thầy trong công tác giảng dạy giúp sinh viên có thêm động lực học .","\nsự nghiêm khắc của thầy trong công tác giảng dạy giúp sinh viên có thêm động lực học","sự nghiêm khắc của thầy trong công tác giảng dạy","Support from lecturers","giúp sinh viên có thêm động lực học","Positive"
"81","thầy tuy nghiêm khắc nhưng đi với thầy cả một học kỳ mới biết thầy rất thương sinh viên và muốn tốt cho tui em .","thầy tuy nghiêm khắc","thầy","General review","nghiêm khắc","Negative"
