"id","Review","Sentence Component","aspect_text","aspect","sentiment_text","sentiment"
"1","chương trình của môn khá nặng ở những phần cuối , cần giảm tải một số phần để có hiệu quả trong việc tiếp thu .","chương trình của môn khá nặng ở những phần cuối","chương trình của môn","Course information","khá nặng ở những phần cuố","Negative"
"1","chương trình của môn khá nặng ở những phần cuối , cần giảm tải một số phần để có hiệu quả trong việc tiếp thu .","cần giảm tải một số phần để có hiệu quả trong việc tiếp thu","một số phần để có hiệu quả trong việc tiếp thu","Course information","cần giảm tải ","Neutral"
"2","dạy chỉ trong slide không bổ sung kiên thức hay giải bài tập .","dạy chỉ trong slide không bổ sung kiên thức hay giải bài tập","dạy ","Teaching quality","chỉ trong slide không bổ sung kiên thức hay giải bài tập","Negative"
"3","thầy giảng bài chưa cuốn hút , hấp dẫn , dễ làm sinh viên chán và buồn ngủ .","thầy giảng bài chưa cuốn hút , hấp dẫn , dễ làm sinh viên chán và buồn ngủ","giảng bài","Teaching quality","chưa cuốn hút , hấp dẫn , dễ làm sinh viên chán và buồn ngủ","Negative"
"4","giảng viên thân thiện , hoà đồng , tận tình với sinh viên .","giảng viên thân thiện , hoà đồng , tận tình với sinh viên","giảng viên thân thiện , hoà đồng , tận tình với sinh viên","Support from lecturers","thân thiện , hoà đồng , tận tình với sinh viên","Positive"
"5","thầy giảng bài rất hay .","thầy giảng bài rất hay","giảng bài","Teaching quality","rất hay","Positive"
"6","em nghĩ cần có những giải pháp đặc biệt giúp những sinh viên dưới tỉnh lên thành phố học tập tốt anh văn .","em nghĩ cần có những giải pháp đặc biệt giúp những sinh viên dưới tỉnh lên thành phố học tập tốt anh văn","những giải pháp đặc biệt giúp những sinh viên dưới tỉnh lên thành phố học tập tốt anh văn","Support from lecturers","em nghĩ cần có","Neutral"
"7","cô nên làm các bài tập mẫu nhiều hơn .","cô nên làm các bài tập mẫu nhiều hơn","cô nên làm các bài tập mẫu","Support from lecturers"," nhiều hơn","Positive"
"8","thầy dạy đúng bài .","thầy dạy đúng bài","dạy","Teaching quality","đúng bài","Positive"
"9","thầy hiển dễ chịu , thoải mái , vui tính .","thầy hiển dễ chịu , thoải mái , vui tính","thầy hiển dễ chịu , thoải mái , vui tính","Teaching quality"," dễ chịu , thoải mái , vui tính","Positive"
"10","giảng viên dạy dễ hiểu , gây thiện cảm .","giảng viên dạy dễ hiểu , gây thiện cảm","dạy","Teaching quality","dễ hiểu , gây thiện cảm","Positive"
"11","thầy hiền và nhiệt tình .","thầy hiền và nhiệt tình","thầy hiền và nhiệt tình","Teaching quality","hiền và nhiệt tình","Positive"
"12","thời gian kết thúc buổi học là 10h30 nhưng cô vẫn tận tâm bỏ ra 30 phút để dạy thêm .","thời gian kết thúc buổi học là 10h30 nhưng cô vẫn tận tâm bỏ ra 30 phút để dạy thêm","thời gian kết thúc buổi học là 10h30","Organization and management"," nhưng cô vẫn tận tâm bỏ ra 30 phút để dạy thêm","Positive"
"13","thầy dạy rất nhiệt tình , hay , hấp dẫn , lôi cuốn .","thầy dạy rất nhiệt tình , hay , hấp dẫn , lôi cuốn"," dạy ","Teaching quality","rất nhiệt tình , hay , hấp dẫn , lôi cuốn","Positive"
"14","giảng viên giảng bài hơi khó hiểu .","giảng viên giảng bài hơi khó hiểu"," giảng bài ","Teaching quality"," hơi khó hiểu","Negative"
"15","cô dạy liên hệ thực tế .","cô dạy liên hệ thực tế","dạy ","Teaching quality","liên hệ thực tế","Positive"
"16","thầy đi trễ rất nhiều lần .","thầy đi trễ rất nhiều lần","thầy đi trễ","Organization and management"," rất nhiều lần","Negative"
"17","các phòng lab cần có wifi đủ mạnh để phục vụ tốt cho quá trình thực hành .","các phòng lab cần có wifi đủ mạnh để phục vụ tốt cho quá trình thực hành","các phòng lab","Learning environment","cần có","Neutral"
"18","cần phòng học và thiết bị tốt hơn .","cần phòng học và thiết bị tốt hơn","phòng học và thiết bị","Learning environment","cần","Neutral"
"19","bài tập còn hơi ít .","bài tập còn hơi ít","bài tập ","Workload"," còn hơi ít","Negative"
"20","thường cho nghỉ .","thường cho nghỉ","cho nghỉ","Organization and management","thường cho nghỉ","Negative"
"21","truyền đạt chính xác cho sinh viên những kiến thức cần thiết của môn học .","truyền đạt chính xác cho sinh viên những kiến thức cần thiết của môn học","truyền đạt ","Teaching quality","chính xác cho sinh viên những kiến thức cần thiết của môn học","Positive"
"22","giảng viên tận tâm nhiệt tình và khả năng truyền đạt tốt .","giảng viên tận tâm nhiệt tình","giảng viên tận tâm nhiệt tình","Support from lecturers"," tận tâm nhiệt tình","Positive"
"22","giảng viên tận tâm nhiệt tình và khả năng truyền đạt tốt .","khả năng truyền đạt tốt"," khả năng truyền đạt","Teaching quality"," tốt","Positive"
"23","bài tập cụ thể .","bài tập cụ thể","bài tập","Test and evaluation","cụ thể","Positive"
"24","thầy dạy nhiệt tình , giảng dễ hiểu .","thầy dạy nhiệt tình","dạy","Teaching quality"," nhiệt tình","Positive"
"24","thầy dạy nhiệt tình , giảng dễ hiểu ."," giảng dễ hiểu","giảng","Teaching quality"," dễ hiểu","Positive"
"25","thường xuyên bảo trì nâng cấp các chương trình máy tính .","thường xuyên bảo trì nâng cấp các chương trình máy tính","các chương trình máy tính","Learning environment","thường xuyên bảo trì nâng cấp ","Positive"
"26","phương pháp giảng dạy hiệu quả , giải đáp thắc mắc tận tình cụ thể .","phương pháp giảng dạy hiệu quả","phương pháp giảng dạy","Teaching quality","hiệu quả","Positive"
"26","phương pháp giảng dạy hiệu quả , giải đáp thắc mắc tận tình cụ thể .","giải đáp thắc mắc tận tình cụ thể","giải đáp thắc mắc","Support from lecturers","tận tình cụ thể","Positive"
"27","cách dạy kỳ quặc , khó hiểu .","cách dạy kỳ quặc , khó hiểu","cách dạy ","Teaching quality"," kỳ quặc , khó hiểu","Negative"
"28","giảng viên rất nhiệt tình , hướng dẫn tận tâm cho sinh viên .","giảng viên rất nhiệt tình ","giảng viên rất nhiệt tình","Support from lecturers","rất nhiệt tình","Positive"
"28","giảng viên rất nhiệt tình , hướng dẫn tận tâm cho sinh viên ."," hướng dẫn tận tâm cho sinh viên"," hướng dẫn tận tâm cho sinh viê","Support from lecturers","tận tâm","Positive"
"29","không thực hành .","không thực hành","thực hành","Course information","không thực hành","Negative"
"30","một số nội dung giảng viên lướt qua khá nhanh .","một số nội dung giảng viên lướt qua khá nhanh","một số nội dung ","Teaching quality","lướt qua khá nhanh","Negative"
"31","giảng viên dạy rất vui tính .","giảng viên dạy rất vui tính","dạy","Teaching quality","rất vui tính","Positive"
"32","giáo viên dạy tận tình , dễ hiểu , truyền đạt phương pháp học cũng như cách giải quyết bài toán đến học sinh rất kỹ .","giáo viên dạy tận tình , dễ hiểu","dạy","Teaching quality","tận tình , dễ hiểu","Positive"
"32","giáo viên dạy tận tình , dễ hiểu , truyền đạt phương pháp học cũng như cách giải quyết bài toán đến học sinh rất kỹ .","truyền đạt phương pháp học cũng như cách giải quyết bài toán đến học sinh rất kỹ","truyền đạt phương pháp học cũng như cách giải quyết bài toán ","Teaching quality","rất kỹ","Positive"
"33","tích cực trong giảng dạy .","tích cực trong giảng dạy","giảng dạy","Teaching quality","tích cực","Positive"
"34","giảng viên nhiệt tình , hay sửa lỗi cho sinh viên .","giảng viên nhiệt tình","giảng viên nhiệt tình","Support from lecturers","nhiệt tình","Positive"
"34","giảng viên nhiệt tình , hay sửa lỗi cho sinh viên ."," hay sửa lỗi cho sinh viên "," sửa lỗi cho sinh viên ","Support from lecturers"," hay sửa lỗi ","Positive"
"35","giáo viên nghỉ quá nhiều , việc học bù cũng phức tạp , vì trùng giờ với lớp học bù khác , cần giảng dạy đầy đủ hơn .","giáo viên nghỉ quá nhiều","giáo viên nghỉ","Organization and management"," quá nhiều","Negative"
"35","giáo viên nghỉ quá nhiều , việc học bù cũng phức tạp , vì trùng giờ với lớp học bù khác , cần giảng dạy đầy đủ hơn .","việc học bù cũng phức tạp , vì trùng giờ với lớp học bù khác","việc học bù ","Organization and management","cũng phức tạp , vì trùng giờ với lớp học bù khác","Negative"
"35","giáo viên nghỉ quá nhiều , việc học bù cũng phức tạp , vì trùng giờ với lớp học bù khác , cần giảng dạy đầy đủ hơn .","cần giảng dạy đầy đủ hơn","giảng dạy","Teaching quality","cần","Neutral"
"36","tài liệu tham khảo đầy đủ .","tài liệu tham khảo đầy đủ","tài liệu tham khảo","Course information"," đầy đủ","Positive"
"37","nâng cao kỹ năng nghe .","nâng cao kỹ năng nghe","kỹ năng nghe","Course information","nâng cao","Neutral"
"38","nội dung truyền đạt của giảng viên hơi dài dòng , lan man .","nội dung truyền đạt của giảng viên hơi dài dòng , lan man","nội dung truyền đạt ","Teaching quality"," hơi dài dòng , lan man","Negative"
"39","nên giảm thời lượng môn học còn 7 tuần và tăng thời gian mỗi buổi học lên 4 tiết .","nên giảm thời lượng môn học còn 7 tuần","thời lượng môn học","Organization and management","nên giảm","Neutral"
"39","nên giảm thời lượng môn học còn 7 tuần và tăng thời gian mỗi buổi học lên 4 tiết ."," tăng thời gian mỗi buổi học lên 4 tiết","thời gian mỗi buổi học","Organization and management","ăng thời gian mỗi buổi học","Positive"
"40","giảng viên chưa chuẩn bị đủ kiến thức cũng như giáo trình .","giảng viên chưa chuẩn bị đủ kiến thức cũng như giáo trình","giảng viên chưa chuẩn bị đủ kiến thức cũng như giáo trình","Teaching quality"," chưa chuẩn bị đủ kiến thức cũng như giáo trình","Negative"
"41","truyền dạt tốt .","truyền dạt tốt","truyền dạt","Teaching quality","tốt","Positive"
"42","mà chủ yếu tập trung vào phần quản lý thao tác đã được học trong môn hệ quản trị cơ sỡ dữ liệu trong khi đó theo đề cương môn học chỉ dạy một buổi , mà giảng viên dạy nhiều buổi .","mà chủ yếu tập trung vào phần quản lý thao tác đã được học trong môn hệ quản trị cơ sỡ dữ liệu trong khi đó theo đề cương môn học chỉ dạy một buổi , mà giảng viên dạy nhiều buổi","chủ yếu tập trung vào phần quản lý thao tác đã được học trong môn hệ quản trị cơ sỡ dữ liệu trong khi đó theo đề cương môn học chỉ dạy một buổi","Organization and management","mà giảng viên dạy nhiều buổi","Negative"
"43","ví dụ doubledot lý thuyết chưa học mà đã cho thực hành .","ví dụ doubledot lý thuyết chưa học mà đã cho thực hành","lý thuyết chưa học mà đã cho thực hành","Course information","lý thuyết chưa học mà đã cho thực hành","Negative"
"44","nên không gây quá nhiều áp lực .","nên không gây quá nhiều áp lực","gây quá nhiều áp lực","Teaching quality","nên không gây quá nhiều áp lực","Negative"
"45","không cho thời gian báo cáo rõ ràng .","không cho thời gian báo cáo rõ ràng"," thời gian báo cáo rõ ràn","Test and evaluation","không cho","Negative"
"46","giảng bài cảm thấy rất buồn ngủ .","giảng bài cảm thấy rất buồn ngủ","giảng bài ","Teaching quality","cảm thấy rất buồn ngủ","Negative"
"47","dạy rất hay và nhiệt tình .","dạy rất hay và nhiệt tình ","dạy","Teaching quality","rất hay và nhiệt tình ","Positive"
"48","dạy từ từ , chi tiết .","dạy từ từ , chi tiết","dạy","Teaching quality","từ từ , chi tiết","Positive"
"49","về giảng dạy .","về giảng dạy","giảng dạy","Teaching quality","về giảng dạy","Neutral"
"50","thầy quá bận .","thầy quá bận","thầy quá bận","Support from lecturers","quá bận","Negative"
"51","có nhiều bài tập giúp sinh viên thực hành nhiều từ đó nắm được kiến thức môn học .","có nhiều bài tập giúp sinh viên thực hành nhiều từ đó nắm được kiến thức môn học","có nhiều bài tập","Workload","giúp sinh viên thực hành nhiều từ đó nắm được kiến thức môn học","Positive"
"52","thiết nghĩ , nên chia thời gian học ra thành 2 buổi , mỗi buổi 2 tiết !","thiết nghĩ , nên chia thời gian học ra thành 2 buổi , mỗi buổi 2 tiết ","chia thời gian học","Organization and management"," nên","Neutral"
"53","cách truyền đạt không gây hứng thú .","cách truyền đạt không gây hứng thú","cách truyền đạt","Teaching quality","không gây hứng thú","Negative"
"54","chương trình hơi nhanh so với lý thuyết .","chương trình hơi nhanh so với lý thuyết","chương trình","Course information","hơi nhanh so với lý thuyết","Negative"
"55","buổi học trước buổi cuối cùng cô wzjwz132 nói buổi sau đi học nhưng bạn nào không đi cũng được vì không có điểm danh nhưng sau đó thì không có người dạy và cũng không thông báo nghỉ .","buổi học trước buổi cuối cùng cô wzjwz132 nói buổi sau đi học nhưng bạn nào không đi cũng được vì không có điểm danh nhưng sau đó thì không có người dạy và cũng không thông báo nghỉ","buổi học trước buổi cuối cùng cô wzjwz132 nói buổi sau đi học nhưng bạn nào không đi cũng được vì không có điểm danh","Organization and management","nhưng sau đó thì không có người dạy và cũng không thông báo nghỉ","Negative"
"56","giáo viên vẫn nhiệt tình mặc dù có một số thành phần không lắng nghe .","giáo viên vẫn nhiệt tình mặc dù có một số thành phần không lắng nghe","giáo viên vẫn nhiệt tình mặc dù có một số thành phần không lắng nghe","Teaching quality","vẫn nhiệt tình mặc dù có một số thành phần không lắng nghe","Positive"
"57","các bài thực hành thường rất khó , quá tầm hiện tại của các sinh viên , dẫn đến các sinh viên thường nản chí và hầu như bỏ đi 20% số điểm của môn thực hành !","các bài thực hành thường rất khó , quá tầm hiện tại của các sinh viên","các bài thực hành ","Course information","thường rất khó , quá tầm hiện tại của các sinh viên","Negative"
"57","các bài thực hành thường rất khó , quá tầm hiện tại của các sinh viên , dẫn đến các sinh viên thường nản chí và hầu như bỏ đi 20% số điểm của môn thực hành !"," dẫn đến các sinh viên thường nản chí và hầu như bỏ đi 20% số điểm của môn thực hành"," môn thực hành","Course information","các sinh viên thường nản chí và hầu như bỏ đi 20% số điểm của môn thực hành","Negative"
"58","giảng viên nhiệt tình , thân thiện , vui tính .","giảng viên nhiệt tình , thân thiện , vui tính","giảng viên nhiệt tình , thân thiện , vui tính","Teaching quality"," nhiệt tình , thân thiện , vui tính","Positive"
"59","hệ thống máy chiếu cần cải thiện .","hệ thống máy chiếu cần cải thiện","hệ thống máy chiếu","Learning environment"," cần cải thiện","Positive"
"60","thầy là người vui tính , tổng hợp kiến thức rất khoa học .","thầy là người vui tính","thầy là người vui tính","Teaching quality","vui tính","Positive"
"60","thầy là người vui tính , tổng hợp kiến thức rất khoa học ."," tổng hợp kiến thức rất khoa học ","tổng hợp kiến thức","Teaching quality","rất khoa học","Positive"
"61","cách cộng điểm như vậy làm mất thời gian trong quá trình học .","cách cộng điểm như vậy làm mất thời gian trong quá trình học ","cách cộng điểm","Test and evaluation"," làm mất thời gian trong quá trình học ","Negative"
"62","các tiết học của cô rất sôi động và làm em rất hài lòng với khả năng giảng dạy của cô .","các tiết học của cô rất sôi động","các tiết học","Learning environment"," rất sôi động","Positive"
"62","các tiết học của cô rất sôi động và làm em rất hài lòng với khả năng giảng dạy của cô .","làm em rất hài lòng với khả năng giảng dạy của cô","khả năng giảng dạy","Teaching quality","rất hài lòng ","Positive"
"63","thầy nhiệt tình dạy giỏi , cung cấp tài liệu cho sinh viên đầy đủ dễ hiểu .","thầy nhiệt tình dạy giỏi","dạy","Teaching quality","nhiệt tình dạy giỏi","Positive"
"63","thầy nhiệt tình dạy giỏi , cung cấp tài liệu cho sinh viên đầy đủ dễ hiểu .","cung cấp tài liệu cho sinh viên đầy đủ dễ hiểu","cung cấp tài liệu","Course information","đầy đủ dễ hiểu","Positive"
"64","cần bài tập thêm vê nhà .","cần bài tập thêm vê nhà","bài tập thêm vê nhà","Workload","cần ","Neutral"
"65","giáo viên nhiệt tình , đi dạy đúng giờ .","giáo viên nhiệt tình","giáo viên nhiệt tình","Support from lecturers"," nhiệt tìn","Positive"
"65","giáo viên nhiệt tình , đi dạy đúng giờ ."," đi dạy đúng giờ","đi dạy đúng giờ","Organization and management"," đúng giờ","Positive"
"66","nội dung môn học cần mở rộng hơn .","nội dung môn học cần mở rộng hơn","nội dung môn học","Course information","cần mở rộng hơn","Neutral"
"67","bị chậm hoặc bị treo máy giữa chừng .","bị chậm hoặc bị treo máy giữa chừng","máy","Learning environment","bị chậm hoặc bị treo","Negative"
"68","cần có sự kết hợp để chương lý thuyết kịp với thực hành .","cần có sự kết hợp để chương lý thuyết kịp với thực hành","chương lý thuyết kịp với thực hành","Course information","cần có sự kết hợp","Neutral"
"69","hy vọng lần sau sinh viên không nhận được câu "" đâu có ai hỏi tôi đâu mà nói "" của giảng viên khi sinh viên nói là không biết đề thi là đề mở .","hy vọng lần sau sinh viên không nhận được câu "" đâu có ai hỏi tôi đâu mà nói "" của giảng viên khi sinh viên nói là không biết đề thi là đề mở","sinh viên không nhận được câu "" đâu có ai hỏi tôi đâu mà nói "" của giảng viên khi sinh viên nói là không biết đề thi là đề mở","Support from lecturers","hy vọng lần sau sinh viên không nhận được câu "" đâu có ai hỏi tôi đâu mà nói ""","Negative"
"70","phần học nội dung chương trình đào tạo của mỗi khoa quá thừa .","phần học nội dung chương trình đào tạo của mỗi khoa quá thừa","phần học nội dung chương trình đào tạo của mỗi khoa","Course information","quá thừa","Negative"
"71","cô dạy rất tuyệt .","cô dạy rất tuyệt","dạy","Teaching quality","rất tuyệt","Positive"
"72","thầy hài hước vui vẻ nhiệt tình .","thầy hài hước vui vẻ nhiệt tình","thầy hài hước vui vẻ nhiệt tình","Support from lecturers"," hài hước vui vẻ nhiệt tình","Positive"
"73","giảng viên truyền đạt hay .","giảng viên truyền đạt hay","truyền đạt","Teaching quality","hay","Positive"
"74","thầy nhiệt tình hướng dẫn từng sinh viên .","thầy nhiệt tình hướng dẫn từng sinh viên","hướng dẫn từng sinh viên","Teaching quality","nhiệt tình","Positive"
"75","không thích phương pháp dạy của thầy !","không thích phương pháp dạy của thầy","phương pháp dạy của thầy","Teaching quality","không thích","Negative"
"76","giảng viên thân thiện vui vẻ gần gũi với sinh viên .","giảng viên thân thiện vui vẻ gần gũi với sinh viên","giảng viên thân thiện vui vẻ gần gũi với sinh viên","Support from lecturers","thân thiện vui vẻ gần gũi với sinh viên","Positive"
"77","chấm điểm khó vì phải kết quả đúng mới chấm điểm , không chấm điểm từng bước .","chấm điểm khó vì phải kết quả đúng mới chấm điểm , không chấm điểm từng bước","chấm điểm","Test and evaluation"," khó vì phải kết quả đúng mới chấm điểm , không chấm điểm từng bước","Negative"
"78","thầy giảng dễ hiểu , gây sự tập trung , kiến thức rộng và bổ ích .","thầy giảng dễ hiểu , gây sự tập trung"," giảng","Teaching quality","dễ hiểu , gây sự tập trung","Positive"
"78","thầy giảng dễ hiểu , gây sự tập trung , kiến thức rộng và bổ ích ."," kiến thức rộng và bổ ích","kiến thức","Teaching quality","rộng và bổ ích","Positive"
"79","thầy rất hiền và nhiệt tình quan tâm giúp đỡ chúng em , nhất là trong giờ thực hành nên em rất quý thầy .","thầy rất hiền và nhiệt tình quan tâm giúp đỡ chúng em , nhất là trong giờ thực hành nên em rất quý thầy"," rất hiền và nhiệt tình quan tâm giúp đỡ chúng em","Support from lecturers","hiền và nhiệt tình ","Positive"
"80","thầy nên chuẩn bị bài trước khi lên lớp , và sử dụng giờ lên lớp hiệu quả , làm cho sao sinh viên hiểu được nội dung môn học .","thầy nên chuẩn bị bài trước khi lên lớp","chuẩn bị bài trước khi lên lớp","Teaching quality"," nên","Neutral"
"80","thầy nên chuẩn bị bài trước khi lên lớp , và sử dụng giờ lên lớp hiệu quả , làm cho sao sinh viên hiểu được nội dung môn học .","và sử dụng giờ lên lớp hiệu quả","sử dụng giờ lên lớp","Organization and management"," hiệu quả","Positive"
"80","thầy nên chuẩn bị bài trước khi lên lớp , và sử dụng giờ lên lớp hiệu quả , làm cho sao sinh viên hiểu được nội dung môn học .","làm cho sao sinh viên hiểu được nội dung môn học","nội dung môn học","Course information","làm cho sao sinh viên hiểu được","Neutral"
"81","thầy rất dễ chịu , giới thiệu về thực tế bên ngoài nhiều !","thầy rất dễ chịu","thầy rất dễ chịu","Teaching quality"," rất dễ chịu","Positive"
"81","thầy rất dễ chịu , giới thiệu về thực tế bên ngoài nhiều !","giới thiệu về thực tế bên ngoài nhiều","giới thiệu về thực tế bên ngoài ","Support from lecturers","nhiều","Positive"
"82","nhiệt tình , thoải mái .","nhiệt tình , thoải mái","nhiệt tình , thoải mái","Support from lecturers","nhiệt tình , thoải mái","Positive"
"83","có những cách giảng sinh động dễ hiểu .","có những cách giảng sinh động dễ hiểu"," những cách giảng","Teaching quality","sinh động dễ hiểu","Positive"
"84","chỉ dạy ngữ pháp , tiếng anh quan trọng phát âm và nói hơn .","chỉ dạy ngữ pháp , tiếng anh quan trọng phát âm và nói hơn","dạy","Teaching quality","chỉ dạy ngữ pháp","Negative"
"85","trong lớp thầy luôn tác động để lớp tự giác phát biểu nêu ý kiến .","trong lớp thầy luôn tác động để lớp tự giác phát biểu nêu ý kiến","thầy luôn tác động để lớp tự giác phát biểu nêu ý kiến","Support from lecturers"," luôn tác động","Positive"
"86","dạy nhiều kiến thức ngoài .","dạy nhiều kiến thức ngoài","dạy","Teaching quality","nhiều kiến thức ngoài","Positive"
