"id","Review","Sentence Component","aspect_text","aspect","sentiment_text","sentiment"
"87","danh sách lớp phân bổ không đều , số sinh viên nhiều hơn số máy trong phòng lab .","danh sách lớp phân bổ không đều","phân bổ","Organization and management","không đều","Negative"
"87","danh sách lớp phân bổ không đều , số sinh viên nhiều hơn số máy trong phòng lab .","số sinh viên nhiều hơn số máy trong phòng lab","số sinh viên nhiều hơn số máy trong phòng lab","Learning environment","số sinh viên nhiều hơn số máy trong phòng lab","Negative"
"88","vui nhộn .","vui nhộn","vui nhộn","General review","vui nhộn","Positive"
"89","tuy nhiên , số lượng nhiệm vụ nhiều quá .","tuy nhiên , số lượng nhiệm vụ nhiều quá","số lượng nhiệm vụ","Workload","nhiều quá","Negative"
"90","giảng kỹ hơn ở vấn đề chính của môn học .","giảng kỹ hơn ở vấn đề chính của môn học","giảng","Teaching quality","kỹ hơn ở vấn đề chính của môn học","Negative"
"91","giảng viên giảng dạy không quan tâm đến sinh viên , hiểu hay không !","giảng viên giảng dạy không quan tâm đến sinh viên , hiểu hay không","giảng dạy","Teaching quality"," không quan tâm đến sinh viên , hiểu hay không","Negative"
"92","khả năng truyền đạt không được hiệu quả .","khả năng truyền đạt không được hiệu quả","khả năng truyền đạt","Teaching quality","không được hiệu quả","Negative"
"93","không cho nhiều bài tập về phần mạch chẵn lẻ , mạch so sánh .","không cho nhiều bài tập về phần mạch chẵn lẻ , mạch so sánh"," bài tập","Workload","không cho nhiều","Negative"
"94","thầy dễ tính , nhiệt tình .","thầy dễ tính , nhiệt tình","thầy dễ tính , nhiệt tình","Support from lecturers","dễ tính , nhiệt tình","Positive"
"95","giảng viên dễ tính gần gũi với học sinh .","giảng viên dễ tính gần gũi với học sinh","giảng viên dễ tính gần gũi với học sinh","Support from lecturers","dễ tính gần gũi","Positive"
"96","thầy yêu cầu cao về đồ án , hơi chi tiết , mong thầy có thể nhẹ tay hơn với các em khóa sau .","thầy yêu cầu cao về đồ án , hơi chi tiết , mong thầy có thể nhẹ tay hơn với các em khóa sau","đồ án","Test and evaluation","yêu cầu cao về đồ án , hơi chi tiết , mong thầy có thể nhẹ tay hơn với các em khóa sau","Negative"
"97","chép phạt .","chép phạt","chép phạt","Learning environment","chép phạt","Negative"
"98","mong thầy vẫn giữa phong độ như thế ;) .","mong thầy vẫn giữa phong độ như thế","phong độ ","Teaching quality","mong","Neutral"
"99","sinh viên gửi mail nhưng có lẽ thầy "" bận "" nên không thấy thầy trả lời .","sinh viên gửi mail nhưng có lẽ thầy "" bận "" nên không thấy thầy trả lời","sinh viên gửi mail ","Support from lecturers","không thấy thầy trả lời","Negative"
"100","cách thầy wzjwz173 chấm điểm quá trình quá gắt .","cách thầy wzjwz173 chấm điểm quá trình quá gắt","chấm điểm quá trình","Workload","quá gắt","Negative"