"id","Review","Sentence Component","aspect_text","aspect","sentiment_text","sentiment"
"81","thầy tuy nghiêm khắc nhưng đi với thầy cả một học kỳ mới biết thầy rất thương sinh viên và muốn tốt cho tui em .","nhưng đi với thầy cả một học kỳ mới biết thầy rất thương sinh viên và muốn tốt cho tui em","thầy rất thương sinh viên và muốn tốt cho tui em","Support from lecturers","rất thương sinh viên và muốn tốt cho tui em","Positive"
"82","tổ chức các trò chơi để vận dụng các kiến thức vừa học .","tổ chức các trò chơi để vận dụng các kiến thức vừa học","tổ chức các trò chơi","Organization and management","vận dụng các kiến thức vừa học","Positive"
"83","em rất thích cách dạy của thầy vì nó bám sát thực tế .","em rất thích cách dạy của thầy vì nó bám sát thực tế ","cách dạy của thầy","Teaching quality","bám sát thực tế","Positive"
"84","cô dạy rất tận tâm và nhiệt huyết , tận tình chỉ bảo , dạy chậm và ôn lại kiến thức .","cô dạy rất tận tâm và nhiệt huyết","cô dạy","Teaching quality"," rất tận tâm và nhiệt huyết","Positive"
"84","cô dạy rất tận tâm và nhiệt huyết , tận tình chỉ bảo , dạy chậm và ôn lại kiến thức .","tận tình chỉ bảo","chỉ bảo","Teaching quality","tận tình","Positive"
"84","cô dạy rất tận tâm và nhiệt huyết , tận tình chỉ bảo , dạy chậm và ôn lại kiến thức .","dạy chậm và ôn lại kiến thức","dạy","Teaching quality","chậm và ôn lại kiến thức","Positive"
"85","cô truyền dạy kiến thức dễ hiểu , tận tình , thân thiện với học sinh và giúp đỡ học sinh tận tình !","cô truyền dạy kiến thức dễ hiểu , tận tình","cô truyền dạy kiến thức","Teaching quality","dễ hiểu , tận tình","Positive"
"85","cô truyền dạy kiến thức dễ hiểu , tận tình , thân thiện với học sinh và giúp đỡ học sinh tận tình !"," thân thiện với học sinh","thân thiện với học sinh","General review"," thân thiện","Positive"
"85","cô truyền dạy kiến thức dễ hiểu , tận tình , thân thiện với học sinh và giúp đỡ học sinh tận tình !","giúp đỡ học sinh tận tình","giúp đỡ học sinh","Support from lecturers","tận tình","Positive"
"86","thường đến lớp trễ .","thường đến lớp trễ","thường đến lớp trễ","Organization and management","trễ","Negative"
"87","lượng kiến thức thì đòi hỏi quá cao , đề thi cũng khó .","lượng kiến thức thì đòi hỏi quá cao","lượng kiến thức","Course information"," đòi hỏi quá cao","Negative"
"87","lượng kiến thức thì đòi hỏi quá cao , đề thi cũng khó ."," đề thi cũng khó","đề thi","Test and evaluation","khó","Negative"
"88","thầy dạy kiến thức khá đầy đủ và thường cho bài tập nâng cao bổ sung thêm những kiến thức mới cho học sinh .","thầy dạy kiến thức khá đầy đủ","thầy dạy kiến thức","Teaching quality"," khá đầy đủ","Positive"
"88","thầy dạy kiến thức khá đầy đủ và thường cho bài tập nâng cao bổ sung thêm những kiến thức mới cho học sinh .","thường cho bài tập nâng cao bổ sung thêm những kiến thức mới cho học sinh","thường cho bài tập nâng cao","Support from lecturers","bổ sung thêm những kiến thức mới cho học sinh","Neutral"
"89","quan tâm học sinh .","quan tâm học sinh ","quan tâm học sinh ","Support from lecturers","quan tâm ","Positive"
"90","giảng viên dạy toàn bộ bằng slide tiếng anh khiến sinh viên cảm thấy ngợp và khó hiểu được vấn đề cũng như hiểu được kỹ từng bài học .","giảng viên dạy toàn bộ bằng slide tiếng anh khiến sinh viên cảm thấy ngợp và khó hiểu được vấn đề","giảng viên dạy toàn bộ bằng slide tiếng anh","Teaching quality","ngợp và khó hiểu được vấn đề","Negative"
"90","giảng viên dạy toàn bộ bằng slide tiếng anh khiến sinh viên cảm thấy ngợp và khó hiểu được vấn đề cũng như hiểu được kỹ từng bài học ."," cũng như hiểu được kỹ từng bài học","hiểu được kỹ từng bài học","Course information","cũng như","Negative"
"91","cô rất nhiệt tình giảng dạy .","cô rất nhiệt tình giảng dạy","giảng dạy","Teaching quality"," rất nhiệt tình ","Positive"
"92","cô nên up một lần hết các file bài học để tụi em tiện đi in ạ .","cô nên up một lần hết các file bài học để tụi em tiện đi in ạ","các file bài học","Course information","nên up một lần hết","Neutral"
"93","sách giáo khoa wrede dan murray không dễ học , còn nhiều sai sót và các trình bày khó hiểu .","sách giáo khoa wrede dan murray không dễ học","sách giáo khoa wrede dan murray","Course information","không dễ học","Negative"
"93","sách giáo khoa wrede dan murray không dễ học , còn nhiều sai sót và các trình bày khó hiểu .","còn nhiều sai sót và các trình bày khó hiểu","còn nhiều sai sót và các trình bày khó hiểu","Course information","còn nhiều sai sót và các trình bày khó hiểu","Negative"
"94","cần nhiều tài liệu về môn học này .","cần nhiều tài liệu về môn học này","cần nhiều tài liệu về môn học này","General review","cần nhiều tài liệu","Neutral"
"95","cô wzjwz106 hay cho nghỉ .","cô wzjwz106 hay cho nghỉ","hay cho nghỉ","Organization and management","hay cho nghỉ","Neutral"
"96","giáo viên giảng dạy tốt nhiệt tình .","giáo viên giảng dạy tốt nhiệt tình","giáo viên giảng dạy","Teaching quality","tốt nhiệt tình","Positive"
"97","cần sửa thêm bài tập trên lớp .","cần sửa thêm bài tập trên lớp"," sửa thêm bài tập trên lớp","Organization and management","cần sửa thêm","Neutral"
"98","thầy dạy rất hay , tận tận tâm nhiệt tình , luôn tạo hứng thú cho sinh viên .","thầy dạy rất hay , tận tận tâm nhiệt tình , luôn tạo hứng thú cho sinh viên ","thầy dạy","Teaching quality","rất hay , tận tận tâm nhiệt tình , luôn tạo hứng thú cho sinh viên","Positive"
"99","ngoài copy và paste ra , giảng viên không hướng dẫn gì thêm .","ngoài copy và paste ra , giảng viên không hướng dẫn gì thêm","giảng viên","Teaching quality","không hướng dẫn gì thêm","Negative"
"100","nên thêm giờ học thực hành trên lớp nếu có thể .","nên thêm giờ học thực hành trên lớp nếu có thể","nên thêm giờ học thực hành trên lớp nếu có thể","General review","nếu có thể ","Neutral"