"id","Review","Sentence Component","aspect_text","aspect","sentiment_text","sentiment"
"69","dạy rất sát với giáo trình của trường đưa ra .","dạy rất sát với giáo trình của trường đưa ra","dạy","Teaching quality","rất sát","Positive"
"70","dạy theo phương pháp truyền thống , lối mòn , lặp khuông như dạy ngữ pháp , giải bài tập .","dạy theo phương pháp truyền thống , lối mòn , lặp khuông như dạy ngữ pháp , giải bài tập","dạy","Teaching quality","lối mòn","Negative"
"70","dạy theo phương pháp truyền thống , lối mòn , lặp khuông như dạy ngữ pháp , giải bài tập .","dạy theo phương pháp truyền thống , lối mòn , lặp khuông như dạy ngữ pháp , giải bài tập","dạy","Teaching quality","lặp khuông","Negative"
"71","giọng cô dễ nghe .","giọng cô dễ nghe","giọng cô","Support from lecturers","dễ nghe","Positive"
"72","nội dung giảng dạy của giảng viên còn sơ sài .","nội dung giảng dạy của giảng viên còn sơ sài","nội dung giảng dạy","Course information","sơ sài","Negative"
"73","tiếng anh .","tiếng anh","tiếng anh","General review","tiếng anh","Neutral"
"74","thiết bị về máy chiếu chưa được tốt , mong nhà trường tạo điều kiện .","thiết bị về máy chiếu chưa được tốt , mong nhà trường tạo điều kiện","thiết bị về máy chiếu","Learning environment","chưa được tốt","Negative"
"75","bài tập về nhà hơi khó .","bài tập về nhà hơi khó","bài tập về nhà","Workload","hơi khó","Negative"
"76","thầy quá tuyệt vời coloncontemn .","thầy quá tuyệt vời coloncontemn","thầy","Support from lecturers","quá tuyệt vời","Positive"
"77","giảng viên dạy rất kỹ , quan tâm đến sinh viên .","giảng viên dạy rất kỹ , quan tâm đến sinh viên","giảng viên","Support from lecturers","dạy rất kỹ","Positive"
"77","giảng viên dạy rất kỹ , quan tâm đến sinh viên .","giảng viên dạy rất kỹ , quan tâm đến sinh viên","giảng viên","Support from lecturers","quan tâm","Positive"
"78","cần cung cấp nhiều thông tin bài học hơn .","cần cung cấp nhiều thông tin bài học hơn","nhiều thông tin bài học","Course information","cần cung cấp","Positive"
"79","một số kiến thức chỉ được giới hạn trong khuôn khổ của môn học , cần phát huy thêm khả năng tìm tòi sáng tạo của sinh viên trong các định lý định nghĩa có sẵn .","một số kiến thức chỉ được giới hạn trong khuôn khổ của môn học , cần phát huy thêm khả năng tìm tòi sáng tạo của sinh viên trong các định lý định nghĩa có sẵn","khả năng tìm tòi sáng tạo","General review","cần phát huy","Positive"
"80","hệ thống chấm điểm wecode kém thông minh , thường hay chấm sai cho những kết quả tương đương với kết quả đúng , thường gặp nhiều lỗi ngớ ngẩn .","hệ thống chấm điểm wecode kém thông minh , thường hay chấm sai cho những kết quả tương đương với kết quả đúng , thường gặp nhiều lỗi ngớ ngẩn","hệ thống chấm điểm wecode","Course information","kém thông minh","Negative"
"81","giảng viên và trợ giảng đều rất nhiệt tình quan tâm đến học sinh .","giảng viên và trợ giảng đều rất nhiệt tình quan tâm đến học sinh","giảng viên và trợ giảng","Support from lecturers","đều rất nhiệt tình","Positive"
"82","cần nêu các công thức cơ bản khi dạy anh văn bổ túc .","cần nêu các công thức cơ bản khi dạy anh văn bổ túc","dạy anh văn bổ túc","Workload","cần nêu các công thức cơ bản","Positive"
"83","có nhiều kiến thức bổ ích cho sinh viên và rất tận tâm .","có nhiều kiến thức bổ ích cho sinh viên và rất tận tâm","có nhiều kiến thức","Course information","rất tận tâm","Positive"
"84","tập trung vào giải thích vài kiến thức cơ bản .","tập trung vào giải thích vài kiến thức cơ bản","giải thích","Support from lecturers","tập trung","Neutral"
"85","thầy rất tốt với học sinh .","thầy rất tốt với học sinh","thầy","Support from lecturers","rất tốt","Positive"
"86","tăng cường chất lượng wifi cho các phòng lab .","tăng cường chất lượng wifi cho các phòng lab","chất lượng wifi","Learning environment","tăng cường","Positive"
"87","em đã đi làm , em không phủ nhận những kiến kiến nền tảng trên trường đại học nhưng thực sự tụi em phải trải qua quá trình đào tạo rèn luyện lại để phù hợp với môi trường doanh nghiệp .","em đã đi làm , em không phủ nhận những kiến kiến nền tảng trên trường đại học nhưng thực sự tụi em phải trải qua quá trình đào tạo rèn luyện lại để phù hợp với môi trường doanh nghiệp","em đã đi làm , em không phủ nhận những kiến kiến nền tảng trên trường đại học nhưng thực sự tụi em phải trải qua quá trình đào tạo rèn luyện lại để phù hợp với môi trường doanh nghiệp","General review","thực sự","Neutral"
"88","nên có những giáo trình hướng dẫn giải bài tập nhiều hơn vì trong trường dường như chỉ có 1 , 2 loại giáo trình bao gồm cả lý thuyết và bài tập chứ không có giáo trình hướng dẫn giải bài tập .","nên có những giáo trình hướng dẫn giải bài tập nhiều hơn vì trong trường dường như chỉ có 1 , 2 loại giáo trình bao gồm cả lý thuyết và bài tập chứ không có giáo trình hướng dẫn giải bài tập","những giáo trình hướng dẫn giải bài tập","Course information","nên có","Positive"
"89","nên đơn giản hóa với các phần không quan trọng .","nên đơn giản hóa với các phần không quan trọng","phần không quan trọng","Course information","nên đơn giản hóa","Positive"
"90","đưa slide bài giảng còn thiếu nội dung .","đưa slide bài giảng còn thiếu nội dung","slide bài giảng","Course information","thiếu nội dung","Negative"
"91","giảng viên có việc bận cho nghỉ nhiều .","giảng viên có việc bận cho nghỉ nhiều","giảng viên","Support from lecturers","cho nghỉ nhiều","Negative"
"92","nên hơi choáng do tự học quá nhiều .","nên hơi choáng do tự học quá nhiều","tự học","Workload","hơi choáng","Negative"
"92","nên hơi choáng do tự học quá nhiều .","nên hơi choáng do tự học quá nhiều","tự học","Workload","quá nhiều","Negative"
"93","môn nhập môn quản trị doanh nghiệp thầy wzjwz111 dạy thường xuyên nghỉ học , lại không có thông báo trước .","môn nhập môn quản trị doanh nghiệp thầy wzjwz111 dạy thường xuyên nghỉ học , lại không có thông báo trước","môn nhập môn quản trị doanh nghiệp","Course information","thường xuyên nghỉ học","Negative"
"93","môn nhập môn quản trị doanh nghiệp thầy wzjwz111 dạy thường xuyên nghỉ học , lại không có thông báo trước .","môn nhập môn quản trị doanh nghiệp thầy wzjwz111 dạy thường xuyên nghỉ học , lại không có thông báo trước","môn nhập môn quản trị doanh nghiệp","Course information","không có thông báo trước","Negative"
"94","nói hơi nhanh .","nói hơi nhanh","nói","Support from lecturers","hơi nhanh","Negative"
"95","giải bài tập về nhà .","giải bài tập về nhà","bài tập về nhà","Workload","giải","Neutral"
"96","bài tập cô đảm bảo đủ và bám theo nội dung lý thuyết !","bài tập cô đảm bảo đủ và bám theo nội dung lý thuyết","bài tập","Workload","đảm bảo đủ","Positive"
"96","bài tập cô đảm bảo đủ và bám theo nội dung lý thuyết !","bài tập cô đảm bảo đủ và bám theo nội dung lý thuyết","bài tập","Workload","bám theo nội dung lý thuyết","Positive"
"97","giảng dạy hết mình .","giảng dạy hết mình","giảng dạy","Teaching quality","hết mình","Positive"
"98","sự tận tâm , nhiệt tình , đảm bảo thời gian và kiến thức cho sinh viên .","sự tận tâm , nhiệt tình , đảm bảo thời gian và kiến thức cho sinh viên","sự tận tâm , nhiệt tình , đảm bảo thời gian và kiến thức cho sinh viên","Support from lecturers","sự tận tâm","Positive"
"98","sự tận tâm , nhiệt tình , đảm bảo thời gian và kiến thức cho sinh viên .","sự tận tâm , nhiệt tình , đảm bảo thời gian và kiến thức cho sinh viên","sự tận tâm , nhiệt tình , đảm bảo thời gian và kiến thức cho sinh viên","Support from lecturers","nhiệt tình","Positive"
"98","sự tận tâm , nhiệt tình , đảm bảo thời gian và kiến thức cho sinh viên .","sự tận tâm , nhiệt tình , đảm bảo thời gian và kiến thức cho sinh viên","sự tận tâm , nhiệt tình , đảm bảo thời gian và kiến thức cho sinh viên","Support from lecturers","đảm bảo thời gian","Positive"
"99","thầy dạy hay , cho bài tập rất nhiều .","thầy dạy hay , cho bài tập rất nhiều","thầy","Support from lecturers","dạy hay","Positive"
"99","thầy dạy hay , cho bài tập rất nhiều .","thầy dạy hay , cho bài tập rất nhiều","thầy","Support from lecturers","rất nhiều","Positive"
"99","thầy dạy hay , cho bài tập rất nhiều .","thầy dạy hay , cho bài tập rất nhiều","cho bài tập","Workload","dạy hay","Positive"
"99","thầy dạy hay , cho bài tập rất nhiều .","thầy dạy hay , cho bài tập rất nhiều","cho bài tập","Workload","rất nhiều","Positive"
"100","giảng dạy chi tiết .","giảng dạy chi tiết","giảng dạy","Support from lecturers","chi tiết","Positive"