"id","Review","Sentence Component","aspect_text","aspect","sentiment_text","sentiment"
"1","giảng viên hơi khó , bài tập hơi nặng đối với những sinh viên không chuyên ngành .","giảng viên hơi khó","hơi khó","Support from lecturers","khó","Negative"
"1","giảng viên hơi khó , bài tập hơi nặng đối với những sinh viên không chuyên ngành .","bài tập hơi nặng đối với những sinh viên không chuyên ngành","bài tập","Workload","nặng ","Negative"
"2","cập nhật nhiều kiến thức mới .","cập nhật nhiều kiến thức mới","kiến thức","Course information","cập nhật nhiều","Positive"
"3","đề nghị nên lắp đặt thêm màn che ở các cửa sổ phòng học , để có thể xem rõ máy chiếu hơn .","đề nghị nên lắp đặt thêm màn che ở các cửa sổ phòng học , để có thể xem rõ máy chiếu hơn","màn che ở các cửa sổ phòng học","Learning environment","đề nghị nên lắp đặt","Neutral"
"4","giáo viên nên giảng bài có trọng tâm hơn .","giáo viên nên giảng bài có trọng tâm hơn","giảng bài","Teaching quality","trọng tâm hơn","Neutral"
"5","giảng dạy ngiêm túc .","giảng dạy ngiêm túc","giảng dạy","Teaching quality","ngiêm túc","Positive"
"6","thầy giải đáp các thắc mắc rất tường tận !","thầy giải đáp các thắc mắc rất tường tận","giải đáp","Support from lecturers","tường tận","Positive"
"7","phòng máy cũ , nhưng nhìn chung thì không có ảnh hưởng gì vì thầy dạy rất nhiệt tình .","phòng máy cũ","phòng máy","Learning environment","cũ","Neutral"
"7","phòng máy cũ , nhưng nhìn chung thì không có ảnh hưởng gì vì thầy dạy rất nhiệt tình .","nhưng nhìn chung thì không có ảnh hưởng gì vì thầy dạy rất nhiệt tình","dạy","Teaching quality","nhiệt tình","Positive"
"8","cô giảng dạy nhiệt tình , hết lòng , vững kiến thức , truyền đạt tốt , cách giảng dạy khá tốt .","cô giảng dạy nhiệt tình , hết lòng , vững kiến thức","giảng dạy","Teaching quality","nhiệt tình , hết lòng , vững kiến thức","Positive"
"8","cô giảng dạy nhiệt tình , hết lòng , vững kiến thức , truyền đạt tốt , cách giảng dạy khá tốt .","truyền đạt tốt","truyền đạt","Teaching quality","tốt","Positive"
"8","cô giảng dạy nhiệt tình , hết lòng , vững kiến thức , truyền đạt tốt , cách giảng dạy khá tốt .","cách giảng dạy khá tốt","cách giảng dạy","Teaching quality","khá tốt","Positive"
"9","cô rất tận tâm ạ !","cô rất tận tâm ạ","tận tâm","Support from lecturers","tận tâm","Positive"
"10","giảng viên ít dạy từ mới , cấu trúc ngữ pháp vdotv .","giảng viên ít dạy từ mới , cấu trúc ngữ pháp vdotv","dạy","Teaching quality","ít","Negative"
"11","tuy nhiên thường cung cấp bài tập trên lớp với thời gian hạn hẹp và chấm điểm thiếu công bằng .","tuy nhiên thường cung cấp bài tập trên lớp với thời gian hạn hẹp","bài tập","Workload","thời gian hạn hẹp","Negative"
"11","tuy nhiên thường cung cấp bài tập trên lớp với thời gian hạn hẹp và chấm điểm thiếu công bằng .","chấm điểm thiếu công bằng","chấm điểm","Test and evaluation","thiếu công bằng","Negative"
"12","giảng viên truyền đạt kinh nghiệm thực tế , đảm bảo giờ lên lớp .","giảng viên truyền đạt kinh nghiệm thực tế","truyền đạt","Teaching quality","thực tế","Positive"
"12","giảng viên truyền đạt kinh nghiệm thực tế , đảm bảo giờ lên lớp .","đảm bảo giờ lên lớp","giờ lên lớp","Organization and management","đảm bảo","Positive"
"13","dạy bằng tiếng anh , giao lưu vui vẻ .","dạy bằng tiếng anh","dạy","Teaching quality","bằng tiếng anh","Neutral"
"13","dạy bằng tiếng anh , giao lưu vui vẻ .","giao lưu vui vẻ","giao lưu","Support from lecturers","vui vẻ","Positive"
"14","thầy tận tâm , nhiệt tình , hòa đồng với học sinh .","thầy tận tâm , nhiệt tình , hòa đồng với học sinh","tận tâm , nhiệt tình , hòa đồng","Support from lecturers","tận tâm , nhiệt tình , hòa đồng","Positive"
"15","thầy giảng khá chậm rãi , mạch lạc , dễ tiếp thu nên có thể giải đáp được những khúc mắc của học sinh .","thầy giảng khá chậm rãi , mạch lạc , dễ tiếp thu","giảng","Teaching quality","chậm rãi , mạch lạc , dễ tiếp thu","Positive"
"15","thầy giảng khá chậm rãi , mạch lạc , dễ tiếp thu nên có thể giải đáp được những khúc mắc của học sinh .","nên có thể giải đáp được những khúc mắc của học sinh","giải đáp","Support from lecturers","giải đáp được","Positive"
"16","giáo viên cần thông báo đầy đủ các vấn đề sinh viên cần biết trên moodle , cung cấp các slide thực hành trước các buổi thực hành để sinh viên tìm hiểu trước .","giáo viên cần thông báo đầy đủ các vấn đề sinh viên cần biết trên moodle","thông báo","Organization and management","cần thông báo đầy đủ","Neutral"
"16","giáo viên cần thông báo đầy đủ các vấn đề sinh viên cần biết trên moodle , cung cấp các slide thực hành trước các buổi thực hành để sinh viên tìm hiểu trước .","cung cấp các slide thực hành trước các buổi thực hành để sinh viên tìm hiểu trước","slide thực hành","Course information","cung cấp","Neutral"
"17","cô dạy nhiệt tình dễ hiểu , sửa bài cẩn thận chi tiết .","cô dạy nhiệt tình dễ hiểu , sửa bài cẩn thận chi tiết","dạy","Teaching quality","nhiệt tình dễ hiểu , sửa bài cẩn thận chi tiết","Positive"
"18","môn khó hiểu quá , học xong chỉ hình dung một ít về môn học , thầy dạy còn chưa hiểu hết được môn học .","môn khó hiểu quá","môn","Course information","khó hiểu","Negative"
"18","môn khó hiểu quá , học xong chỉ hình dung một ít về môn học , thầy dạy còn chưa hiểu hết được môn học .","học xong chỉ hình dung một ít về môn học","môn học","Course information","chỉ hình dung một ít","Negative"
"18","môn khó hiểu quá , học xong chỉ hình dung một ít về môn học , thầy dạy còn chưa hiểu hết được môn học .","thầy dạy còn chưa hiểu hết được môn học","dạy","Teaching quality","chưa hiểu hết","Negative"
"19","phòng còn thiếu chất lượng , nhất là máy chiếu , máy chiếu gì mà mờ vàng không , làm giảm chất lượng slide trình chiếu , ảnh hưởng tới khả năng tiếp thu khi thầy wzjwz33 mô phỏng lý thuyết bằng hình ảnh .","phòng còn thiếu chất lượng , nhất là máy chiếu , máy chiếu gì mà mờ vàng không , làm giảm chất lượng slide trình chiếu , ảnh hưởng tới khả năng tiếp thu khi thầy wzjwz33 mô phỏng lý thuyết bằng hình ảnh","phòng còn thiếu chất lượng","Learning environment","thiếu chất lượng , nhất là máy chiếu , máy chiếu gì mà mờ vàng không , làm giảm chất lượng slide trình chiếu , ảnh hưởng tới khả năng tiếp thu","Negative"
"20","thầy giảng bài ít trong khi kiến thức rất nhiều , chủ yếu bảo sinh viên lên google tìm rồi học , bài tập thực hành không đồng nhất với bài học lý thuyết , toàn thực hành trước cả bài học .","thầy giảng bài ít trong khi kiến thức rất nhiều , chủ yếu bảo sinh viên lên google tìm rồi học","giảng bài","Teaching quality","ít trong khi kiến thức rất nhiều , chủ yếu bảo sinh viên lên google tìm rồi học","Negative"
"20","thầy giảng bài ít trong khi kiến thức rất nhiều , chủ yếu bảo sinh viên lên google tìm rồi học , bài tập thực hành không đồng nhất với bài học lý thuyết , toàn thực hành trước cả bài học .","bài tập thực hành không đồng nhất với bài học lý thuyết , toàn thực hành trước cả bài học","bài tập thực hành","Course information","không đồng nhất","Negative"
"21","giảng viên nhiệt tính tâm huyết .","giảng viên nhiệt tính tâm huyết","nhiệt tính tâm huyết","Support from lecturers","nhiệt tính tâm huyết","Positive"
"22","môn học chỉ có 2 tiết nên kiến thức vẫn chưa truyền đạt hết , thời gian phân bố môn học chưa hợp lý lắm sáng học 3 tiết rồi chiều học 2 tiết .","môn học chỉ có 2 tiết nên kiến thức vẫn chưa truyền đạt hết , thời gian phân bố môn học chưa hợp lý lắm sáng học 3 tiết rồi chiều học 2 tiết","môn học chỉ có 2 tiết","Organization and management","chỉ có 2 tiết nên kiến thức vẫn chưa truyền đạt hết , thời gian phân bố môn học chưa hợp lý","Negative"
"23","slide dễ hiểu , đầy đủ .","slide dễ hiểu , đầy đủ","slide","Course information","dễ hiểu , đầy đủ","Positive"
"24","sinh viên than phiền nhiều sau 3 tuần thì mới có giảng viên khác thay thế .","sinh viên than phiền nhiều sau 3 tuần thì mới có giảng viên khác thay thế","giảng viên khác thay thế","Organization and management","than phiền nhiều sau 3 tuần","Negative"
"25","cô dạy vui vẻ .","cô dạy vui vẻ","dạy","Teaching quality","vui vẻ","Positive"
"26","cần có thêm tài liệu tiếng việt vì nhiều khi không phải ai cũng giỏi tiếng anh để theo kịp slide tiếng anh .","cần có thêm tài liệu tiếng việt vì nhiều khi không phải ai cũng giỏi tiếng anh để theo kịp slide tiếng anh","tài liệu tiếng việt","Course information","cần có thêm","Neutral"
"27","chính vì đặc thù của môn học là như vậy , nên khi code thầy nên quay lại màn hình cho sinh viên về xem lại , thời gian code lâu , hơn nữa cho dù sinh viên hiểu code nhưng khó để hình dung các ký tự một cách chính xác .","chính vì đặc thù của môn học là như vậy , nên khi code thầy nên quay lại màn hình cho sinh viên về xem lại , thời gian code lâu , hơn nữa cho dù sinh viên hiểu code nhưng khó để hình dung các ký tự một cách chính xác","đặc thù của môn học","Teaching quality","nên khi code thầy nên quay lại màn hình cho sinh viên về xem lại , thời gian code lâu , hơn nữa cho dù sinh viên hiểu code nhưng khó để hình dung các ký tự một cách chính xác","Neutral"
"28","dạy nhiệt tình , dạy hết mình .","dạy nhiệt tình","dạy","Teaching quality","nhiệt tình","Positive"
"28","dạy nhiệt tình , dạy hết mình .","dạy hết mình","dạy","Teaching quality","hết mình","Positive"
"29","khả năng truyền đạt của giảng viên còn hạn chế .","khả năng truyền đạt của giảng viên còn hạn chế","khả năng truyền đạt","Teaching quality","còn hạn chế","Negative"
"30","luôn nhiệt tình , cập nhập những thông tin mới nhất cho sinh viên biết .","luôn nhiệt tình","luôn nhiệt tình","Support from lecturers","luôn nhiệt tình","Positive"
"30","luôn nhiệt tình , cập nhập những thông tin mới nhất cho sinh viên biết .","cập nhập những thông tin mới nhất cho sinh viên biết","cập nhập những thông tin","Support from lecturers","mới nhất","Positive"
"31","thầy rất tận tình và hiểu sinh viên .","thầy rất tận tình và hiểu sinh viên","tận tình và hiểu","Support from lecturers","tận tình và hiểu","Positive"
"32","giáo viên giảng dạy nhiệt tình , tận tâm , tạo điều kiện tốt nhất cho sinh viên , ân cần , chu đáo .","giáo viên giảng dạy nhiệt tình , tận tâm , tạo điều kiện tốt nhất cho sinh viên , ân cần , chu đáo","giảng dạy","Teaching quality","nhiệt tình , tận tâm , tạo điều kiện tốt nhất cho sinh viên , ân cần , chu đáo","Positive"
"33","thật kỳ là ở môn này các hệ cơ sở tri thức thuộc hệ thống thông tin và chuyên ngành khoa học máy tính gần như giống nhau về kiến thức giảng dạy , nhưng lại khác nhau về số chỉ .","thật kỳ là ở môn này các hệ cơ sở tri thức thuộc hệ thống thông tin và chuyên ngành khoa học máy tính gần như giống nhau về kiến thức giảng dạy , nhưng lại khác nhau về số chỉ","môn này các hệ cơ sở tri thức thuộc hệ thống thông tin và chuyên ngành khoa học máy tính","Course information","gần như giống nhau về kiến thức giảng dạy , nhưng lại khác nhau về số chỉ","Neutral"
"34","sự kiên nhẫn và tận tình giảng , chỉ lỗi sai cho sinh viên khi thực hành .","sự kiên nhẫn và tận tình giảng , chỉ lỗi sai cho sinh viên khi thực hành","sự kiên nhẫn và tận tình giảng , chỉ lỗi sai cho sinh viên khi thực hành","Support from lecturers","kiên nhẫn và tận tình giảng , chỉ lỗi sai","Positive"
"35","cô rất tận tình , và thận thiện , cô luôn giải đáp các thắc mắc cho sinh viên dễ hiểu .","cô rất tận tình , và thận thiện","tận tình , và thận thiện","Support from lecturers","tận tình , và thận thiện","Positive"
"35","cô rất tận tình , và thận thiện , cô luôn giải đáp các thắc mắc cho sinh viên dễ hiểu .","cô luôn giải đáp các thắc mắc cho sinh viên dễ hiểu","giải đáp","Support from lecturers","dễ hiểu","Positive"
"36","nếu có môn học nào trong học kỳ tiếp theo mà thầy giảng dạy được , mong phòng đào tạo điều kiện cho thầy tiếp tục hướng dẫn lần sau .","nếu có môn học nào trong học kỳ tiếp theo mà thầy giảng dạy được , mong phòng đào tạo điều kiện cho thầy tiếp tục hướng dẫn lần sau","nếu có môn học nào trong học kỳ tiếp theo mà thầy giảng dạy được , mong phòng đào tạo điều kiện cho thầy tiếp tục hướng dẫn lần sau","General review","mong phòng đào tạo điều kiện","Neutral"
"37","phương pháp dạy của thầy thực sự hiệu quả và cuốn hút .","phương pháp dạy của thầy thực sự hiệu quả và cuốn hút","phương pháp dạy","Teaching quality","hiệu quả và cuốn hút","Positive"
"38","thầy khá nhiệt huyết , vui vẻ , hệ thống kiến thức cho chúng em rõ ràng .","thầy khá nhiệt huyết , vui vẻ","nhiệt huyết , vui vẻ","Support from lecturers","nhiệt huyết , vui vẻ","Positive"
"38","thầy khá nhiệt huyết , vui vẻ , hệ thống kiến thức cho chúng em rõ ràng .","hệ thống kiến thức cho chúng em rõ ràng","hệ thống kiến thức","Teaching quality","rõ ràng","Positive"
"39","tích cực hỗ trợ sinh viên .","tích cực hỗ trợ sinh viên","hỗ trợ","Support from lecturers","tích cực","Positive"
"40","phòng lab khoa wzjwz143 quá nóng .","phòng lab khoa wzjwz143 quá nóng","phòng lab","Learning environment","quá nóng","Negative"
"41","phòng máy không đáp ứng tốt , gây khó khăn cho việc làm bài .","phòng máy không đáp ứng tốt , gây khó khăn cho việc làm bài","phòng máy","Learning environment","không đáp ứng tốt , gây khó khăn","Negative"
"42","dạy nhiệt tình , vui vẻ , dễ tiếp thu .","dạy nhiệt tình , vui vẻ , dễ tiếp thu","dạy","Teaching quality","nhiệt tình , vui vẻ , dễ tiếp thu","Positive"
"43","mong cô ở lâu với trường .","mong cô ở lâu với trường","mong cô ở lâu với trường","General review","mong cô ở lâu với trường","Positive"
"44","thay vì cho sinh viên thuyết trình tất cả nội dung môn học , giáo viên nên hướng dẫn nội dung môn học và cho sinh viên tìm hiểu và thuyết trình về những nội dung mới , không nằm trong khung học .","thay vì cho sinh viên thuyết trình tất cả nội dung môn học , giáo viên nên hướng dẫn nội dung môn học và cho sinh viên tìm hiểu và thuyết trình về những nội dung mới , không nằm trong khung học","thuyết trình","Test and evaluation","nên hướng dẫn nội dung môn học và cho sinh viên tìm hiểu và thuyết trình về những nội dung mới , không nằm trong khung học","Neutral"
"45","nên có thêm bài tập giải trực tiếp trên lớp .","nên có thêm bài tập giải trực tiếp trên lớp","bài tập giải trực tiếp","Workload","nên có thêm","Neutral"
"46","truyền đạt tốt .","truyền đạt tốt","truyền đạt","Teaching quality","tốt","Positive"
"47","thầy giảng bài rất thú vị , nhiệt tình .","thầy giảng bài rất thú vị , nhiệt tình","giảng bài","Teaching quality","thú vị , nhiệt tình","Positive"
"48","hoạt động cho mỗi nhóm lên thuyết trình về chủ đề đã được giao .","hoạt động cho mỗi nhóm lên thuyết trình về chủ đề đã được giao","hoạt động cho mỗi nhóm lên thuyết trình về chủ đề đã được giao","Organization and management","hoạt động cho mỗi nhóm lên thuyết trình về chủ đề đã được giao","Neutral"
"49","và giải đáp thắc mắc cho lớp em về code rất nhiệt tình .","và giải đáp thắc mắc cho lớp em về code rất nhiệt tình","giải đáp thắc mắc","Support from lecturers","nhiệt tình","Positive"
"50","thầy dạy vui , cảm ơn thầy nhiều .","thầy dạy vui","dạy","Teaching quality","vui","Positive"
"50","thầy dạy vui , cảm ơn thầy nhiều .","cảm ơn thầy nhiều","cảm ơn thầy nhiều","General review","cảm ơn thầy nhiều","Positive"
"51","thầy dạy hay , vui tính , thoải mái .","thầy dạy hay , vui tính , thoải mái","dạy","Teaching quality","hay , vui tính , thoải mái","Positive"
"52","cần mở thêm lớp thực hành .","cần mở thêm lớp thực hành","mở thêm lớp thực hành","Organization and management","cần","Neutral"
"53","kiến thức chuyên môn cao .","kiến thức chuyên môn cao","kiến thức chuyên môn","Teaching quality","cao","Positive"
"54","bài tập thầy nên sát với đề thi hơn .","bài tập thầy nên sát với đề thi hơn","bài tập thầy nên sát với đề thi hơn","Test and evaluation","nên","Neutral"
"55","tạo được kiến thức đầu đầy đủ cho sinh viên mới vào học bộ môn này .","tạo được kiến thức đầu đầy đủ cho sinh viên mới vào học bộ môn này","kiến thức","Teaching quality","tạo được kiến thức đầu đầy đủ","Positive"
"56","nghỉ giờ lên lớp quá nhiều .","nghỉ giờ lên lớp quá nhiều","giờ lên lớp","Organization and management","nghỉ giờ lên lớp quá nhiều","Negative"
"57","thiết bị để làm còn ít .","thiết bị để làm còn ít","thiết bị","Learning environment","ít","Negative"
"58","nói dễ nghe .","nói dễ nghe","nói","Teaching quality","dễ nghe","Positive"
"59","nên phần thi lý thuyết chúng em không thể nào đảm bảo thời gian để học bài nữa .","nên phần thi lý thuyết chúng em không thể nào đảm bảo thời gian để học bài nữa","phần thi lý thuyết","Test and evaluation","không thể nào đảm bảo thời gian để học","Negative"
"60","nên hạn chế chửi mắng sinh viên .","nên hạn chế chửi mắng sinh viên","chửi mắng sinh viên","Support from lecturers","nên hạn chế","Neutral"
"61","giảng dạy có tâm .","giảng dạy có tâm","giảng dạy","Teaching quality","có tâm","Positive"
"62","cô rất tận tâm , nhiệt tình .","cô rất tận tâm , nhiệt tình","tận tâm , nhiệt tình","Support from lecturers","tận tâm , nhiệt tình","Positive"
"63","sự tận tâm của giảng viên đối với sinh viên .","sự tận tâm của giảng viên đối với sinh viên","sự tận tâm của giảng viên đối với sinh viên","Support from lecturers","tận tâm","Positive"
"64","do giảng viên giảng bằng tiếng anh nên với một số bạn không học tốt anh văn như em thì để hiểu được bài giảng quả là một việc khó khăn .","do giảng viên giảng bằng tiếng anh nên với một số bạn không học tốt anh văn như em thì để hiểu được bài giảng quả là một việc khó khăn ","giảng","Course information","bằng tiếng anh nên với một số bạn không học tốt anh văn như em thì để hiểu được bài giảng quả là một việc khó khăn","Negative"
"65","cầu kỳ .","cầu kỳ","cầu kỳ","General review","cầu kỳ","Neutral"
"66","thầy hiền và dễ thương .","thầy hiền và dễ thương","hiền và dễ thương","Support from lecturers","hiền và dễ thương","Positive"
"67","nên có đề cương ghi thông tin rõ ràng hơn về các bài thực hành .","nên có đề cương ghi thông tin rõ ràng hơn về các bài thực hành","đề cương","Course information","nên có","Neutral"
"68","cô dạy quá tốt .","cô dạy quá tốt","dạy","Teaching quality","quá tốt","Positive"
"69","thầy dạy dễ hiểu , dễ tiếp thu , nhiệt tình với sinh viên , tâm huyết với bài giảng .","thầy dạy dễ hiểu , dễ tiếp thu , nhiệt tình với sinh viên , tâm huyết với bài giảng","dạy","Teaching quality","dễ hiểu , dễ tiếp thu , nhiệt tình với sinh viên , tâm huyết","Positive"
"70","tạo không khí vui vẻ khi giảng dạy .","tạo không khí vui vẻ khi giảng dạy","giảng dạy","Teaching quality","tạo không khí vui vẻ","Positive"
"71","hy vọng môn nào cũng như môn này thì quá tốt .","hy vọng môn nào cũng như môn này thì quá tốt","hy vọng môn nào cũng như môn này thì quá tốt","General review","hy vọng","Neutral"
"72","thầy rất tốt , có nhiều phương pháp dạy hay , mong thầy tiếp tục phát huy .","thầy rất tốt","thầy rất tốt","Teaching quality","tốt","Positive"
"72","thầy rất tốt , có nhiều phương pháp dạy hay , mong thầy tiếp tục phát huy .","có nhiều phương pháp dạy hay , mong thầy tiếp tục phát huy","phương pháp dạy","Teaching quality","hay , mong thầy tiếp tục phát huy","Positive"
"73","thầy dạy dễ hiểu , có cho làm bài tập .","thầy dạy dễ hiểu , có cho làm bài tập","dạy","Teaching quality","dễ hiểu , có cho làm bài tập","Positive"
"74","giọng nói khó nghe .","giọng nói khó nghe","giọng nói","Teaching quality","khó nghe","Negative"
"75","thầy không nên cho tụi em trốn học nhiều quá colonbigsmile .","thầy không nên cho tụi em trốn học nhiều quá colonbigsmile","trốn học","Organization and management","không nên cho tụi em trốn học","Negative"
"76","tránh giảng vòng vo và phớt lờ nội dung chính của bài học .","tránh giảng vòng vo và phớt lờ nội dung chính của bài học"," giảng","Teaching quality","vòng vo và phớt lờ","Negative"
"77","giảng viên nhiệt tình , thân thiện với sinh viên .","giảng viên nhiệt tình , thân thiện với sinh viên","nhiệt tình , thân thiện","Support from lecturers","nhiệt tình , thân thiện","Positive"
"78","nói tiếng anh rất hay , tận tình với học sinh .","nói tiếng anh rất hay","nói","Teaching quality","hay","Positive"
"78","nói tiếng anh rất hay , tận tình với học sinh .","tận tình với học sinh","tận tình","Support from lecturers","tận tình","Positive"
"79","khi lên lớp thầy chỉ đọc slide từ đầu tới cuối và thầy bảo tụi em chép vào .","khi lên lớp thầy chỉ đọc slide từ đầu tới cuối và thầy bảo tụi em chép vào","đọc slide","Teaching quality","chỉ đọc slide từ đầu tới cuối và thầy bảo tụi em chép vào","Negative"
"80","vật chất cần cải tiến .","vật chất cần cải tiến","vật chất","Learning environment","cần cải tiến","Neutral"
"81","môn học cần có một giáo án rõ ràng hoặc một giáo trình để sinh viên nắm rõ là mình đang học về cái gì .","môn học cần có một giáo án rõ ràng hoặc một giáo trình để sinh viên nắm rõ là mình đang học về cái gì","môn học","Course information","cần có một giáo án rõ ràng","Neutral"
