id,Review,Sentence Component,aspect_text,aspect,sentiment_text,sentiment
96,"giảng viên nên có bài sửa cho những bài thực hành được cho làm , hoặc giảng lại cách làm sau đó .","giảng viên nên có bài sửa cho những bài thực hành được cho làm , hoặc giảng lại cách làm sau đó","bài sửa cho những bài thực hành được cho làm , hoặc giảng lại cách làm sau đó",Teaching quality,nên có,Neutral
97,cần đảm bảo thời gian lên lớp .,cần đảm bảo thời gian lên lớp,thời gian lên lớp,Organization and management,cần đảm bảo,Neutral
98,kiến thức truyền đạt .,kiến thức truyền đạt,kiến thức truyền đạt,General review,kiến thức truyền đạt,Neutral
99,"giảng viên nói to rõ , nhiệt tình , tận tâm .","giảng viên nói to rõ , nhiệt tình , tận tâm",nói,Teaching quality,"to rõ , nhiệt tình , tận tâm",Positive
100,cần tăng thêm bài tập thực tế .,cần tăng thêm bài tập thực tế,bài tập thực tế,Workload,cần tăng thêm,Neutral