id,Review,Sentence Component,aspect_text,aspect,sentiment_text,sentiment
93,thầy hướng dẫn sinh viên cách tư duy để giải quyết vấn đề .,thầy hướng dẫn sinh viên cách tư duy để giải quyết vấn đề,hướng dẫn,Support from lecturers,tư duy để giải quyết vấn đề,Positive
94,"kiểm tra thì cực kỳ vô lý , phải làm những bài viết loàng ngoằng chẳng khác gì học sinh cấp 3 .","kiểm tra thì cực kỳ vô lý , phải làm những bài viết loàng ngoằng chẳng khác gì học sinh cấp 3",kiểm tra,Test and evaluation,"cực kỳ vô lý , phải làm những bài viết loàng ngoằng",Negative
95,sinh viên không hiểu lắm .,sinh viên không hiểu lắm,sinh viên không hiểu lắm,Teaching quality,không hiểu,Negative
96,"thầy không nhiệt tình trong cách dạy , cũng như hướng dẫn sinh viên thực hành .",thầy không nhiệt tình trong cách dạy,cách dạy,Teaching quality,không nhiệt tình,Negative
96,"thầy không nhiệt tình trong cách dạy , cũng như hướng dẫn sinh viên thực hành .","thầy không nhiệt tình trong cách dạy , cũng như hướng dẫn sinh viên thực hành",hướng dẫn sinh viên thực hành,Support from lecturers,không nhiệt tình,Negative
97,"học để giao tiếp nên chú trọng giao tiếp hơn , môn quá tập trung vào ngữ pháp và các bài nghe với level khó , trong khi tốc độ giao tiếp bình thường chậm hơn nhiều , thậm chí mình giao tiếp với người ngoại quốc còn thấy dễ nghe và dễ hiểu hơn nghe các file nghe trong bài học , điều này hoàn toàn không giúp sinh viên khá hơn .","học để giao tiếp nên chú trọng giao tiếp hơn , môn quá tập trung vào ngữ pháp và các bài nghe với level khó",chú trọng giao tiếp,Teaching quality,quá tập trung vào ngữ pháp và các bài nghe với level khó,Negative
97,"học để giao tiếp nên chú trọng giao tiếp hơn , môn quá tập trung vào ngữ pháp và các bài nghe với level khó , trong khi tốc độ giao tiếp bình thường chậm hơn nhiều , thậm chí mình giao tiếp với người ngoại quốc còn thấy dễ nghe và dễ hiểu hơn nghe các file nghe trong bài học , điều này hoàn toàn không giúp sinh viên khá hơn .","trong khi tốc độ giao tiếp bình thường chậm hơn nhiều , thậm chí mình giao tiếp với người ngoại quốc còn thấy dễ nghe và dễ hiểu hơn nghe các file nghe trong bài học , điều này hoàn toàn không giúp sinh viên khá hơn",file nghe trong bài học,Course information,"dễ nghe và dễ hiểu hơn nghe các file nghe trong bài học , điều này hoàn toàn không giúp sinh viên khá hơn",Negative
98,giảng viên nhiệt tình và tận tâm .,giảng viên nhiệt tình và tận tâm,nhiệt tình và tận tâm,Support from lecturers,nhiệt tình và tận tâm,Positive
99,"thầy giảng bài rất hay , là người rất tâm huyết và nhiệt tình .","thầy giảng bài rất hay , là người rất tâm huyết và nhiệt tình",giảng bài,Teaching quality,"rất hay , là người rất tâm huyết và nhiệt tình",Positive
100,"thầy tuy rất dễ , nhưng việc không điểm danh và tạo deadline cho các buổi thực hành sẽ gây ra ảnh hưởng tiêu cực nhiều hơn tích cực .","thầy tuy rất dễ , nhưng việc không điểm danh và tạo deadline cho các buổi thực hành sẽ gây ra ảnh hưởng tiêu cực nhiều hơn tích cực",không điểm danh và tạo deadline,Organization and management,ảnh hưởng tiêu cực,Negative
