id,Review,Sentence Component,aspect_text,aspect,sentiment_text,sentiment
80,"trên lớp lý thuyết giảng viên yêu cầu sinh viên phải thực hiện đồ án theo những gì mình hướng dẫn , những nhóm sinh viên bổ sung thêm những liên hệ thực tiễn đều bị cho là sai , không phù hợp với đồ án .",trên lớp lý thuyết giảng viên yêu cầu sinh viên phải thực hiện đồ án theo những gì mình hướng dẫn, lý thuyết giảng viên,Teaching quality,trên lớp lý thuyết giảng viên yêu cầu sinh viên phải thực hiện đồ án theo những gì mình hướng dẫn,Negative
80,"trên lớp lý thuyết giảng viên yêu cầu sinh viên phải thực hiện đồ án theo những gì mình hướng dẫn , những nhóm sinh viên bổ sung thêm những liên hệ thực tiễn đều bị cho là sai , không phù hợp với đồ án .","những nhóm sinh viên bổ sung thêm những liên hệ thực tiễn đều bị cho là sai , không phù hợp với đồ án","những nhóm sinh viên bổ sung thêm những liên hệ thực tiễn đều bị cho là sai , không phù hợp với đồ án",Test and evaluation,"những nhóm sinh viên bổ sung thêm những liên hệ thực tiễn đều bị cho là sai , không phù hợp với đồ án",Negative
81,thầy giảng bài hay và hiệu quả !,thầy giảng bài hay và hiệu quả,thầy giảng bài,Teaching quality,hay và hiệu quả,Positive
82,giảng viên nhiệt tình vui vẻ .,giảng viên nhiệt tình vui vẻ,giảng viên,Teaching quality,nhiệt tình vui vẻ,Positive
83,phòng học nên có rèm che sáng để khi chiếu slide được nhìn rõ hơn .,phòng học nên có rèm che sáng để khi chiếu slide được nhìn rõ hơn ,phòng học,Learning environment,nên có rèm che sáng để khi chiếu slide được nhìn rõ hơn,Neutral
84,"chương trình dạy lý thuyết và thực hành nên khớp với nhau hơn , tránh tình trạng thực hành trước khi học lý thuyết .","chương trình dạy lý thuyết và thực hành nên khớp với nhau hơn , tránh tình trạng thực hành trước khi học lý thuyết",chương trình dạy lý thuyết và thực hành,Course information," nên khớp với nhau hơn , tránh tình trạng thực hành trước khi học lý thuyết",Negative
85,"thầy giảng dạy nhiệt tình , dễ hiểu .","thầy giảng dạy nhiệt tình , dễ hiểu",thầy giảng dạy,Teaching quality,"nhiệt tình , dễ hiểu",Positive
86,mong giảng viên ngày càng chấn chỉnh việc dạy học để các khoá sau được hiểu tốt hơn .,mong giảng viên ngày càng chấn chỉnh việc dạy học để các khoá sau được hiểu tốt hơn,giảng viên,Teaching quality,mong giảng viên ngày càng chấn chỉnh việc dạy học để các khoá sau được hiểu tốt hơn,Negative
87,"thầy dạy rất có tâm , và giảng cho sinh viên rất nhiều thứ !",thầy dạy rất có tâm,thầy dạy,Teaching quality,rất có tâm,Positive
87,"thầy dạy rất có tâm , và giảng cho sinh viên rất nhiều thứ !",và giảng cho sinh viên rất nhiều thứ,giảng cho sinh viên,Teaching quality,rất nhiều thứ,Positive
88,"nội dung khảo sat quá dài , nhiều mục lặp đi lặp lại , nhiều bạn khảo sát mà không cần đọc , toàn tích chàn .",nội dung khảo sat quá dài ,nội dung khảo sat,Organization and management,quá dài,Negative
88,"nội dung khảo sat quá dài , nhiều mục lặp đi lặp lại , nhiều bạn khảo sát mà không cần đọc , toàn tích chàn .","nhiều mục lặp đi lặp lại , nhiều bạn khảo sát mà không cần đọc , toàn tích chàn","nhiều mục lặp đi lặp lại , nhiều bạn khảo sát",Organization and management,"nhiều mục lặp đi lặp lại , nhiều bạn khảo sát mà không cần đọc , toàn tích chàn",Negative
89,dạy tốt và rất nhiệt tình chỉ dạy hoc sinh .,dạy tốt và rất nhiệt tình chỉ dạy hoc sinh,dạy tốt và rất nhiệt tình chỉ dạy hoc sinh,Teaching quality,dạy tốt và rất nhiệt tình chỉ dạy hoc sinh,Positive
90,"nhiệt tình , tân tâm .","nhiệt tình , tân tâm","nhiệt tình , tân tâm",Teaching quality,"nhiệt tình , tân tâm",Positive
91,"nhưng học mới thấy kiến thức thầy dạy rất hay , bám sát thực tế , thầy dạy rất nhiệt tình , vui vẻ , khác với mọi người nói .","nhưng học mới thấy kiến thức thầy dạy rất hay , bám sát thực tế ", kiến thức thầy dạy,Teaching quality,"kiến thức thầy dạy rất hay , bám sát thực tế",Positive
91,"nhưng học mới thấy kiến thức thầy dạy rất hay , bám sát thực tế , thầy dạy rất nhiệt tình , vui vẻ , khác với mọi người nói .","thầy dạy rất nhiệt tình , vui vẻ , khác với mọi người nói",thầy dạy,Teaching quality,"rất nhiệt tình , vui vẻ , khác với mọi người nói",Positive
92,bài tập rất hay .,bài tập rất hay,bài tập,Course information,rất hay,Positive
93,thầy cô cần cho nhiều dạng bài tập sát với đề thi hơn .,thầy cô cần cho nhiều dạng bài tập sát với đề thi hơn,nhiều dạng bài tập,Course information,cần cho nhiều dạng bài tập sát với đề thi hơn,Neutral
94,"thầy giảng hay nhưng nên tự tin hơn , nói to hơn để học sinh hiểu bài một cách rõ ràng hơn .","thầy giảng hay nhưng nên tự tin hơn , nói to hơn để học sinh hiểu bài một cách rõ ràng hơn",thầy giảng,Teaching quality,"hay nhưng nên tự tin hơn , nói to hơn để học sinh hiểu bài một cách rõ ràng hơn",Positive
95,"mong thầy vui tính , gần gũi với sinh viên hơn .","mong thầy vui tính , gần gũi với sinh viên hơn", thầy,Teaching quality,"mong thầy vui tính , gần gũi với sinh viên hơn",Neutral
96,"giáo viên vui tính , hòa đồng , nhiệt tình .","giáo viên vui tính , hòa đồng , nhiệt tình",giáo viên,Teaching quality," vui tính , hòa đồng , nhiệt tình",Positive
97,cung cấp kiến thức trọng tâm .,cung cấp kiến thức trọng tâm,cung cấp kiến thức,Teaching quality,trọng tâm,Positive
98,cố gắng truyền đạt một cách tốt nhất để sinh viên được hiểu .,cố gắng truyền đạt một cách tốt nhất để sinh viên được hiểu,truyền đạt,Teaching quality,cố gắng truyền đạt một cách tốt nhất để sinh viên được hiểu,Positive
99,giọng của giảng viên nhỏ dù đã sử dụng micro .,giọng của giảng viên nhỏ dù đã sử dụng micro,giọng của giảng viên,Teaching quality,nhỏ,Negative
100,"dù phương pháp học tập này khá hiệu quả nhưng vẫn có chút nào đó nghi ngờ từ phần thuyết trình của các bạn , liệu các kiến thức đó có chuẩn xác và cập nhật chưa .","dù phương pháp học tập này khá hiệu quả nhưng vẫn có chút nào đó nghi ngờ từ phần thuyết trình của các bạn , liệu các kiến thức đó có chuẩn xác và cập nhật chưa","dù phương pháp học tập này khá hiệu quả nhưng vẫn có chút nào đó nghi ngờ từ phần thuyết trình của các bạn , liệu các kiến thức đó có chuẩn xác và cập nhật chưa",Teaching quality,"dù phương pháp học tập này khá hiệu quả nhưng vẫn có chút nào đó nghi ngờ từ phần thuyết trình của các bạn , liệu các kiến thức đó có chuẩn xác và cập nhật chưa",Neutral