id,Review,Sentence Component,aspect_text,aspect,sentiment_text,sentiment
73,"cả năm toàn học vòng lặp "" if "" "" for "" "" while "" đến bữa cuối mới lơ mơ học được struct với tạo file header mà ra đề 5 điểm trong phần đó .",bữa cuối mới lơ mơ học được struct với tạo file header mà ra đề 5 điểm trong phần đó,đề 5 điểm trong phần đó,Test and evaluation,bữa cuối mới lơ mơ học được struct với tạo file header mà ra đề 5 điểm trong phần đó,Negative
74,"gần gũi , thân thiện với sinh viên , khả năng truyền đạt kiến thức tốt .","gần gũi , thân thiện với sinh viên","gần gũi , thân thiện với sinh viên",Support from lecturers,"gần gũi , thân thiện",Positive
74,"gần gũi , thân thiện với sinh viên , khả năng truyền đạt kiến thức tốt .",khả năng truyền đạt kiến thức tốt,khả năng truyền đạt kiến thức,Teaching quality,tốt,Positive
75,quá dễ dẫn đến buồn ngủ .,quá dễ dẫn đến buồn ngủ,quá dễ dẫn đến buồn ngủ,Course information,quá dễ dẫn đến buồn ngủ,Negative
76,giảng viên không có tính hài hước .,giảng viên không có tính hài hước,giảng viên,Teaching quality,không có tính hài hước,Negative
77,"vui tính , nhiệt tình .","vui tính , nhiệt tình","vui tính , nhiệt tình",Support from lecturers,"vui tính , nhiệt tình",Positive
78,"thầy vui tính , giảng bài hay , đưa nhiều thông tin thực tế vào bài giảng .",thầy vui tính,thầy vui tính,Support from lecturers,vui tính,Positive
78,"thầy vui tính , giảng bài hay , đưa nhiều thông tin thực tế vào bài giảng .",giảng bài hay,giảng bài,Teaching quality,hay,Positive
78,"thầy vui tính , giảng bài hay , đưa nhiều thông tin thực tế vào bài giảng .",đưa nhiều thông tin thực tế vào bài giảng,bài giảng,Teaching quality,đưa nhiều thông tin thực tế,Positive
79,thẩy wzjwz311 rất vui và nhiệt tình .,thẩy wzjwz311 rất vui và nhiệt tình,thẩy wzjwz311 rất vui và nhiệt tình,Support from lecturers, rất vui và nhiệt tình,Positive
80,giáo viên giảng dạy lôi cuốn .,giáo viên giảng dạy lôi cuốn,giáo viên giảng dạy,Teaching quality,lôi cuốn,Positive
81,"nhiệt tình , dễ gần , truyền đạt tận tâm .","nhiệt tình , dễ gần , truyền đạt tận tâm",truyền đạt ,Teaching quality,"nhiệt tình , dễ gần , truyền đạt tận tâm",Positive
82,phương pháp truyền đạt của giảng viên chưa hiệu quả lắm .,phương pháp truyền đạt của giảng viên chưa hiệu quả lắm,phương pháp truyền đạt,Teaching quality,chưa hiệu quả lắm,Negative
83,giáo viên chưa tạo được không khí vui vẻ trong lớp học .,giáo viên chưa tạo được không khí vui vẻ trong lớp học ,giáo viên chưa tạo được không khí vui vẻ trong lớp học,Teaching quality,chưa tạo được không khí vui vẻ trong lớp học,Negative
84,thầy giúp em biết mạch số là gì .,thầy giúp em biết mạch số là gì .,thầy giúp em,Support from lecturers,giúp em biết mạch số là gì,Positive
85,có lúc thầy lạc đề .,có lúc thầy lạc đề ,có lúc thầy lạc đề ,Teaching quality,có lúc thầy lạc đề,Negative
86,thầy dạy hơi chậm .,thầy dạy hơi chậm,thầy dạy,Teaching quality, hơi chậm,Negative
87,"lần được học thầy , thấm nhiều thứ quá .","lần được học thầy , thấm nhiều thứ quá",được học thầy,Teaching quality, thấm nhiều thứ quá,Positive
88,nhiều phần trong slide bài giảng của giảng viên không chính xác .,nhiều phần trong slide bài giảng của giảng viên không chính xác,slide bài giảng của giảng viên,Teaching quality,không chính xác,Negative
89,"môn học cần phân chia hợp lý giữa các phần , phần nào khó cần nhiều thời gian để học nó , phần nào đã học thì chỉ ra những điểm đặc biệt cũng như thời gian học phần đó rút ngắn lại để các phần chưa học khác sẽ có thời gian nhiều hơn .",môn học cần phân chia hợp lý giữa các phần,môn học ,Course information,cần phân chia hợp lý giữa các phần,Neutral
89,"môn học cần phân chia hợp lý giữa các phần , phần nào khó cần nhiều thời gian để học nó , phần nào đã học thì chỉ ra những điểm đặc biệt cũng như thời gian học phần đó rút ngắn lại để các phần chưa học khác sẽ có thời gian nhiều hơn .","phần nào khó cần nhiều thời gian để học nó , phần nào đã học thì chỉ ra những điểm đặc biệt cũng như thời gian học phần đó rút ngắn lại để các phần chưa học khác sẽ có thời gian nhiều hơn","phần nào khó cần nhiều thời gian để học nó , phần nào đã học thì chỉ ra những điểm đặc biệt cũng như thời gian học phần đó rút ngắn lại để các phần chưa học khác sẽ có thời gian nhiều hơn",Organization and management,"phần nào khó cần nhiều thời gian để học nó , phần nào đã học thì chỉ ra những điểm đặc biệt cũng như thời gian học phần đó rút ngắn lại để các phần chưa học khác sẽ có thời gian nhiều hơn",Neutral
90,"thực hành đúng tiêu chí môn học , đi từ dễ đến khó cho sinh viên học tập từng bước dễ hiểu , giảng viên tích cực giải đáp thắc mắc và hỗ trợ sinh viên trong giờ thực hành .","thực hành đúng tiêu chí môn học , đi từ dễ đến khó cho sinh viên học tập từng bước dễ hiểu",tiêu chí môn học,Course information,"thực hành đúng tiêu chí môn học , đi từ dễ đến khó cho sinh viên học tập từng bước dễ hiểu",Positive
90,"thực hành đúng tiêu chí môn học , đi từ dễ đến khó cho sinh viên học tập từng bước dễ hiểu , giảng viên tích cực giải đáp thắc mắc và hỗ trợ sinh viên trong giờ thực hành .",giảng viên tích cực giải đáp thắc mắc và hỗ trợ sinh viên trong giờ thực hành,giảng viên tích cực giải đáp thắc mắc và hỗ trợ sinh viên,Support from lecturers, tích cực giải đáp thắc mắc và hỗ trợ sinh viên trong giờ thực hành,Positive
91,"dạy dễ hiểu , sâu rộng .","dạy dễ hiểu , sâu rộng ",dạy,Teaching quality," dễ hiểu , sâu rộng ",Positive
92,"thầy dạy nhiệt tình , vui vẻ .","thầy dạy nhiệt tình , vui vẻ ",thầy dạy,Teaching quality,"nhiệt tình , vui vẻ",Positive
93,"thầy cực kỳ tâm lý , vui tính , dạy nhiệt tình và tận tụy với học trò .","thầy cực kỳ tâm lý , vui tính","thầy cực kỳ tâm lý , vui tính",Support from lecturers,"cực kỳ tâm lý , vui tính",Positive
93,"thầy cực kỳ tâm lý , vui tính , dạy nhiệt tình và tận tụy với học trò .",dạy nhiệt tình và tận tụy với học trò,dạy,Teaching quality,nhiệt tình và tận tụy với học trò,Positive
94,thầy luôn chủ động tạo tranh luận và kiểm tra bài tập đầu giờ để sinh viên dễ dàng nắm bắt kiến thức .,thầy luôn chủ động tạo tranh luận và kiểm tra bài tập đầu giờ để sinh viên dễ dàng nắm bắt kiến thức,chủ động tạo tranh luận và kiểm tra bài tập đầu giờ,Support from lecturers, luôn chủ động tạo tranh luận và kiểm tra bài tập đầu giờ để sinh viên dễ dàng nắm bắt kiến thức,Positive
95,"nội dung tiết học còn lan man , cảm tưởng như thầy đang dạy về tiếng anh chuyên ngành , chứ không đào sâu về kỹ thuật .",nội dung tiết học còn lan man,nội dung tiết học,Course information,còn lan man,Negative
95,"nội dung tiết học còn lan man , cảm tưởng như thầy đang dạy về tiếng anh chuyên ngành , chứ không đào sâu về kỹ thuật .","cảm tưởng như thầy đang dạy về tiếng anh chuyên ngành , chứ không đào sâu về kỹ thuật","hầy đang dạy về tiếng anh chuyên ngành , chứ không đào sâu về kỹ thuật",Teaching quality,"cảm tưởng như thầy đang dạy về tiếng anh chuyên ngành , chứ không đào sâu về kỹ thuật",Negative
96,nên tự tin hơn trong việc giảng dạy .,nên tự tin hơn trong việc giảng dạy, giảng dạy,Teaching quality,nên tự tin hơn,Neutral
97,giảng viên có cập nhật thông tin mới nhất về tình hình thực tế .,giảng viên có cập nhật thông tin mới nhất về tình hình thực tế ,giảng viên có cập nhật thông tin mới nhất về tình hình thực tế ,Teaching quality, có cập nhật thông tin mới nhất về tình hình thực tế,Positive
98,giáo viên rất nhiệt tình đối với sinh viên .,giáo viên rất nhiệt tình đối với sinh viên,giáo viên rất nhiệt tình đối với sinh viên,Support from lecturers, rất nhiệt tình đối với sinh viên,Positive
99,cảm thấy hứng thú khi lên lớp .,cảm thấy hứng thú khi lên lớp,cảm thấy hứng thú khi lên lớp,General review,cảm thấy hứng thú khi lên lớp,Positive
100,"cùng một kiến thức nhưng cách truyền đạt của thầy dễ hiểu hơn , phù hợp với đại đa số sinh viên và tất nhiên là hữu dụng cho các môn khác chứ không hề lan man , thiếu trọng tâm như các giảng viên toán khác .","cùng một kiến thức nhưng cách truyền đạt của thầy dễ hiểu hơn , phù hợp với đại đa số sinh viên và tất nhiên là hữu dụng cho các môn khác chứ không hề lan man , thiếu trọng tâm như các giảng viên toán khác",cách truyền đạt của thầy,Teaching quality,"cùng một kiến thức nhưng cách truyền đạt của thầy dễ hiểu hơn , phù hợp với đại đa số sinh viên và tất nhiên là hữu dụng cho các môn khác chứ không hề lan man , thiếu trọng tâm như các giảng viên toán khác",Positive