"id","Review","Sentence Component","aspect_text","aspect","sentiment_text","sentiment"
"87","thầy nên hỗ trợ hướng dẫn và tương tác với các bạn sinh viên nhiều hơn .","thầy nên hỗ trợ hướng dẫn và tương tác với các bạn sinh viên nhiều hơn","hỗ trợ hướng dẫn và tương tác","Support from lecturers"," nên","Neutral"
"88","thầy nhiệt nhiệt tình vui tính niềm nở với sinh viên .","thầy nhiệt nhiệt tình vui tính niềm nở với sinh viên","nhiệt tình vui tính niềm nở với sinh viên","Support from lecturers","nhiệt tình vui tính niềm nở","Positive"
"89","dứt khoát .","dứt khoát","dứt khoát","General review","dứt khoát","Positive"
"90","phòng máy thực hành còn yếu , máy chạy chậm hay đơ , thỉnh thoảng còn hư , mạng để hỗ trợ ta cứu trong phòng máy còn chậm .","phòng máy thực hành còn yếu","phòng máy thực hành","Learning environment","yếu","Negative"
"90","phòng máy thực hành còn yếu , máy chạy chậm hay đơ , thỉnh thoảng còn hư , mạng để hỗ trợ ta cứu trong phòng máy còn chậm .","máy chạy chậm hay đơ , thỉnh thoảng còn hư","máy","Learning environment","chậm hay đơ , thỉnh thoảng còn hư","Negative"
"90","phòng máy thực hành còn yếu , máy chạy chậm hay đơ , thỉnh thoảng còn hư , mạng để hỗ trợ ta cứu trong phòng máy còn chậm .","mạng để hỗ trợ ta cứu trong phòng máy còn chậm","mạng","Learning environment","chậm","Negative"
"91","thầy chia sẻ những kinh nghiệm về bên ngoài rất hay và đáng để học hỏi .","thầy chia sẻ những kinh nghiệm về bên ngoài rất hay và đáng để học hỏi","chia sẻ","Support from lecturers","hay và đáng để học hỏi","Positive"
"92","thầy quá tuyệt vời , nhiệt tình , quá chu đáo .","thầy quá tuyệt vời , nhiệt tình , quá chu đáo","thầy quá tuyệt vời , nhiệt tình , quá chu đáo","General review","tuyệt vời , nhiệt tình , quá chu đáo","Positive"
"93","trời nóng .","trời nóng","trời nóng","Learning environment","nóng","Negative"
"94","tiết học lúc nào cũng sôi nổi .","tiết học lúc nào cũng sôi nổi","tiết học","Learning environment","sôi nổi","Positive"
"95","hướng dẫn rõ ràng cách thực hiện .","hướng dẫn rõ ràng cách thực hiện","hướng dẫn","Support from lecturers","rõ ràng","Positive"
"96","phương pháp dạy hiệu quả .","phương pháp dạy hiệu quả","phương pháp dạy","Teaching quality","hiệu quả","Positive"
"97","dạy được .","dạy được","dạy","Teaching quality","được","Positive"
"98","thầy có nhiều kinh nghiệm , hỗ trợ sinh viên cho việc thực hành các bài tập trên lớp .","thầy có nhiều kinh nghiệm , hỗ trợ sinh viên cho việc thực hành các bài tập trên lớp","thầy có nhiều kinh nghiệm , hỗ trợ sinh viên cho việc thực hành các bài tập trên lớp","Support from lecturers","có nhiều kinh nghiệm , hỗ trợ sinh viên cho việc thực hành các bài tập trên lớp","Positive"
"99","thầy luôn đến lớp đúng giờ và giảng dạy nhiệt tình .","thầy luôn đến lớp đúng giờ","đúng giờ","Organization and management","luôn đến lớp đúng giờ","Positive"
"99","thầy luôn đến lớp đúng giờ và giảng dạy nhiệt tình .","giảng dạy nhiệt tình","giảng dạy ","Teaching quality","giảng dạy ","Positive"
"99","thầy luôn đến lớp đúng giờ và giảng dạy nhiệt tình .","giảng dạy nhiệt tình","giảng dạy ","Teaching quality","nhiệt tình","Positive"
"99","thầy luôn đến lớp đúng giờ và giảng dạy nhiệt tình .","giảng dạy nhiệt tình","nhiệt tình","Teaching quality","giảng dạy ","Positive"
"99","thầy luôn đến lớp đúng giờ và giảng dạy nhiệt tình .","giảng dạy nhiệt tình","nhiệt tình","Teaching quality","nhiệt tình","Positive"
"100","cô dạy rất vui và nhiệt tình dễ hiểu bài .","cô dạy rất vui và nhiệt tình dễ hiểu bài","dạy","Teaching quality","rất vui và nhiệt tình dễ hiểu bài","Positive"