id,Review,Sentence Component,aspect_text,aspect,sentiment_text,sentiment
89,bài tập về nhà khá khó .,bài tập về nhà khá khó,bài tập về nhà,Workload,khá khó,Negative
90,môn học cần có một lượng bài tập lớn và người học muốn hiểu được vấn đề thì cần làm nhiều bài tập vì thế môn học cần có thời gian làm bài tập sau mỗi phần để có thể ôn lại những gì đã học trong các tuần trước .,môn học cần có một lượng bài tập lớn và người học muốn hiểu được vấn đề thì cần làm nhiều bài tập vì thế môn học cần có thời gian làm bài tập sau mỗi phần để có thể ôn lại những gì đã học trong các tuần trước,lượng bài tập lớn và người học muốn hiểu được vấn đề thì cần làm nhiều bài tập vì thế môn học cần có thời gian làm bài tập,Workload,để có thể ôn lại,Neutral
91,chất lượng môn học vậy đã đầy đủ .,chất lượng môn học vậy đã đầy đủ,chất lượng môn học,Course information,đầy đủ,Positive
92,"thầy dạy hơi lan man , diễn đạt không tốt ạ .",thầy dạy hơi lan man,dạy,Teaching quality,hơi lan man,Negative
92,"thầy dạy hơi lan man , diễn đạt không tốt ạ .",diễn đạt không tốt ạ,diễn đạt,Teaching quality,không tốt,Negative
93,thầy giảng rất dễ hiểu và dễ tiếp thu bài .,thầy giảng rất dễ hiểu và dễ tiếp thu bài,giảng,Teaching quality,dễ hiểu và dễ tiếp thu,Positive
94,lớp wzjwz1 nên được học ở phòng máy tốt hơn chút xíu được không ạ .,lớp wzjwz1 nên được học ở phòng máy tốt hơn chút xíu được không ạ,phòng máy,Learning environment,tốt hơn chút xíu,Neutral
95,đề nghị bỏ phần thi lý thuyết cuối kỳ .,đề nghị bỏ phần thi lý thuyết cuối kỳ,phần thi lý thuyết cuối kỳ,Test and evaluation,đề nghị bỏ,Neutral
96,"thầy wzjwz182 dạy rất hay , rất dễ hiểu .","thầy wzjwz182 dạy rất hay , rất dễ hiểu",dạy,Teaching quality,"hay , rất dễ hiểu",Positive
97,"thầy dạy nhiệt tình , rất hài lòng .",thầy dạy nhiệt tình,dạy,Teaching quality,nhiệt tình,Positive
97,"thầy dạy nhiệt tình , rất hài lòng .",rất hài lòng,hài lòng,General review,hài lòng,Positive
98,"cô dạy hay , tận tình với học sinh .",cô dạy hay,dạy,Teaching quality,hay,Positive
98,"cô dạy hay , tận tình với học sinh .",tận tình với học sinh,tận tình với học sinh,Support from lecturers,tận tình,Positive
99,có liên hệ thực tiễn và lấy ví dụ minh họa .,có liên hệ thực tiễn và lấy ví dụ minh họa,thực tiễn và lấy ví dụ minh họa,Teaching quality,thực tiễn,Positive
100,cần thêm tiết học thực hành .,cần thêm tiết học thực hành,cần thêm tiết học thực hành,Organization and management,cần thêm,Neutral