"id","Review","Sentence Component","aspect_text","aspect","sentiment_text","sentiment"
"82","cách truyền đạt của cô tốt , nhưng nghe một lúc dễ buồn ngủ , học liên tục bốn tiết nên khoảng hai tiết sau cũng có một số bạn ngủ gật .","cách truyền đạt của cô tốt , nhưng nghe một lúc dễ buồn ngủ , học liên tục bốn tiết nên khoảng hai tiết sau cũng có một số bạn ngủ gật","cách truyền đạt","Teaching quality","tốt , nhưng nghe một lúc dễ buồn ngủ","Neutral"
"83","giáo viên rất tận tâm và nhiệt tình .","giáo viên rất tận tâm và nhiệt tình","tận tâm và nhiệt tình","Support from lecturers","tận tâm và nhiệt tình","Positive"
"84","chỉ cần tổ chức các cuộc thi học thuật , trường phải nhúng tay vào , kêu tài trợ nhiều lên , giải thưởng cao lên , có tiền sinh viên sẽ nghiên cứu thôi .","chỉ cần tổ chức các cuộc thi học thuật , trường phải nhúng tay vào , kêu tài trợ nhiều lên , giải thưởng cao lên , có tiền sinh viên sẽ nghiên cứu thôi","tổ chức các cuộc thi học thuật","Organization and management","trường phải nhúng tay vào , kêu tài trợ nhiều lên , giải thưởng cao lên , có tiền sinh viên sẽ nghiên cứu thôi","Neutral"
"85","phòng thực hành còn chưa đảm bảo đủ số lượng học sinh của lớp học thực hành .","phòng thực hành còn chưa đảm bảo đủ số lượng học sinh của lớp học thực hành","phòng thực hành","Learning environment","chưa đảm bảo đủ số lượng","Negative"
"86","trợ giảng tận tình , dễ chịu , giảng viên chính hầu như không có mặt .","trợ giảng tận tình , dễ chịu","tận tình , dễ chịu","Support from lecturers","tận tình , dễ chịu","Positive"
"86","trợ giảng tận tình , dễ chịu , giảng viên chính hầu như không có mặt .","giảng viên chính hầu như không có mặt","giảng viên chính hầu như không có mặt","Organization and management","hầu như không có mặt","Negative"
"87","khả năng truyền đạt tốt , dễ hiểu , nhiệt huyết , giảng hay .","khả năng truyền đạt tốt , dễ hiểu , nhiệt huyết , giảng hay","khả năng truyền đạt","Teaching quality","tốt , dễ hiểu , nhiệt huyết , giảng hay","Positive"
"88","phòng lab thực hành đã quá cũ nát , nên cải tiến và xây dựng hệ thống phòng lab để sinh viên có thể thực hành các kỹ năng của môn học này .","phòng lab thực hành đã quá cũ nát","phòng lab","Learning environment","quá cũ nát","Negative"
"88","phòng lab thực hành đã quá cũ nát , nên cải tiến và xây dựng hệ thống phòng lab để sinh viên có thể thực hành các kỹ năng của môn học này .","nên cải tiến và xây dựng hệ thống phòng lab để sinh viên có thể thực hành các kỹ năng của môn học này","hệ thống phòng lab","Learning environment","nên cải tiến và xây dựng","Neutral"
"89","lớp quá đông .","lớp quá đông","lớp quá đông","Organization and management","quá đông","Negative"
"90","cô dạy hay , dễ hiểu , giảng kỹ , thân thiện với sinh viên .","cô dạy hay , dễ hiểu , giảng kỹ , thân thiện với sinh viên","dạy","Teaching quality","hay , dễ hiểu , giảng kỹ , thân thiện","Positive"
"91","dạy rất chi tiết .","dạy rất chi tiết","dạy","Teaching quality","rất chi tiết","Positive"
"92","cảm ơn thầy đã sửa bài cho lớp trong những tháng qua .","cảm ơn thầy đã sửa bài cho lớp trong những tháng qua","sửa bài","Support from lecturers","cảm ơn","Positive"
"93","giảng viên tận tâm , kỹ năng truyền đạt tốt .","giảng viên tận tâm","tận tâm","Support from lecturers","tận tâm","Positive"
"93","giảng viên tận tâm , kỹ năng truyền đạt tốt ."," kỹ năng truyền đạt tốt","kỹ năng truyền đạt","Teaching quality","tốt","Positive"
"94","giáo viên dạy toàn trong sách giáo trình .","giáo viên dạy toàn trong sách giáo trình","dạy","Teaching quality","toàn trong sách","Negative"
"95","giảng viên không giới thiệu về nội dung học và kiểm tra ( thi ) , nội dung kiểm tra ( thi ) quá dài so với thời gian làm và phân bố điểm không phù hợp .","giảng viên không giới thiệu về nội dung học và kiểm tra ( thi )","giới thiệu về nội dung học và kiểm tra","Organization and management","không giới thiệu","Negative"
"95","giảng viên không giới thiệu về nội dung học và kiểm tra ( thi ) , nội dung kiểm tra ( thi ) quá dài so với thời gian làm và phân bố điểm không phù hợp .","nội dung kiểm tra ( thi ) quá dài so với thời gian làm và phân bố điểm không phù hợp","nội dung kiểm tra","Test and evaluation","quá dài so với thời gian làm và phân bố điểm không phù hợp","Negative"
"96","điều này thiếu ở nhiều bộ môn khác .","điều này thiếu ở nhiều bộ môn khác","điều này thiếu ở nhiều bộ môn khác","General review","thiếu","Negative"
"97","do khi ra trường các công ty chủ yếu đánh mạnh phần thực hành và vận dụng .","do khi ra trường các công ty chủ yếu đánh mạnh phần thực hành và vận dụng","ra trường các công ty chủ yếu đánh mạnh phần thực hành và vận dụng","General review","chủ yếu đánh mạnh","Neutral"
"98","giáo viên truyền đạt kinh nghiệm thực tế nhiều .","giáo viên truyền đạt kinh nghiệm thực tế nhiều","truyền đạt kinh nghiệm thực tế","Teaching quality","nhiều","Positive"
"99","giảng dạy thú vị .","giảng dạy thú vị","giảng dạy","Teaching quality","thú vị","Positive"
"100","ghi chép quá nhiều .","ghi chép quá nhiều","ghi chép","Teaching quality","quá nhiều","Negative"