"id","Review","Sentence Component","aspect_text","aspect","sentiment_text","sentiment"
"88","thầy không quan tâm đến việc học của sinh viên , nhiệm vụ của thầy là lên lớp đọc slide cho các bạn khác nên trình trạng sinh viên nghỉ rất nhiều .","thầy không quan tâm đến việc học của sinh viên , nhiệm vụ của thầy là lên lớp đọc slide cho các bạn khác nên trình trạng sinh viên nghỉ rất nhiều","thầy ","Teaching quality","thầy không quan tâm đến việc học của sinh viên , nhiệm vụ của thầy là lên lớp đọc slide cho các bạn khác nên trình trạng sinh viên nghỉ rất nhiều","Negative"
"89","môn này gắn với thực tế nhiều nên có những các tương tác trực tiếp với nhau .","môn này gắn với thực tế nhiều nên có những các tương tác trực tiếp với nhau","môn này gắn với thực tế nhiều nên có những các tương tác trực tiếp với nhau","General review","môn này gắn với thực tế nhiều nên có những các tương tác trực tiếp với nhau","Neutral"
"90","cô tận tâm , nhiệt tình , sẵn sàng giảng lại bài cho lớp khi có chỗ khó hiểu .","cô tận tâm , nhiệt tình , sẵn sàng giảng lại bài cho lớp khi có chỗ khó hiểu ","cô","Support from lecturers","tận tâm , nhiệt tình , sẵn sàng giảng lại bài cho lớp khi có chỗ khó hiểu ","Positive"
"91","tài liệu cho kết quả nhưng có cái đúng cái sai làm hoang mang cho việc tự học tại nhà .","tài liệu cho kết quả nhưng có cái đúng cái sai làm hoang mang cho việc tự học tại nhà","tài liệu","Course information"," cho kết quả nhưng có cái đúng cái sai làm hoang mang cho việc tự học tại nhà","Negative"
"92","chỉ lên cho tự làm .","chỉ lên cho tự làm","chỉ lên cho tự làm","Teaching quality","chỉ lên cho tự làm","Negative"
"93","em cảm thấy sự tương quan giữa tiết học thực hành và lý thuyết chưa hợp lý lắm .","em cảm thấy sự tương quan giữa tiết học thực hành và lý thuyết chưa hợp lý lắm"," tiết học thực hành và lý thuyết","Course information","em cảm thấy sự tương quan giữa tiết học thực hành và lý thuyết chưa hợp lý lắm","Negative"
"94","giảng viên rất nhiệt tình , thường xuyên trao đổi tài liệu qua website môn học .","giảng viên rất nhiệt tình , thường xuyên trao đổi tài liệu qua website môn học","giảng viên","Support from lecturers","rất nhiệt tình , thường xuyên trao đổi tài liệu qua website môn học","Positive"
"95","thầy nhiệt tình năng động .","thầy nhiệt tình năng động","thầy","Teaching quality"," nhiệt tình năng động","Positive"
"96","không có lời giải đầy đủ , học sinh không biết làm là coi như không biết làm từ đâu hết cuối .","không có lời giải đầy đủ , học sinh không biết làm là coi như không biết làm từ đâu hết cuối","lời giải","Course information","không có lời giải đầy đủ , học sinh không biết làm là coi như không biết làm từ đâu hết cuối","Negative"
"97","cô rất thân thiện và nhiệt tình .","cô rất thân thiện và nhiệt tình","cô ","Support from lecturers","rất thân thiện và nhiệt tình","Positive"
"98","thầy rất tận tình , hướng dẫn cụ thể .","thầy rất tận tình , hướng dẫn cụ thể","thầy ","Support from lecturers","rất tận tình , hướng dẫn cụ thể","Positive"
"99","em học phân tích thiết kế cô wzjwz276 mà .","em học phân tích thiết kế cô wzjwz276 mà","em học phân tích thiết kế cô wzjwz276 mà","General review","em học phân tích thiết kế cô wzjwz276 mà","Neutral"
"100","dạy dễ hiểu , cuốn hút .","dạy dễ hiểu , cuốn hút","dạy","Teaching quality","dễ hiểu , cuốn hút","Positive"