"id","Review","Sentence Component","aspect_text","aspect","sentiment_text","sentiment"
"1","giảng viên vào lớp toàn đọc báo bấm slide thời lượng không được bảo đảm tầm 9h là đi họp hoài .","giảng viên vào lớp toàn đọc báo bấm slide","giảng viên vào lớp","Teaching quality","toàn đọc báo bấm slide","Negative"
"1","giảng viên vào lớp toàn đọc báo bấm slide thời lượng không được bảo đảm tầm 9h là đi họp hoài .","thời lượng không được bảo đảm tầm 9h là đi họp hoài ","thời lượng","Organization and management","không được bảo đảm","Negative"
"2","khi giảng bài , nói rất nhanh và khó nghe .","khi giảng bài , nói rất nhanh và khó nghe","giảng bài","Teaching quality","rất nhanh và khó nghe","Negative"
"3","nên thực hành nói nhiều hơn và lên lớp nên có những hoạt động vui hơn .","nên thực hành nói nhiều hơn","thực hành nói","Teaching quality","nên","Neutral"
"3","nên thực hành nói nhiều hơn và lên lớp nên có những hoạt động vui hơn .","và lên lớp nên có những hoạt động vui hơn","những hoạt động","Teaching quality","nên có","Neutral"
"4","giảng viên tận tình hướng dẫn .","giảng viên tận tình hướng dẫn"," hướng dẫn","Support from lecturers","tận tình","Positive"
"5","đặc biệt là micro và máy chiếu còn trục trặc nhiều .","đặc biệt là micro và máy chiếu còn trục trặc nhiều","micro và máy chiếu","Learning environment","còn trục trặc","Negative"
"6","cô dạy tận tình , dễ hiểu , sử dụng thời gian lên lớp hợp lý .","cô dạy tận tình , dễ hiểu","dạy","Teaching quality","tận tình , dễ hiểu","Positive"
"6","cô dạy tận tình , dễ hiểu , sử dụng thời gian lên lớp hợp lý .","sử dụng thời gian lên lớp hợp lý","sử dụng thời gian","Organization and management","hợp lý","Positive"
"7","điều chỉnh chất lượng doubledot với chương trình học tập hiên nay , sinh viên thương lắm vững kiến thức khi gần đến cuối kỳ gây khó cho sinh viên làm đồ án thời gian hạn hẹp .","điều chỉnh chất lượng doubledot với chương trình học tập hiên nay , sinh viên thương lắm vững kiến thức khi gần đến cuối kỳ gây khó cho sinh viên làm đồ án thời gian hạn hẹp","điều chỉnh chất lượng","Teaching quality","khó cho sinh viên làm đồ án thời gian hạn hẹp","Negative"
"8","quan tâm sinh viên , bám sát đề cương ôn tập .","quan tâm sinh viên","quan tâm sinh viên","Support from lecturers","quan tâm","Positive"
"8","quan tâm sinh viên , bám sát đề cương ôn tập .","bám sát đề cương ôn tập","bám sát đề cương ôn tập","Teaching quality","bám sát","Positive"
"9","nhiệt tình , hướng dẫn cụ thể .","nhiệt tình","nhiệt tình","Support from lecturers","nhiệt tình","Positive"
"9","nhiệt tình , hướng dẫn cụ thể .","hướng dẫn cụ thể","hướng dẫn","Support from lecturers","cụ thể","Positive"
"10","thầy không điểm danh .","thầy không điểm danh","điểm danh","Organization and management","không","Negative"
"11","cô dạy nhiệt tình , quan tâm đến học sinh .","cô dạy nhiệt tình , quan tâm đến học sinh","dạy","Teaching quality","nhiệt tình , quan tâm","Positive"
"12","giờ lên lớp đều đặn , giảng viên tích cực giải đáp thắc mắc của sinh viên .","giờ lên lớp đều đặn","giờ lên lớp","Organization and management","đều đặn","Positive"
"12","giờ lên lớp đều đặn , giảng viên tích cực giải đáp thắc mắc của sinh viên ."," giảng viên tích cực giải đáp thắc mắc của sinh viên","giải đáp thắc mắc","Support from lecturers"," tích cực","Positive"
"13","hình thức đánh giá , chấm điểm giữa các nhóm , đánh giá bản thân , nhóm khách hàng .","hình thức đánh giá , chấm điểm giữa các nhóm , đánh giá bản thân , nhóm khách hàng","hình thức đánh giá","Test and evaluation","đánh giá , chấm điểm","Neutral"
"14","thầy quá nhiệt tình nên lớp thường hay ra muộn .","thầy quá nhiệt tình","thầy quá nhiệt tình","Teaching quality","quá nhiệt tình","Neutral"
"14","thầy quá nhiệt tình nên lớp thường hay ra muộn .","nên lớp thường hay ra muộn","lớp thường hay ra muộn","Organization and management","muộn","Negative"
"15","bên cạnh đó còn chia sẻ với sinh viên nhiều kinh nghiệm quý báu , có ích cho việc học và làm sau này .","bên cạnh đó còn chia sẻ với sinh viên nhiều kinh nghiệm quý báu , có ích cho việc học và làm sau này","chia sẻ với sinh viên","Teaching quality","kinh nghiệm quý báu , có ích","Positive"
"16","thầy dạy rất hay , luôn gắn liền với đời sống thực , giúp cho tụi em có cái nhìn chính xác về một game .","thầy dạy rất hay , luôn gắn liền với đời sống thực , giúp cho tụi em có cái nhìn chính xác về một game"," dạy","Teaching quality","rất hay , luôn gắn liền với đời sống thực","Positive"
"17","có chăng là thầy cô làm những file hướng dẫn cụ thể để sinh viên biết mình cần tìm gì .","có chăng là thầy cô làm những file hướng dẫn cụ thể để sinh viên biết mình cần tìm gì","file hướng dẫn","Course information","có chăng là","Neutral"
"18","thầy vui vẻ , nhiệt tình .","thầy vui vẻ , nhiệt tình","thầy vui vẻ , nhiệt tình","Support from lecturers","vui vẻ , nhiệt tình","Positive"
"19","về hạn nộp bài ( deadline ) trên moodle thầy nên cố định một giờ giấc nào đó .","về hạn nộp bài ( deadline ) trên moodle thầy nên cố định một giờ giấc nào đó","hạn nộp bài","Organization and management","nên cố định","Neutral"
"20","dạy dễ hiểu , vui vẻ , tận tình .","dạy dễ hiểu , vui vẻ , tận tình","dạy","Teaching quality","dễ hiểu , vui vẻ , tận tình","Positive"
"21","thường xuyên nghỉ không báo trước không báo lên da hoặc báo với sinh viên .","thường xuyên nghỉ không báo trước không báo lên da hoặc báo với sinh viên","nghỉ không báo trước","Organization and management","không báo trước không báo","Negative"
"22","không có ạ .","không có ạ","không có ạ","General review","không có ạ","Neutral"
"23","thầy dạy tốt , lập nhóm cho thuyết trình , tạo được không khí học tập tốt , không nhàm chán .","thầy dạy tốt"," dạy","Teaching quality","tốt","Positive"
"23","thầy dạy tốt , lập nhóm cho thuyết trình , tạo được không khí học tập tốt , không nhàm chán .","lập nhóm cho thuyết trình , tạo được không khí học tập tốt , không nhàm chán","lập nhóm","Teaching quality","tốt , không nhàm chán","Positive"
"24","chưa làm rõ được ứng dụng vào thực tế của nội dung môn học .","chưa làm rõ được ứng dụng vào thực tế của nội dung môn học","nội dung môn học","Course information","chưa làm rõ","Negative"
"25","đề nghị trường triển khai hệ thống user để quản lý tốc độ cũng như sinh viên nào đang tải phim , soft , vdotv .","đề nghị trường triển khai hệ thống user để quản lý tốc độ cũng như sinh viên nào đang tải phim , soft , vdotv","triển khai hệ thống","Organization and management","đề nghị","Neutral"
"26","lịch bù không rõ ràng , không ôn tập , dạy không kịp chương trình , đăng video cho sinh viên xem lại .","lịch bù không rõ ràng","lịch bù","Organization and management","không rõ ràng","Negative"
"26","lịch bù không rõ ràng , không ôn tập , dạy không kịp chương trình , đăng video cho sinh viên xem lại ."," không ôn tập","không ôn tập","Teaching quality","không","Negative"
"26","lịch bù không rõ ràng , không ôn tập , dạy không kịp chương trình , đăng video cho sinh viên xem lại .","dạy không kịp chương trình","dạy","Teaching quality","không kịp","Negative"
"26","lịch bù không rõ ràng , không ôn tập , dạy không kịp chương trình , đăng video cho sinh viên xem lại .","đăng video cho sinh viên xem lại","đăng video","Teaching quality","xem lại","Negative"
"27","slide bài giảng chưa được chuẩn hóa , đa phần sao chép nhặt mỗi nơi một ít .","slide bài giảng chưa được chuẩn hóa , đa phần sao chép nhặt mỗi nơi một ít","slide bài giảng","Course information"," chưa được chuẩn hóa , đa phần sao chép","Negative"
"28","cho bài tập về nhà để học sinh làm thêm .","cho bài tập về nhà để học sinh làm thêm","bài tập về nhà","Workload","làm thêm","Neutral"
"29","thường xuyên vào lớp muộn và dạy lố giờ .","thường xuyên vào lớp muộn","vào lớp","Organization and management","muộn","Negative"
"29","thường xuyên vào lớp muộn và dạy lố giờ .","và dạy lố giờ","dạy lố giờ","Organization and management","lố giờ","Negative"
"30","thầy giáo vui tính nhiệt tình .","thầy giáo vui tính nhiệt tình","thầy giáo vui tính nhiệt tình","Support from lecturers","vui tính nhiệt tình","Positive"
"31","rất nhiệt tình , khách quan .","rất nhiệt tình , khách quan","rất nhiệt tình , khách quan","Support from lecturers","rất nhiệt tình , khách quan","Positive"
"32","bài thi cũng sử dụng nửa tiếng việt nửa tiếng anh với câu hỏi và đáp án khó hiểu , không rõ ràng .","bài thi cũng sử dụng nửa tiếng việt nửa tiếng anh với câu hỏi và đáp án khó hiểu , không rõ ràng","bài thi","Test and evaluation","khó hiểu , không rõ ràng","Negative"
"33","thầy wzjwz30 là một giảng viên trẻ , vì vậy thầy rất hiểu tâm lý sinh viên và giúp đỡ chúng em rất nhiều .","thầy wzjwz30 là một giảng viên trẻ , vì vậy thầy rất hiểu tâm lý sinh viên và giúp đỡ chúng em rất nhiều","giảng viên trẻ","Teaching quality","rất hiểu tâm lý sinh viên và giúp đỡ chúng em rất nhiều","Positive"
"34","giảng viên dễ thương , hiền lành , gần gũi với sinh viên , thường xuyên trợ giúp sinh viên một cách rất nhiệt tình , giúp sinh viên hiểu bài dễ hơn .","giảng viên dễ thương , hiền lành , gần gũi với sinh viên","gần gũi với sinh viên","Support from lecturers","dễ thương , hiền lành , gần gũi","Positive"
"34","giảng viên dễ thương , hiền lành , gần gũi với sinh viên , thường xuyên trợ giúp sinh viên một cách rất nhiệt tình , giúp sinh viên hiểu bài dễ hơn .","giảng viên dễ thương , hiền lành , gần gũi với sinh viên","gần gũi với sinh viên","Support from lecturers","rất nhiệt tình","Positive"
"34","giảng viên dễ thương , hiền lành , gần gũi với sinh viên , thường xuyên trợ giúp sinh viên một cách rất nhiệt tình , giúp sinh viên hiểu bài dễ hơn .","giảng viên dễ thương , hiền lành , gần gũi với sinh viên","thường xuyên trợ giúp sinh viên một cách rất nhiệt tình","Support from lecturers","dễ thương , hiền lành , gần gũi","Positive"
"34","giảng viên dễ thương , hiền lành , gần gũi với sinh viên , thường xuyên trợ giúp sinh viên một cách rất nhiệt tình , giúp sinh viên hiểu bài dễ hơn .","giảng viên dễ thương , hiền lành , gần gũi với sinh viên","thường xuyên trợ giúp sinh viên một cách rất nhiệt tình","Support from lecturers","rất nhiệt tình","Positive"
"34","giảng viên dễ thương , hiền lành , gần gũi với sinh viên , thường xuyên trợ giúp sinh viên một cách rất nhiệt tình , giúp sinh viên hiểu bài dễ hơn .","giảng viên dễ thương , hiền lành , gần gũi với sinh viên","thường xuyên trợ giúp","Support from lecturers","dễ thương , hiền lành , gần gũi","Positive"
"34","giảng viên dễ thương , hiền lành , gần gũi với sinh viên , thường xuyên trợ giúp sinh viên một cách rất nhiệt tình , giúp sinh viên hiểu bài dễ hơn .","giảng viên dễ thương , hiền lành , gần gũi với sinh viên","thường xuyên trợ giúp","Support from lecturers","rất nhiệt tình","Positive"
"34","giảng viên dễ thương , hiền lành , gần gũi với sinh viên , thường xuyên trợ giúp sinh viên một cách rất nhiệt tình , giúp sinh viên hiểu bài dễ hơn .","giúp sinh viên hiểu bài dễ hơn","giúp sinh viên","Support from lecturers","hiểu bài dễ hơn","Positive"
"35","không nên dạy theo phương pháp như ở bậc phổ thông mà nên chú trọng vào rèn luyện đầy đủ các kỹ năng chính của môn học .","không nên dạy theo phương pháp như ở bậc phổ thông","dạy","Teaching quality","không nên","Neutral"
"35","không nên dạy theo phương pháp như ở bậc phổ thông mà nên chú trọng vào rèn luyện đầy đủ các kỹ năng chính của môn học .","mà nên chú trọng vào rèn luyện đầy đủ các kỹ năng chính của môn học","các kỹ năng chính","Teaching quality","nên chú trọng","Neutral"
"36","giáo viên nên bảo đảm giờ lên lớp để sinh viên biết chính xác học ngày nào .","giáo viên nên bảo đảm giờ lên lớp để sinh viên biết chính xác học ngày nào","giờ lên lớp","Organization and management","nên bảo đảm","Negative"
"37","ngoài ra , giảng viên còn giúp các học sinh tích cực phát biểu trong tiết học .","ngoài ra , giảng viên còn giúp các học sinh tích cực phát biểu trong tiết học","giúp","Support from lecturers","tích cực","Positive"
"38","kiến thức chưa vững .","kiến thức chưa vững","kiến thức","Teaching quality","chưa vững","Negative"
"39","tăng cường cập nhập kiến thức mới .","tăng cường cập nhập kiến thức mới","cập nhập kiến thức","Teaching quality","tăng cường","Neutral"
"40","tiết dạy thầy rất sinh động , không thể tin được , thật là không thể tin nổi , quá là tuyệt vời !","tiết dạy thầy rất sinh động , không thể tin được , thật là không thể tin nổi , quá là tuyệt vời","tiết dạy","Teaching quality","rất sinh động , không thể tin được , thật là không thể tin nổi , quá là tuyệt vời","Positive"
"41","thầy có các khái niệm thực tế và có kinh nghiệm .","thầy có các khái niệm thực tế và có kinh nghiệm","khái niệm thực tế và có kinh nghiệm","Teaching quality","có các khái niệm thực tế và có kinh nghiệm","Positive"
"42","giảng viên chưa để ý nhiều đến sinh viên .","giảng viên chưa để ý nhiều đến sinh viên","để ý","Support from lecturers"," chưa để ý nhiều","Negative"
"43","phần hướng dẫn thực hành nên tập trung vào bài tập cần làm , hơn là hướng dẫn các ví dụ khó hiểu và không liên quan ví dụ như cho input và output để sinh viên có thể hình dung ra những công việc cần làm .","phần hướng dẫn thực hành nên tập trung vào bài tập cần làm","hướng dẫn thực hành","Support from lecturers","nên tập trung","Neutral"
"43","phần hướng dẫn thực hành nên tập trung vào bài tập cần làm , hơn là hướng dẫn các ví dụ khó hiểu và không liên quan ví dụ như cho input và output để sinh viên có thể hình dung ra những công việc cần làm .","hơn là hướng dẫn các ví dụ khó hiểu và không liên quan ví dụ như cho input và output để sinh viên có thể hình dung ra những công việc cần làm","hướng dẫn","Support from lecturers","hơn là hướng dẫn các ví dụ khó hiểu và không liên quan","Negative"
"44","thầy nên up bài giảng , bài tập lên courses để sinh viên không cần phải đi xin tài liệu ở những lớp khác .","thầy nên up bài giảng , bài tập lên courses để sinh viên không cần phải đi xin tài liệu ở những lớp khác","bài giảng","Course information","nên up","Neutral"
"45","cần cân bằng giữa lý thuyết và thực hành .","cần cân bằng giữa lý thuyết và thực hành","cân bằng giữa lý thuyết và thực hành","Teaching quality","cần cân bằng","Neutral"
"46","thầy dạy hay và vui .","thầy dạy hay và vui","dạy","Teaching quality","hay và vui","Positive"
"47","giảng viên tận tình , sử dụng giờ dạy hợp lý .","giảng viên tận tình","giảng viên tận tình","Support from lecturers","tận tình","Positive"
"47","giảng viên tận tình , sử dụng giờ dạy hợp lý .","sử dụng giờ dạy hợp lý","sử dụng giờ dạy","Organization and management","hợp lý","Positive"
"48","dạy đến khi các bạn hiểu rõ thì hãy tiếp tục .","dạy đến khi các bạn hiểu rõ thì hãy tiếp tục","dạy","Teaching quality","đến khi các bạn hiểu rõ","Neutral"
"49","thầy thường xuyên theo dõi sinh viên trong quá trình thực hành và giải đáp thắc mắc rất hợp lý .","thầy thường xuyên theo dõi sinh viên trong quá trình thực hành","theo dõi sinh viên","Support from lecturers","thường xuyên","Positive"
"49","thầy thường xuyên theo dõi sinh viên trong quá trình thực hành và giải đáp thắc mắc rất hợp lý ."," và giải đáp thắc mắc rất hợp lý","giải đáp thắc mắc","Support from lecturers","rất hợp lý","Positive"
"50","thầy giảng tập trung nhiều vào bài tập .","thầy giảng tập trung nhiều vào bài tập","giảng","Teaching quality"," tập trung nhiều","Neutral"
"51","cần có nhiều thiết bị trực quan hơn .","cần có nhiều thiết bị trực quan hơn","thiết bị","Learning environment","cần có nhiều","Neutral"
"52","nguyên tắc , phương pháp giảng dạy tốt .","nguyên tắc , phương pháp giảng dạy tốt","phương pháp giảng dạy","Teaching quality","tốt","Positive"
"53","dạy liên tục không ngừng nghỉ làm sinh viên hơi ngán vì phải tập trung liên tục dẫn đến nhiều sinh viên nản gục mặt xuống bàn ngủ .","dạy liên tục không ngừng nghỉ làm sinh viên hơi ngán","dạy","Teaching quality","liên tục không ngừng nghỉ làm sinh viên hơi ngán","Negative"
"53","dạy liên tục không ngừng nghỉ làm sinh viên hơi ngán vì phải tập trung liên tục dẫn đến nhiều sinh viên nản gục mặt xuống bàn ngủ .","vì phải tập trung liên tục dẫn đến nhiều sinh viên nản gục mặt xuống bàn ngủ","tập trung liên tục","Workload","nản gục mặt xuống bàn ngủ","Negative"
"54","bài tập nhiều quá , không phù hợp lắm .","bài tập nhiều quá , không phù hợp lắm","bài tập","Workload","nhiều quá , không phù hợp","Negative"
"55","có chỗ thầy dạy quá kỹ nhưng có chỗ thì lại chỉ nói sơ qua .","có chỗ thầy dạy quá kỹ","dạy","Teaching quality","quá kỹ","Neutral"
"55","có chỗ thầy dạy quá kỹ nhưng có chỗ thì lại chỉ nói sơ qua .","nhưng có chỗ thì lại chỉ nói sơ qua","nói","Teaching quality","sơ qua","Negative"
"56","có các ví dụ thực tiễn .","có các ví dụ thực tiễn ","có các ví dụ thực tiễn","Teaching quality","có","Positive"
"57","thầy wzjwz198 giảng dạy rất nhiệt tình và đầy đủ .","thầy wzjwz198 giảng dạy rất nhiệt tình và đầy đủ","giảng dạy","Teaching quality","rất nhiệt tình và đầy đủ","Positive"
"58","thiếu linh kiện .","thiếu linh kiện","thiếu linh kiện","Learning environment","thiếu","Negative"
"59","giảng viên dạy dễ tiếp thu , slide dễ hiểu , bài tập mức độ vừa phải , giảng viên giải bài tập rất chi tiết , nhiệt tình .","giảng viên dạy dễ tiếp thu","dạy","Teaching quality","dễ tiếp thu","Positive"
"59","giảng viên dạy dễ tiếp thu , slide dễ hiểu , bài tập mức độ vừa phải , giảng viên giải bài tập rất chi tiết , nhiệt tình .","slide dễ hiểu","slide","Course information","dễ hiểu","Positive"
"59","giảng viên dạy dễ tiếp thu , slide dễ hiểu , bài tập mức độ vừa phải , giảng viên giải bài tập rất chi tiết , nhiệt tình .","bài tập mức độ vừa phải","bài tập","Workload","mức độ vừa phải","Positive"
"59","giảng viên dạy dễ tiếp thu , slide dễ hiểu , bài tập mức độ vừa phải , giảng viên giải bài tập rất chi tiết , nhiệt tình .","giảng viên giải bài tập rất chi tiết , nhiệt tình","giải bài tập","Support from lecturers","rất chi tiết , nhiệt tình","Positive"
"60","hi hi đồ ngốc .","hi hi đồ ngốc","hi hi đồ ngốc","General review","hi hi đồ ngốc","Neutral"
"61","nội dung môn học rõ ràng .","nội dung môn học rõ ràng","nội dung môn học","Course information","rõ ràng","Positive"
"62","tận dụng tốt website môn học để chia sẻ tài liệu , thảo luận .","tận dụng tốt website môn học để chia sẻ tài liệu , thảo luận","website môn học","Teaching quality","tận dụng tốt ","Positive"
"63","giảng viên chưa truyền đạt được bài học một cách dễ hiểu .","giảng viên chưa truyền đạt được bài học một cách dễ hiểu","truyền đạt","Teaching quality","chưa truyền đạt được bài học một cách dễ hiểu","Negative"
"64","thầy nói to quá .","thầy nói to quá","nói","Teaching quality","to quá","Negative"
"65","các bài tập wireshark đều là của năm 2007 hết .","các bài tập wireshark đều là của năm 2007 hết","bài tập","Workload","của năm 2007 hết","Neutral"
"66","buổi học buổi không hiệu quả , sinh viên tới trường học mà không thấy giáo viên , nghỉ không thông báo , mà nghỉ mấy nhiểu buổi như vậy , vừa tốn thời gian sinh viên tốn công sức tới trường không thấy giáo viên đâu , ngồi đợi cả buổi không có sinh viên mới bỏ về .","buổi học buổi không hiệu quả","buổi học","Organization and management","không hiệu quả","Negative"
"66","buổi học buổi không hiệu quả , sinh viên tới trường học mà không thấy giáo viên , nghỉ không thông báo , mà nghỉ mấy nhiểu buổi như vậy , vừa tốn thời gian sinh viên tốn công sức tới trường không thấy giáo viên đâu , ngồi đợi cả buổi không có sinh viên mới bỏ về .","sinh viên tới trường học mà không thấy giáo viên","tới trường học mà không thấy giáo viên","Organization and management","không thấy giáo viên","Negative"
"66","buổi học buổi không hiệu quả , sinh viên tới trường học mà không thấy giáo viên , nghỉ không thông báo , mà nghỉ mấy nhiểu buổi như vậy , vừa tốn thời gian sinh viên tốn công sức tới trường không thấy giáo viên đâu , ngồi đợi cả buổi không có sinh viên mới bỏ về .","nghỉ không thông báo","nghỉ ","Organization and management","không thông báo","Negative"
"66","buổi học buổi không hiệu quả , sinh viên tới trường học mà không thấy giáo viên , nghỉ không thông báo , mà nghỉ mấy nhiểu buổi như vậy , vừa tốn thời gian sinh viên tốn công sức tới trường không thấy giáo viên đâu , ngồi đợi cả buổi không có sinh viên mới bỏ về .","mà nghỉ mấy nhiểu buổi như vậy , vừa tốn thời gian sinh viên tốn công sức tới trường không thấy giáo viên đâu , ngồi đợi cả buổi không có sinh viên mới bỏ về","nghỉ mấy nhiểu buổi","Organization and management","ốn thời gian sinh viên tốn công sức","Negative"
"67","nên nêu ví dụ cụ thể dễ hiễu hơn .","nên nêu ví dụ cụ thể dễ hiễu hơn","nêu ví dụ","Teaching quality","nên","Neutral"
"68","thầy ơi , thầy chép ít lại dùm em .","thầy ơi , thầy chép ít lại dùm em","chép","Teaching quality","ít lại","Neutral"
"69","thầy nghiêm túc .","thầy nghiêm túc","thầy nghiêm túc","Teaching quality","nghiêm túc","Neutral"
"70","cô dạy dễ hiểu , dạy kỹ , tận tình , không khí học tập thoải mái .","cô dạy dễ hiểu"," dạy","Teaching quality"," dễ hiểu","Positive"
