"id","Review","Sentence Component","aspect_text","aspect","sentiment_text","sentiment"
"70","cô dạy dễ hiểu , dạy kỹ , tận tình , không khí học tập thoải mái .","dạy kỹ , tận tình","dạy","Teaching quality","kỹ , tận tình","Positive"
"70","cô dạy dễ hiểu , dạy kỹ , tận tình , không khí học tập thoải mái .","không khí học tập thoải mái","không khí học tập","Learning environment","thoải mái","Positive"
"71","giáo viên giảng bài dễ hiểu .","giáo viên giảng bài dễ hiểu","giảng bài","Teaching quality","dễ hiểu","Positive"
"72","giảng viên cần có phương pháp giảng dạy tốt hơn .","giảng viên cần có phương pháp giảng dạy tốt hơn","phương pháp giảng dạy","Teaching quality","cần có","Negative"
"73","phương pháp giảng dạy hay , có nhiều thông tin thực tiễn .","phương pháp giảng dạy hay , có nhiều thông tin thực tiễn","phương pháp giảng dạy","Teaching quality","hay , có nhiều thông tin thực tiễn","Positive"
"74","em rất hài lòng thầy về mọi mặt .","em rất hài lòng thầy về mọi mặt","em rất hài lòng thầy về mọi mặt","General review","hài lòng","Positive"
"75","cô dạy dễ hiểu , ít điểm danh tạo cơ hội tự học cho sinh viên colonsmilesmile , rất tận tình giải thích các thắc mắc cho sinh viên .","cô dạy dễ hiểu"," dạy","Teaching quality","dễ hiểu","Positive"
"75","cô dạy dễ hiểu , ít điểm danh tạo cơ hội tự học cho sinh viên colonsmilesmile , rất tận tình giải thích các thắc mắc cho sinh viên .","ít điểm danh tạo cơ hội tự học cho sinh viên colonsmilesmile","điểm danh","Organization and management"," tạo cơ hội","Positive"
"75","cô dạy dễ hiểu , ít điểm danh tạo cơ hội tự học cho sinh viên colonsmilesmile , rất tận tình giải thích các thắc mắc cho sinh viên .","ít điểm danh tạo cơ hội tự học cho sinh viên colonsmilesmile"," rất tận tình giải thích các thắc mắc cho sinh viên","Support from lecturers"," tạo cơ hội","Positive"
"75","cô dạy dễ hiểu , ít điểm danh tạo cơ hội tự học cho sinh viên colonsmilesmile , rất tận tình giải thích các thắc mắc cho sinh viên ."," rất tận tình giải thích các thắc mắc cho sinh viên","giải thích các thắc mắc ","Support from lecturers"," tận tình","Positive"
"76","lịch học thực hành trùng với lịch học lý thuyết .","lịch học thực hành trùng với lịch học lý thuyết","lịch học","Organization and management","trùng","Negative"
"77","kiến thức xã hội .","kiến thức xã hội ","kiến thức xã hội","General review","kiến thức xã hội","Neutral"
"78","cô có thể nói to hơn một chút được không ạ !","cô có thể nói to hơn một chút được không ạ","nói","Teaching quality","có thể nói to hơn","Neutral"
"79","cô vui tính học rất thoải mái , truyền cảm hứng .","cô vui tính học rất thoải mái , truyền cảm hứng","cô vui tính học rất thoải mái , truyền cảm hứng","Teaching quality","vui tính học rất thoải mái , truyền cảm hứng","Positive"
"80","thầy giúp cho sinh viên hiểu rõ vấn đề để thực hành đúng .","thầy giúp cho sinh viên hiểu rõ vấn đề để thực hành đúng","giúp","Support from lecturers","hiểu rõ","Positive"
"81","sẽ tạo được nhiều hứng thú hơn trong giờ học đòi hỏi nhiều kiến thức chuyên sâu này !","sẽ tạo được nhiều hứng thú hơn trong giờ học đòi hỏi nhiều kiến thức chuyên sâu này","giờ học","Teaching quality","sẽ tạo được nhiều hứng thú hơn","Neutral"
"82","cô dạy hay và nhiệt tình .","cô dạy hay và nhiệt tình","dạy","Teaching quality","hay và nhiệt tình","Positive"
"83","cô rất nhiệt tình và gần gũi với sinh viên .","cô rất nhiệt tình và gần gũi với sinh viên","gần gũi với sinh viên","Support from lecturers","nhiệt tình và gần gũi","Positive"
"84","nên có nhiều thiết bị trực quan hơn .","nên có nhiều thiết bị trực quan hơn ","thiết bị","Learning environment","nên có","Neutral"
"85","giảng viên thực hiện giảng dạy nghiêm túc , dễ hiểu , dễ tiếp thu , có nhiều buổi làm bài tập , sửa bài tập để ôn tập cho các kỳ kiểm tra , nghỉ bù đều có thông báo .","giảng viên thực hiện giảng dạy nghiêm túc , dễ hiểu , dễ tiếp thu","giảng dạy","Teaching quality","nghiêm túc , dễ hiểu , dễ tiếp thu","Positive"
"85","giảng viên thực hiện giảng dạy nghiêm túc , dễ hiểu , dễ tiếp thu , có nhiều buổi làm bài tập , sửa bài tập để ôn tập cho các kỳ kiểm tra , nghỉ bù đều có thông báo .","có nhiều buổi làm bài tập , sửa bài tập để ôn tập cho các kỳ kiểm tra"," làm bài tập","Workload","có nhiều","Positive"
"85","giảng viên thực hiện giảng dạy nghiêm túc , dễ hiểu , dễ tiếp thu , có nhiều buổi làm bài tập , sửa bài tập để ôn tập cho các kỳ kiểm tra , nghỉ bù đều có thông báo .","nghỉ bù đều có thông báo","nghỉ bù","Organization and management","đều có thông báo","Positive"
"86","giảng viên nên cho sinh viên lựa chọn các nền tảng để phát triển game chứ không nhất thiết phải chọn nền tảng directx trên c .","giảng viên nên cho sinh viên lựa chọn các nền tảng để phát triển game chứ không nhất thiết phải chọn nền tảng directx trên c","lựa chọn các nền tảng","Teaching quality","nên cho","Neutral"
"87","giảng viên không nhiệt tình .","giảng viên không nhiệt tình","giảng viên không nhiệt tình","Support from lecturers","không nhiệt tình","Negative"
"88","thầy dạy ngắn gọn , súc tích , dễ hiểu .","thầy dạy ngắn gọn , súc tích , dễ hiểu","dạy","Teaching quality","ngắn gọn , súc tích , dễ hiểu","Positive"
"89","cần wifi mạnh ở dãy nhà cũ .","cần wifi mạnh ở dãy nhà cũ"," wifi","Learning environment","cần wifi mạnh","Neutral"
"90","cần giảng kỹ hơn chút nhưng cũng đừng quá chậm , giảng viên nên quan niệm sinh viên đã đọc sơ bài ở nhà rồi , nên đi sâu vào những ý mới , đặc thù của từng phần .","cần giảng kỹ hơn chút nhưng cũng đừng quá chậm","giảng ","Teaching quality","cần giảng kỹ hơn","Neutral"
"90","cần giảng kỹ hơn chút nhưng cũng đừng quá chậm , giảng viên nên quan niệm sinh viên đã đọc sơ bài ở nhà rồi , nên đi sâu vào những ý mới , đặc thù của từng phần .","giảng viên nên quan niệm sinh viên đã đọc sơ bài ở nhà rồi , nên đi sâu vào những ý mới , đặc thù của từng phần","đi sâu vào những ý mới","Teaching quality"," nên quan niệm sinh viên đã đọc sơ bài ở nhà rồi , nên đi sâu vào những ý mới","Neutral"
"91","khó tiếp thu !","khó tiếp thu","khó tiếp thu","Teaching quality","khó","Negative"
"92","thầy vui tính giảng bài dễ hiểu .","thầy vui tính","thầy vui tính","Support from lecturers","vui tính","Positive"
"92","thầy vui tính giảng bài dễ hiểu .","giảng bài dễ hiểu","giảng bài","Teaching quality","dễ hiểu","Positive"
"93","học thì đơn giản mà sao đề khó quá ạ !","học thì đơn giản mà sao đề khó quá ạ","đề","Test and evaluation","khó","Negative"
"94","thầy dạy vui vẻ , nhiệt tình , hòa đồng , dễ hiểu .","thầy dạy vui vẻ , nhiệt tình , hòa đồng , dễ hiểu","dạy","Teaching quality","vui vẻ , nhiệt tình , hòa đồng , dễ hiểu","Positive"
"95","giảng viên cần thay đổi cách dạy , tích cực hơn thay vì chỉ đọc chép .","giảng viên cần thay đổi cách dạy , tích cực hơn thay vì chỉ đọc chép","cách dạy","Teaching quality","cần thay đổi","Neutral"
"96","giảng viên dạy có nhiều tiết học khá thú vị và thực tế .","giảng viên dạy có nhiều tiết học khá thú vị và thực tế","dạy","Teaching quality","khá thú vị và thực tế","Positive"
"97","đúng giờ , phương pháp tốt .","đúng giờ","đúng giờ","Organization and management","đúng","Positive"
"97","đúng giờ , phương pháp tốt .","phương pháp tốt","phương pháp","Teaching quality","tốt","Positive"
"98","thầy dạy không có hứng , thầy chỉ đọc những gì trên slide và kêu sinh viên chép vào tập .","thầy dạy không có hứng","dạy","Teaching quality","không có hứng","Negative"
"98","thầy dạy không có hứng , thầy chỉ đọc những gì trên slide và kêu sinh viên chép vào tập .","thầy chỉ đọc những gì trên slide và kêu sinh viên chép vào tập","đọc","Teaching quality","chỉ đọc những gì trên slide và kêu sinh viên chép vào tập","Negative"
"99","thưa , thầy dạy rất dễ hiểu và tốc độ vừa phải .","thưa , thầy dạy rất dễ hiểu và tốc độ vừa phải","dạy","Teaching quality","rất dễ hiểu và tốc độ vừa phải","Positive"
"100","cô nhiệt tình và vui vẻ .","cô nhiệt tình và vui vẻ","cô nhiệt tình và vui vẻ","Support from lecturers","nhiệt tình và vui vẻ","Positive"