id,Review,Sentence Component,aspect_text,aspect,sentiment_text,sentiment
86,"thầy rất nhiệt tình , giúp đỡ sinh viên rất nhiều trong quá trình hoàn thành đồ án .",thầy rất nhiệt tình,thầy rất nhiệt tình,Support from lecturers,rất nhiệt tình,Positive
86,"thầy rất nhiệt tình , giúp đỡ sinh viên rất nhiều trong quá trình hoàn thành đồ án .",giúp đỡ sinh viên rất nhiều trong quá trình hoàn thành đồ án,giúp đỡ sinh viên,Support from lecturers,rất nhiều trong quá trình hoàn thành đồ án,Positive
87,"và chuột máy tính trong phòng lab cũng hư khá nhiều , đề nghị nhà trường thay thế để có nhiều máy tính phục vụ học tập cho sinh viên .",và chuột máy tính trong phòng lab cũng hư khá nhiều,chuột máy tính trong phòng lab,Learning environment, cũng hư khá nhiều,Negative
87,"và chuột máy tính trong phòng lab cũng hư khá nhiều , đề nghị nhà trường thay thế để có nhiều máy tính phục vụ học tập cho sinh viên .", đề nghị nhà trường thay thế để có nhiều máy tính phục vụ học tập cho sinh viên,máy tính phục vụ học tập cho sinh viên,Learning environment, đề nghị nhà trường thay thế để có nhiều máy tính phục vụ học tập cho sinh viên,Neutral
88,"giáo viên giảng dạy tận tâm , dễ hiểu , truyền đạt và liên hệ thực tiễn .","giáo viên giảng dạy tận tâm , dễ hiểu",giảng dạy,Teaching quality," tận tâm , dễ hiểu",Positive
88,"giáo viên giảng dạy tận tâm , dễ hiểu , truyền đạt và liên hệ thực tiễn .", truyền đạt và liên hệ thực tiễn,truyền đạt và liên hệ thực tiễn,Teaching quality,truyền đạt và liên hệ thực tiễn,Positive
89,giảng viên tận tụy có tâm huyết đối với sinh viên .,giảng viên tận tụy,giảng viên tận tụy,Teaching quality,tận tụy,Positive
89,giảng viên tận tụy có tâm huyết đối với sinh viên ., có tâm huyết đối với sinh viên,tâm huyết đối với sinh viên,Support from lecturers,có tâm huyết,Positive
90,"giảng viên dạy rất nhiệt tình , tuy nhiên việc dạy quá giờ lên lớp sẽ khiến nhiều sinh viên gặp khó khăn trong việc học , giảng viên dạy vượt qua tiết 4 và 5 khiến nhiều sinh viên phải sang học tiết khác và bỏ qua rất nhiều bài giảng dẫn đến việc học không hiệu quả .",giảng viên dạy rất nhiệt tình,dạy,Teaching quality,rất nhiệt tình,Positive
90,"giảng viên dạy rất nhiệt tình , tuy nhiên việc dạy quá giờ lên lớp sẽ khiến nhiều sinh viên gặp khó khăn trong việc học , giảng viên dạy vượt qua tiết 4 và 5 khiến nhiều sinh viên phải sang học tiết khác và bỏ qua rất nhiều bài giảng dẫn đến việc học không hiệu quả .",", tuy nhiên việc dạy quá giờ lên lớp sẽ khiến nhiều sinh viên gặp khó khăn trong việc học",việc dạy quá giờ lên lớp,Teaching quality,sẽ khiến nhiều sinh viên gặp khó khăn trong việc học,Negative
90,"giảng viên dạy rất nhiệt tình , tuy nhiên việc dạy quá giờ lên lớp sẽ khiến nhiều sinh viên gặp khó khăn trong việc học , giảng viên dạy vượt qua tiết 4 và 5 khiến nhiều sinh viên phải sang học tiết khác và bỏ qua rất nhiều bài giảng dẫn đến việc học không hiệu quả .",giảng viên dạy vượt qua tiết 4 và 5 khiến nhiều sinh viên phải sang học tiết khác và bỏ qua rất nhiều bài giảng dẫn đến việc học không hiệu quả ,giảng viên dạy,Teaching quality,vượt qua tiết 4 và 5 khiến nhiều sinh viên phải sang học tiết khác và bỏ qua rất nhiều bài giảng dẫn đến việc học không hiệu quả,Negative
91,em có suy nghĩ là thầy không tin các bài tập do chính các bạn nữ làm .,em có suy nghĩ là thầy không tin các bài tập do chính các bạn nữ làm ,thầy không tin các bài tập do chính các bạn nữ làm ,Support from lecturers,em có suy nghĩ là thầy không tin các bài tập do chính các bạn nữ làm,Neutral
92,tạo thêm nhiều ví dụ ngoài thực tiễn .,tạo thêm nhiều ví dụ ngoài thực tiễn, ví dụ ngoài thực tiễn,Teaching quality,tạo thêm nhiều ví dụ ngoài thực tiễn,Neutral
93,"giảng viên giảng dạy nhiệt tình , phương pháp dạy hay , chỉ dẫn hiệu quả .",giảng viên giảng dạy nhiệt tình,giảng dạy,Teaching quality,nhiệt tình,Positive
93,"giảng viên giảng dạy nhiệt tình , phương pháp dạy hay , chỉ dẫn hiệu quả .",phương pháp dạy hay,phương pháp dạy,Teaching quality,hay,Positive
93,"giảng viên giảng dạy nhiệt tình , phương pháp dạy hay , chỉ dẫn hiệu quả .",chỉ dẫn hiệu quả,chỉ dẫn,Teaching quality,hiệu quả,Positive
94,không hài lòng điểm gì cả !,không hài lòng điểm gì cả !,không hài lòng điểm gì cả,General review,không hài lòng,Negative
95,"cần có các bài lab thực hành , để sinh viên thành thạo cũng như các thao tác ứng dụng .",cần có các bài lab thực hành,các bài lab thực hành,Workload,"cần có các bài lab thực hành , để sinh viên thành thạo cũng như các thao tác ứng dụng",Neutral
96,cách dạy của thầy wzjwz170 vô cùng chán đối với môn học kỹ năng như thế này .,cách dạy của thầy wzjwz170 vô cùng chán đối với môn học kỹ năng như thế này,cách dạy của thầy,Teaching quality, vô cùng chán,Negative
97,"thầy luôn hướng dẫn sinh viên giải bài tập bằng nhiều cách , suy luận logic .","thầy luôn hướng dẫn sinh viên giải bài tập bằng nhiều cách , suy luận logic","luôn hướng dẫn sinh viên giải bài tập bằng nhiều cách , suy luận logic",Support from lecturers," luôn hướng dẫn sinh viên giải bài tập bằng nhiều cách , suy luận logic",Positive
98,sự nhiệt tình thầy dạy dễ hiểu vui vẻ .,sự nhiệt tình thầy dạy dễ hiểu vui vẻ, thầy dạy ,Teaching quality,sự nhiệt tình thầy dạy dễ hiểu vui vẻ,Positive
99,cần tạo điều kiện cho sinh viên tăng vốn ngoại ngữ giao tiếp .,cần tạo điều kiện cho sinh viên tăng vốn ngoại ngữ giao tiếp,tạo điều kiện cho sinh viên tăng vốn ngoại ngữ giao tiếp,Support from lecturers,cần tạo điều kiện cho sinh viên tăng vốn ngoại ngữ giao tiếp,Neutral
100,"thầy dạy dễ hiểu , dễ tiếp thu .","thầy dạy dễ hiểu , dễ tiếp thu",dạy,Teaching quality,"dễ hiểu , dễ tiếp thu",Positive
