id,Review,Sentence Component,aspect_text,aspect,sentiment_text,sentiment
1284,"cô có khả năng truyền đạt tốt , giảng dạy kết hợp với luyện tập các kỹ năng cơ bản trong môn học rất linh hoạt và hấp dẫn , cô có sự nhiệt tình lớn .",giảng dạy kết hợp với luyện tập các kỹ năng cơ bản trong môn học rất linh hoạt và hấp dẫn,giảng dạy,Teaching quality,linh hoạt và hấp dẫn,Positive
1284,"cô có khả năng truyền đạt tốt , giảng dạy kết hợp với luyện tập các kỹ năng cơ bản trong môn học rất linh hoạt và hấp dẫn , cô có sự nhiệt tình lớn .",cô có sự nhiệt tình lớn,cô có sự nhiệt tình,Support from lecturers,nhiệt tình,Positive
1285,giảng viên dạy rất tận tâm .,giảng viên dạy rất tận tâm,dạy,Teaching quality,tận tâm,Positive
1286,ok hết .,ok hết,ok hết,General review,ok,Positive
1287,mong thầy kiểm duyệt đề thi kỹ hơn trước khi đưa vào làm đề chính thức .,mong thầy kiểm duyệt đề thi kỹ hơn trước khi đưa vào làm đề chính thức,kiểm duyệt đề thi,Test and evaluation,mong thầy kiểm duyệt đề thi kỹ hơn,Negative
1288,về các ví dụ .,về các ví dụ,về các ví dụ,General review,về các ví dụ,Neutral
1289,bằng chứng là kỳ thi cuối kỳ điểm trải dài từ 1 - 5 điểm .,bằng chứng là kỳ thi cuối kỳ điểm trải dài từ 1 - 5 điểm,kỳ thi cuối kỳ điểm trải dài từ 1 - 5 điểm,Test and evaluation,bằng chứng là,Neutral
1290,"giảng bài kỹ , dễ hiểu , nhiệt tình .","giảng bài kỹ , dễ hiểu , nhiệt tình",giảng bài,Teaching quality,"kỹ , dễ hiểu , nhiệt tình",Positive
1291,nên chú trọng hơn về giao tiếp tiếng anh .,nên chú trọng hơn về giao tiếp tiếng anh,chú trọng hơn về giao tiếp tiếng anh,General review,nên,Neutral
1292,thầy dạy rất nhiệt tình luôn luôn xuống giữa lớp để giao tiếp với sinh viên một cách dễ dàng luôn đưa ra những ví dụ xung quanh lớp giúp sinh viên dễ dàng hiểu bài hơn .,thầy dạy rất nhiệt tình luôn luôn xuống giữa lớp để giao tiếp với sinh viên một cách dễ dàng luôn đưa ra những ví dụ xung quanh lớp giúp sinh viên dễ dàng hiểu bài hơn,dạy,Teaching quality,nhiệt tình,Positive
1293,"thầy rất nhiệt tình , giảng rất kỹ càng .",thầy rất nhiệt tình,thầy rất nhiệt tình,Support from lecturers,nhiệt tình,Positive
1293,"thầy rất nhiệt tình , giảng rất kỹ càng .",giảng rất kỹ càng,giảng,Teaching quality,kỹ càng,Positive
1294,"khả năng truyền đạt , giao tiếp rất kém , kiến thức không vững , thiếu khả năng tương tác với sinh viên .","khả năng truyền đạt , giao tiếp rất kém , kiến thức không vững , thiếu khả năng tương tác với sinh viên","khả năng truyền đạt , giao tiếp rất kém , kiến thức không vững , thiếu khả năng tương tác",Teaching quality,"kém , kiến thức không vững , thiếu khả năng tương tác",Negative
1295,giảng viên có tâm .,giảng viên có tâm,giảng viên có tâm,Teaching quality,có tâm,Positive
1296,"giảng viên tận tình , giảng dạy hay , chất lượng .",giảng viên tận tình,giảng viên tận tình,Support from lecturers,tận tình,Positive
1296,"giảng viên tận tình , giảng dạy hay , chất lượng .","giảng dạy hay , chất lượng",giảng dạy,Teaching quality,"hay , chất lượng",Positive
1297,không có ứng dụng trong thực tế .,không có ứng dụng trong thực tế,ứng dụng trong thực tế,Course information,không có,Negative
1298,"thầy rất hay đi trễ , giờ học cũng bị kéo đài ra , những bạn có việc phải bỏ về trước .","thầy rất hay đi trễ , giờ học cũng bị kéo đài ra , những bạn có việc phải bỏ về trước","đi trễ , giờ học cũng bị kéo đài ra",Organization and management,"đi trễ , giờ học cũng bị kéo đài ra",Negative
1299,giáo viên chưa đi sâu vào vấn đề bài học .,giáo viên chưa đi sâu vào vấn đề bài học,đi sâu vào vấn đề bài học,Teaching quality,chưa đi sâu,Negative
1300,thầy không cho làm đồ án .,thầy không cho làm đồ án,làm đồ án,Course information,không cho,Negative
