id,Review,Sentence Component,aspect_text,aspect,sentiment_text,sentiment
87,"giảng viên nhiệt tình , phương pháp dạy khá hay .",giảng viên nhiệt tình,giảng viên nhiệt tình,Support from lecturers,nhiệt tình,Positive
87,"giảng viên nhiệt tình , phương pháp dạy khá hay .",phương pháp dạy khá hay,phương pháp dạy,Teaching quality,khá hay,Positive
88,bài tập còn khó so với lớp yếu tiếng anh .,bài tập còn khó so với lớp yếu tiếng anh,bài tập,Workload,còn khó so với lớp yếu tiếng anh,Negative
89,"đi dạy đúng giờ , dễ hiểu .","đi dạy đúng giờ , dễ hiểu",đi dạy,Teaching quality," đúng giờ , dễ hiểu",Positive
90,cô dạy nhiệt tình hay liên hệ thêm thực tiễn .,cô dạy nhiệt tình hay liên hệ thêm thực tiễ,dạy ,Teaching quality,nhiệt tình,Positive
91,em chỉ có ý kiến là các trang thiết bị trong các phòng học anh văn như vậy là chưa đảm bảo .,em chỉ có ý kiến là các trang thiết bị trong các phòng học anh văn như vậy là chưa đảm bảo ,các trang thiết bị trong các phòng học,Learning environment, chưa đảm bảo ,Negative
92,"tháng học 4 ngày , nghỉ 3 ngày , bù thì trùng lịch 1 lúc 3 môn bắt buộc nghỉ rớt môn .","tháng học 4 ngày , nghỉ 3 ngày , bù thì trùng lịch 1 lúc 3 môn bắt buộc nghỉ rớt môn ","tháng học 4 ngày , nghỉ 3 ngày , bù thì trùng lịch 1 lúc 3 môn bắt buộc nghỉ rớt môn",Organization and management,"tháng học 4 ngày , nghỉ 3 ngày , bù thì trùng lịch 1 lúc 3 môn bắt buộc nghỉ rớt môn",Negative
93,nên bổ sung phần lập trình socket ạ !,nên bổ sung phần lập trình socket ạ,phần lập trình socket,Course information,nên bổ sung,Neutral
94,đảm bảo thời gian .,đảm bảo thời gian, thời gian,Organization and management,đảm bảo,Positive
95,"thầy dạy rất có tâm , dễ hiểu .","thầy dạy rất có tâm , dễ hiểu",dạy ,Teaching quality," rất có tâm , dễ hiểu",Positive
96,cho làm bài kiểm tra thử trước khi thi .,cho làm bài kiểm tra thử trước khi thi,bài kiểm tra thử,Test and evaluation,cho làm bài kiểm tra thử trước khi thi,Positive
97,thầy hiền .,thầy hiền,thầy hiền,Teaching quality, hiền,Positive
98,từ đó bọn em khó mà có được nhiều kiến thức về môn học này .,từ đó bọn em khó mà có được nhiều kiến thức về môn học này,kiến thức về môn học này,Course information, khó mà có được nhiều,Negative
99,cho cực kỳ nhiều bài và cực kỳ khó luôn .,cho cực kỳ nhiều bài và cực kỳ khó luôn,nhiều bài và cực kỳ khó luôn,Workload,cho cực kỳ nhiều bài và cực kỳ khó luôn,Negative
100,không quan tâm đến học sinh .,không quan tâm đến học sinh,quan tâm đến học sinh,Support from lecturers,không quan tâm đến học sinh,Negative
