"id","Review","Sentence Component","aspect_text","aspect","sentiment_text","sentiment"
"82","cách dạy của thầy giúp sinh viên dễ tiếp thu kiến thức , chủ động học tập .","cách dạy của thầy giúp sinh viên dễ tiếp thu kiến thức , chủ động học tập","cách dạy của thầy","Teaching quality","giúp sinh viên dễ tiếp thu kiến thức , chủ động học tập","Positive"
"83","cô cho làm đồ án nhóm với lại cho bài tập theo từng tuần nên sinh viên có thời gian sắp xếp để làm bài .","cô cho làm đồ án nhóm với lại cho bài tập theo từng tuần nên sinh viên có thời gian sắp xếp để làm bài","cô cho làm đồ án nhóm với lại cho bài tập theo từng tuần","Teaching quality","nên sinh viên có thời gian sắp xếp để làm bài","Positive"
"84","tài liệu tìm kiếm còn hạn chế .","tài liệu tìm kiếm còn hạn chế","tài liệu tìm kiếm","Course information","còn hạn chế","Negative"
"85","em rất thích cô , cô dạy hay dễ hiểu .","em rất thích cô","em rất thích cô","General review","em rất thích cô","Positive"
"85","em rất thích cô , cô dạy hay dễ hiểu .","cô dạy hay dễ hiểu"," cô dạy ","Teaching quality","hay dễ hiểu","Positive"
"86","cần có một bộ giáo trình cụ thể cải thiện chất lượng của lớp thực hành .","cần có một bộ giáo trình cụ thể cải thiện chất lượng của lớp thực hành","một bộ giáo trình cụ thể ","Course information","cần có một bộ giáo trình cụ thể cải thiện chất lượng của lớp thực hành","Neutral"
"87","giọng thầy khó nghe rõ .","giọng thầy khó nghe rõ","giọng thầy","General review","khó nghe rõ","Negative"
"88","tập trung thực hành kiến thức trọng tâm của giờ ký thuyết .","tập trung thực hành kiến thức trọng tâm của giờ ký thuyết","tập trung thực hành kiến thức trọng tâm của giờ ký thuyết","Teaching quality","tập trung thực hành kiến thức trọng tâm","Positive"
"89","thiếu nhiệt tình trong giảng dạy , hay có thái độ không tốt nói những điều không hay về sinh viên , tạo áp lực trong giờ học .","thiếu nhiệt tình trong giảng dạy","giảng dạy","Teaching quality","thiếu nhiệt tình","Negative"
"89","thiếu nhiệt tình trong giảng dạy , hay có thái độ không tốt nói những điều không hay về sinh viên , tạo áp lực trong giờ học ."," hay có thái độ không tốt nói những điều không hay về sinh viên , tạo áp lực trong giờ học","hay có thái độ không tốt nói những điều không hay về sinh viên , tạo áp lực trong giờ học","Teaching quality","hay có thái độ không tốt nói những điều không hay về sinh viên , tạo áp lực trong giờ học","Negative"
"90","thầy dạy vui , dễ hiểu , đưa ra nhiều ví dụ cụ thể , lối hướng dẫn sinh động , giúp sinh viên tự tìm hiểu .","thầy dạy vui , dễ hiểu , đưa ra nhiều ví dụ cụ thể","thầy dạy ","Teaching quality","vui , dễ hiểu , đưa ra nhiều ví dụ cụ thể","Positive"
"90","thầy dạy vui , dễ hiểu , đưa ra nhiều ví dụ cụ thể , lối hướng dẫn sinh động , giúp sinh viên tự tìm hiểu .","lối hướng dẫn sinh động , giúp sinh viên tự tìm hiểu","lối hướng dẫn","Support from lecturers","sinh động , giúp sinh viên tự tìm hiểu","Positive"
"91","môn học chỉ nên có một giảng viên đứng lớp để đảm bảo tính liên tục cho bài học .","môn học chỉ nên có một giảng viên đứng lớp để đảm bảo tính liên tục cho bài học","môn học chỉ nên có một giảng viên đứng lớp để đảm bảo tính liên tục cho bài học","General review","môn học chỉ nên có một giảng viên đứng lớp để đảm bảo tính liên tục cho bài học","Neutral"
"92","gần gũi .","gần gũi","gần gũi ","General review","gần gũi","Positive"
"93","cũng như bao đứa sinh viên khác bước vào phòng báo cáo đồ án , tôi cảm thấy rất hồi hộp và lo sợ bởi lẽ đồ án lần này tôi không thật sự code 100% , tôi tham khảo nó từ internet và thay đổi một vài thứ để hoàn chỉnh và chờ đến ngày báo cáo .","cũng như bao đứa sinh viên khác bước vào phòng báo cáo đồ án , tôi cảm thấy rất hồi hộp và lo sợ bởi lẽ đồ án lần này tôi không thật sự code 100% , tôi tham khảo nó từ internet và thay đổi một vài thứ để hoàn chỉnh và chờ đến ngày báo cáo"," báo cáo đồ án ","Test and evaluation","cũng như bao đứa sinh viên khác bước vào phòng báo cáo đồ án , tôi cảm thấy rất hồi hộp và lo sợ bởi lẽ đồ án lần này tôi không thật sự code 100% , tôi tham khảo nó từ internet và thay đổi một vài thứ để hoàn chỉnh và chờ đến ngày báo cáo","Neutral"
"94","giảng dạy hơi dài dòng lan man dẫn đến khó hiểu .","giảng dạy hơi dài dòng lan man dẫn đến khó hiểu","giảng dạy ","Teaching quality","hơi dài dòng lan man dẫn đến khó hiểu","Negative"
"95","nội dung môn học hoàn toàn không giống với phần mô tả vắn tắt nội dung môn học .","nội dung môn học hoàn toàn không giống với phần mô tả vắn tắt nội dung môn học ","nội dung môn học","Course information"," hoàn toàn không giống với phần mô tả vắn tắt nội dung môn học","Negative"
"96","ngôn ngữ dùng để thuyết trình bài học còn hơi khó nghe được vì giảng viên giảng bài bằng tiếng anh .","ngôn ngữ dùng để thuyết trình bài học còn hơi khó nghe được vì giảng viên giảng bài bằng tiếng anh","ngôn ngữ dùng để thuyết trình bài học còn hơi khó nghe được vì giảng viên giảng bài bằng tiếng anh","General review","ngôn ngữ dùng để thuyết trình bài học còn hơi khó nghe được vì giảng viên giảng bài bằng tiếng anh","Negative"
"97","dạy liên hệ thực tế , giảng dễ hiểu .","dạy liên hệ thực tế","dạy ","Teaching quality","liên hệ thực tế","Positive"
"97","dạy liên hệ thực tế , giảng dễ hiểu .","giảng dễ hiểu","giảng ","Teaching quality","dễ hiểu","Positive"
"98","thầy wzjwz44 đừng nên đêm tâm trạng cá nhân vào buổi học , thầy giảng rất nhanh .","thầy wzjwz44 đừng nên đêm tâm trạng cá nhân vào buổi học","thầy wzjwz44 đừng nên đêm tâm trạng cá nhân vào buổi học","Teaching quality","thầy wzjwz44 đừng nên đêm tâm trạng cá nhân vào buổi học","Neutral"
"98","thầy wzjwz44 đừng nên đêm tâm trạng cá nhân vào buổi học , thầy giảng rất nhanh ."," thầy giảng rất nhanh","thầy giảng","Teaching quality"," rất nhanh","Negative"
"99","theo em , giảng đường hơi nóng .","theo em , giảng đường hơi nóng"," giảng đường","Learning environment","hơi nóng","Negative"
"100","wzjwz217 là thầy nào ?","wzjwz217 là thầy nào ","wzjwz217 là thầy nào","General review","wzjwz217 là thầy nào","Neutral"