id,Review,Sentence Component,aspect_text,aspect,sentiment_text,sentiment
1,chưa tương tác tốt với sinh viên qua e-mail .,chưa tương tác tốt với sinh viên qua e-mail , tương tác tốt với sinh viên qua e-mail ,Support from lecturers,chưa tương tác tốt với sinh viên qua e-mail,Negative
2,"rất nhiệt tình vì học sinh , giảng dạy rất hay và hiệu quả .",rất nhiệt tình vì học sinh,rất nhiệt tình vì học sinh,Support from lecturers,rất nhiệt tình vì học sinh,Positive
2,"rất nhiệt tình vì học sinh , giảng dạy rất hay và hiệu quả .",giảng dạy rất hay và hiệu quả,giảng dạy,Teaching quality,rất hay và hiệu quả,Positive
3,ít nhiệt tình trong việc hỗ trợ sinh viên làm đồ án .,ít nhiệt tình trong việc hỗ trợ sinh viên làm đồ án,hỗ trợ sinh viên làm đồ án,Support from lecturers,ít nhiệt tình,Negative
4,cô thường xuyên lên lớp muộn khiến học sinh phải đợi cô .,cô thường xuyên lên lớp muộn khiến học sinh phải đợi cô,cô thường xuyên lên lớp muộn,Organization and management,thường xuyên lên lớp muộn khiến học sinh phải đợi cô,Negative
5,triệu like cho thầy !,triệu like cho thầy ,triệu like cho thầy,General review,triệu like cho thầy,Positive
6,"lên lớp trễ , nghỉ không thấy thông báo .",lên lớp trễ ,lên lớp,Organization and management,trễ,Negative
6,"lên lớp trễ , nghỉ không thấy thông báo .",nghỉ không thấy thông báo,nghỉ ,Organization and management,không thấy thông báo,Negative
7,"để cải tiến chất lượng môn học , em hi vọng nhà trường tăng thời lượng cho môn này , vì thực sự môn này còn nhiều vấn đề nhưng không đủ thời gian để dạy .","để cải tiến chất lượng môn học , em hi vọng nhà trường tăng thời lượng cho môn này",chất lượng môn học,Course information,"để cải tiến chất lượng môn học , em hi vọng nhà trường tăng thời lượng cho môn này",Neutral
7,"để cải tiến chất lượng môn học , em hi vọng nhà trường tăng thời lượng cho môn này , vì thực sự môn này còn nhiều vấn đề nhưng không đủ thời gian để dạy .",vì thực sự môn này còn nhiều vấn đề nhưng không đủ thời gian để dạy,môn này,Course information,còn nhiều vấn đề nhưng không đủ thời gian để dạy,Negative
8,đề nghị thầy đừng nghỉ nhiều quá mất bài của chúng em .,đề nghị thầy đừng nghỉ nhiều quá mất bài của chúng em,đề nghị thầy đừng nghỉ nhiều quá mất bài của chúng em,Organization and management,đề nghị thầy đừng nghỉ nhiều quá mất bài của chúng em,Negative
9,"bài tập đa dạng , mức độ khó dễ khác nhau .","bài tập đa dạng , mức độ khó dễ khác nhau",bài tập,Workload,"đa dạng , mức độ khó dễ khác nhau",Positive
10,thầy chỉ hướng dẫn cách làm bài mặc dù sinh viên không hiểu bản chất của vấn đề .,thầy chỉ hướng dẫn cách làm bài mặc dù sinh viên không hiểu bản chất của vấn đề,hướng dẫn cách làm bài,Teaching quality,thầy chỉ hướng dẫn cách làm bài mặc dù sinh viên không hiểu bản chất của vấn đề,Negative
11,số lượng buổi học hơi ít so với nội dung thực hành .,số lượng buổi học hơi ít so với nội dung thực hành ,nội dung thực hành,Course information,số lượng buổi học hơi ít so với nội dung thực hành,Negative
12,thầy dạy chán chưa thu hút học sinh .,thầy dạy chán chưa thu hút học sinh,dạy,Teaching quality,chán chưa thu hút học sinh,Negative
13,thu hút sinh viên .,thu hút sinh viên,thu hút sinh viên,Teaching quality,thu hút,Positive
14,"trình độ chuyên môn cao , quan tâm nhiều đến sinh viên .",trình độ chuyên môn cao,trình độ chuyên môn,Teaching quality, cao,Positive
14,"trình độ chuyên môn cao , quan tâm nhiều đến sinh viên .",quan tâm nhiều đến sinh viên,quan tâm nhiều đến sinh viên,Support from lecturers,quan tâm nhiều,Positive
15,cung cấp đủ tài liệu để sinh viên tự nghiên cứu .,cung cấp đủ tài liệu để sinh viên tự nghiên cứu,tài liệu để sinh viên tự nghiên cứu,Course information,cung cấp đủ,Positive
16,"thầy giáo sôi nổi truyền đạt kiến thức tốt , gần gũi với học sinh , vui vẻ .",thầy giáo sôi nổi,thầy giáo sôi nổi,Teaching quality, sôi nổ,Positive
16,"thầy giáo sôi nổi truyền đạt kiến thức tốt , gần gũi với học sinh , vui vẻ .","truyền đạt kiến thức tốt , gần gũi với học sinh , vui vẻ ",truyền đạt kiến thức,Teaching quality," tốt , gần gũi với học sinh , vui vẻ ",Positive
17,"cô sẵn sàng giải đáp mọi thắc mắc nhanh nhất có thể , luôn tìm hiểu kỹ nội dung để có thể dạy tốt nhất .",cô sẵn sàng giải đáp mọi thắc mắc nhanh nhất có thể, mọi thắc mắc,Support from lecturers,sẵn sàng giải đáp mọi thắc mắc nhanh nhất có thể,Positive
17,"cô sẵn sàng giải đáp mọi thắc mắc nhanh nhất có thể , luôn tìm hiểu kỹ nội dung để có thể dạy tốt nhất .",luôn tìm hiểu kỹ nội dung để có thể dạy tốt nhất , tìm hiểu kỹ nội dung để có thể dạy tốt nhất ,Teaching quality,uôn tìm hiểu kỹ nội dung để có thể dạy tốt nhất ,Positive
18,"em thấy bất cập là khi giải bài trên bảng ở giảng đường 1 , khoảng cách thì xa trong khi chữ viết của sinh viên lại rất mờ và nhỏ , khó có thể thấy rõ .","em thấy bất cập là khi giải bài trên bảng ở giảng đường 1 , khoảng cách thì xa trong khi chữ viết của sinh viên lại rất mờ và nhỏ , khó có thể thấy rõ ", giảng đường 1,Learning environment,"thấy bất cập là khi giải bài trên bảng ở giảng đường 1 , khoảng cách thì xa trong khi chữ viết của sinh viên lại rất mờ và nhỏ , khó có thể thấy rõ",Negative
19,"dạy dễ hiểu , học sinh tiếp thu tốt .","dạy dễ hiểu , học sinh tiếp thu tốt",dạy,Teaching quality,"dễ hiểu , học sinh tiếp thu tốt",Positive
20,tận tình của giáo viên .,tận tình của giáo viên,tận tình của giáo viên,Support from lecturers,tận tình,Positive
21,bài tập về nhà mức hơi khó .,bài tập về nhà mức hơi khó ,bài tập về nhà,Workload, mức hơi khó ,Negative
22,cần giáo trình và bài tập .,cần giáo trình và bài tập,giáo trình và bài tập,Course information,cần,Neutral
23,chu đáo nhiệt tình .,chu đáo nhiệt tình,chu đáo nhiệt tình,Support from lecturers,chu đáo nhiệt tình,Positive
24,thái độ giảng dạy của giáo viên khá tốt .,thái độ giảng dạy của giáo viên khá tốt,thái độ giảng dạy của giáo viên,Teaching quality, khá tốt,Positive
25,mọi thứ .,mọi thứ,mọi thứ,General review,mọi thứ,Neutral
26,thầy dạy chủ yếu chứng minh công thức có sẵn nên hay mất thời gian và không đưa ra trọng tâm cho sinh viên học !,thầy dạy chủ yếu chứng minh công thức có sẵn nên hay mất thời gian và không đưa ra trọng tâm cho sinh viên học,dạy,Teaching quality,chủ yếu chứng minh công thức có sẵn nên hay mất thời gian và không đưa ra trọng tâm cho sinh viên học,Positive
27,không đảm bảo giờ giấc lên lớp .,không đảm bảo giờ giấc lên lớp,giờ giấc lên lớp,Organization and management,không đảm bảo,Negative
28,"giảng viên nhiệt tình , tận tâm với công việc .",giảng viên nhiệt tình,nhiệt tình,Support from lecturers,nhiệt tình,Positive
28,"giảng viên nhiệt tình , tận tâm với công việc .", tận tâm với công việc,tận tâm với công việc,Teaching quality,tận tâm,Positive
29,nên cung cấp cho sinh viên nhiều kiến thức thực tế qua các bài tập và thực hành .,nên cung cấp cho sinh viên nhiều kiến thức thực tế qua các bài tập và thực hành, cung cấp cho sinh viên nhiều kiến thức thực tế qua các bài tập và thực hành,Teaching quality,nên cung cấp,Neutral
30,"nhiệt tình dạy dễ hiểu , thân thiện hài hước .",nhiệt tình dạy dễ hiểu,dạy,Teaching quality,nhiệt tình dạy dễ hiểu,Positive
30,"nhiệt tình dạy dễ hiểu , thân thiện hài hước .",thân thiện hài hước,thân thiện hài hước,Teaching quality,thân thiện hài hước,Positive
31,giảng viên dạy rất chi tiết và nhiệt tình dành nhiều thời gian giải thích thắc mắc cho sinh viên .,giảng viên dạy rất chi tiết ,dạy,Teaching quality,rất chi tiết,Positive
31,giảng viên dạy rất chi tiết và nhiệt tình dành nhiều thời gian giải thích thắc mắc cho sinh viên ., nhiệt tình dành nhiều thời gian giải thích thắc mắc cho sinh viên,thắc mắc cho sinh viên,Support from lecturers, nhiệt tình dành nhiều thời gian giải thích,Positive
32,"sau mỗi phần lý thuyết thầy đều cho bài tập , bài học trở nên rất dễ hiểu và tạo cơ hội cho sinh viên áp dụng những kiến thức vừa được học .","sau mỗi phần lý thuyết thầy đều cho bài tập , bài học trở nên rất dễ hiểu và tạo cơ hội cho sinh viên áp dụng những kiến thức vừa được học",bài tập,Workload,"sau mỗi phần lý thuyết thầy đều cho bài tập , bài học trở nên rất dễ hiểu và tạo cơ hội cho sinh viên áp dụng những kiến thức vừa được học",Positive
33,cô dạy siêu dễ thương .,cô dạy siêu dễ thương,dạy,Teaching quality, siêu dễ thương,Positive
34,em không hài lòng về cách dạy .,em không hài lòng về cách dạy,cách dạy,Teaching quality, không hài lòng ,Negative
35,"đặc biệt là khi kiểm tra nghe cuối kỳ , có thể ví von âm thanh với máy nổ .","đặc biệt là khi kiểm tra nghe cuối kỳ , có thể ví von âm thanh với máy nổ ",kiểm tra nghe cuối kỳ,Learning environment,có thể ví von âm thanh với máy nổ ,Negative
36,mong thầy càng giảng dạy tốt hơn cho đến sau này !,mong thầy càng giảng dạy tốt hơn cho đến sau này,giảng dạy,Teaching quality,mong thầy càng giảng dạy tốt hơn cho đến sau này,Neutral
37,thầy dạy khá nhanh và khá khó hiểu .,thầy dạy khá nhanh và khá khó hiểu, dạy,Teaching quality, khá nhanh và khá khó hiểu,Negative
38,"thầy wzjwz318 dễ thương , thân thiện với sinh viên , giảng bài dễ hiểu .",thầy wzjwz318 dễ thương,thầy wzjwz318 dễ thương,Teaching quality,dễ thương,Positive
38,"thầy wzjwz318 dễ thương , thân thiện với sinh viên , giảng bài dễ hiểu .",thân thiện với sinh viên,thân thiện với sinh viên,Teaching quality,thân thiện với sinh viên,Positive
38,"thầy wzjwz318 dễ thương , thân thiện với sinh viên , giảng bài dễ hiểu .",giảng bài dễ hiểu,giảng bài,Teaching quality,dễ hiể,Positive
39,khả năng truyền đạt tốt và hướng dẫn cụ thể cho sinh viên .,khả năng truyền đạt tốt ,khả năng truyền đạt,Teaching quality, tốt ,Positive
39,khả năng truyền đạt tốt và hướng dẫn cụ thể cho sinh viên .,hướng dẫn cụ thể cho sinh viên,hướng dẫn cụ thể cho sinh viên,Support from lecturers,hướng dẫn cụ thể cho sinh viên,Positive
40,cô có tâm huyết với nghề .,cô có tâm huyết với nghề,tâm huyết với nghề,Teaching quality,có tâm huyết với nghề,Positive
41,thân thiện .,thân thiện ,thân thiện,Teaching quality,thân thiện,Positive
42,vấn đề điểm kiểm tra cuối kỳ gây nhiều tranh cãi trong sinh viên .,vấn đề điểm kiểm tra cuối kỳ gây nhiều tranh cãi trong sinh viên,vấn đề điểm kiểm tra cuối kỳ,Test and evaluation,gây nhiều tranh cãi trong sinh viên,Negative
43,"các ví dụ về định nghĩa , giao thức , tổ chức mạng của thầy rất gần gũi và dễ hiểu .","các ví dụ về định nghĩa , giao thức , tổ chức mạng của thầy rất gần gũi và dễ hiểu","các ví dụ về định nghĩa , giao thức , tổ chức mạng của thầy",Teaching quality,rất gần gũi và dễ hiểu,Positive
44,em hoàn toàn hài lòng về phương pháp giảng dạy của cô .,em hoàn toàn hài lòng về phương pháp giảng dạy của cô, phương pháp giảng dạy ,Teaching quality,hoàn toàn hài lòng,Positive
45,điểm danh đủ các buổi để tạo công bằng cho sinh viên .,điểm danh đủ các buổi để tạo công bằng cho sinh viên,điểm danh đủ các buổi ,Organization and management, tạo công bằng cho sinh viên,Positive
46,"thầy giáo giảng dạy vui vẻ , áp dụng thực tế .","thầy giáo giảng dạy vui vẻ , áp dụng thực tế",giảng dạy,Teaching quality,"vui vẻ , áp dụng thực tế",Positive
47,thầy wzjwz63 đưa ra những đề tài rất hay .,thầy wzjwz63 đưa ra những đề tài rất hay ,đưa ra những đề tài,Test and evaluation,rất hay,Positive
48,giờ thực hành được tăng cường nhiều hơn nữa .,giờ thực hành được tăng cường nhiều hơn nữa ,giờ thực hành,Course information, được tăng cường nhiều hơn nữa ,Positive
49,thầy rất đẹp trai colonsmile .,thầy rất đẹp trai colonsmile,thầy rất đẹp trai colonsmile,General review, rất đẹp trai colonsmile,Positive
50,thầy dạy rất nhiệt tình và tận tâm chỉ bảo sinh viên .,thầy dạy rất nhiệt tình,dạy ,Teaching quality,rất nhiệt tình,Positive
50,thầy dạy rất nhiệt tình và tận tâm chỉ bảo sinh viên ., tận tâm chỉ bảo sinh viên,chỉ bảo sinh viên,Support from lecturers, tận tâm,Positive
51,"thầy dạy cũng được , có kể vài câu chuyện về kỹ năng sống .","thầy dạy cũng được , có kể vài câu chuyện về kỹ năng sống", dạy,Teaching quality," cũng được , có kể vài câu chuyện về kỹ năng sống",Positive
52,"giảng viên nhiệt tình , giảng giải lý thuyết rõ ràng .",giảng viên nhiệt tình,giảng viên nhiệt tình,Support from lecturers, nhiệt tình,Positive
52,"giảng viên nhiệt tình , giảng giải lý thuyết rõ ràng .",giảng giải lý thuyết rõ ràng,giảng giải lý thuyết,Teaching quality,rõ ràng,Positive
53,thầy wzjwz83 cần nâng cao sự am hiểu về môn học để phục vụ giảng dạy .,thầy wzjwz83 cần nâng cao sự am hiểu về môn học để phục vụ giảng dạy,thầy wzjwz83 cần nâng cao sự am hiểu về môn học để phục vụ giảng dạy,Teaching quality,cần nâng cao sự am hiểu về môn học để phục vụ giảng dạy,Negative
54,"cho nghiên cứu nhiều đề tài khoa học hay , bổ ích .","cho nghiên cứu nhiều đề tài khoa học hay , bổ ích ","nghiên cứu nhiều đề tài khoa học hay , bổ ích",Course information," hay , bổ ích ",Positive
55,giáo viên dạy rất tốt !,giáo viên dạy rất tốt,dạy,Teaching quality, rất tốt,Positive
56,thực hành hình thức 2 giảng viên cần sử dụng thời gian của môn học có hiệu quả và ý nghĩa với học viên .,thực hành hình thức 2 giảng viên cần sử dụng thời gian của môn học có hiệu quả và ý nghĩa với học viên,sử dụng thời gian của môn học,Organization and management,cần sử dụng thời gian của môn học có hiệu quả và ý nghĩa với học viên,Negative
57,cách này không phù hợp với môn học .,cách này không phù hợp với môn học,cách này,Teaching quality, không phù hợp với môn học,Negative
58,hài lòng nhất là đúng giờ .,hài lòng nhất là đúng giờ,đúng giờ,Organization and management,hài lòng nhất là đúng giờ,Positive
59,phát âm tốt và sữa sai khi sinh viên phát âm hoặc viết sai ngữ pháp .,phát âm tốt,phát âm,Teaching quality,tốt,Positive
59,phát âm tốt và sữa sai khi sinh viên phát âm hoặc viết sai ngữ pháp .,sữa sai khi sinh viên phát âm hoặc viết sai ngữ pháp,sữa sai khi sinh viên phát âm hoặc viết sai ngữ pháp,Support from lecturers,sữa sai khi sinh viên phát âm hoặc viết sai ngữ pháp,Positive
60,nên dạy thực tế hơn một chút và máy chiếu nên rõ hơn .,nên dạy thực tế hơn một chút,dạy,Teaching quality,nên dạy thực tế hơn một chút,Neutral
60,nên dạy thực tế hơn một chút và máy chiếu nên rõ hơn .,máy chiếu nên rõ hơn,máy chiếu,Learning environment,nên rõ hơn,Neutral
61,có sự thay đổi giảng viên trong quá trình học làm sinh viên không thích ứng kịp trong quá trình báo cáo làm các bài báo cáo trong thời gian đó nộp không đúng hạn bị trừ điểm .,có sự thay đổi giảng viên trong quá trình học làm sinh viên không thích ứng kịp trong quá trình báo cáo làm các bài báo cáo trong thời gian đó nộp không đúng hạn bị trừ điểm,sự thay đổi giảng viên trong quá trình học,Organization and management,làm sinh viên không thích ứng kịp trong quá trình báo cáo làm các bài báo cáo trong thời gian đó nộp không đúng hạn bị trừ điểm,Negative
62,"đọc slide xong cũng hết giờ và coi như kiến thức đó đã được "" nạp "" .","đọc slide xong cũng hết giờ và coi như kiến thức đó đã được "" nạp """,đọc slide ,Teaching quality,"xong cũng hết giờ và coi như kiến thức đó đã được "" nạp "" ",Negative
63,một số giảng viên khác nên có một số điều giống như cô .,một số giảng viên khác nên có một số điều giống như cô,có một số điều giống như cô,Teaching quality,một số giảng viên khác nên có một số điều giống như cô,Positive
64,"giảng viên thường xuyên không đến lớp mà không thông báo nghỉ học , ảnh hưởng đến hoạt động học tập của sinh viên , vì vậy nhà trường nên nhắc nhở giảng viên về vấn đề này .","giảng viên thường xuyên không đến lớp mà không thông báo nghỉ học , ảnh hưởng đến hoạt động học tập của sinh viên , vì vậy nhà trường nên nhắc nhở giảng viên về vấn đề này",thường xuyên không đến lớp mà không thông báo nghỉ học,Organization and management,ảnh hưởng đến hoạt động học tập của sinh viên,Negative
65,"hướng dẫn tận tiện cho sinh viên về nghề nghiệp tương lai , truyền đạt tốt .",hướng dẫn tận tiện cho sinh viên về nghề nghiệp tương lai,hướng dẫn tận tiện cho sinh viên về nghề nghiệp tương lai,Support from lecturers,hướng dẫn tận tiện,Positive
65,"hướng dẫn tận tiện cho sinh viên về nghề nghiệp tương lai , truyền đạt tốt .",truyền đạt tốt,truyền đạt,Teaching quality, tốt,Positive
66,"giảng viên nhiệt tình , có các hoạt động mang tính làm việc nhóm rất cao .",giảng viên nhiệt tình,giảng viên nhiệt tình,Support from lecturers, nhiệt tình,Positive
66,"giảng viên nhiệt tình , có các hoạt động mang tính làm việc nhóm rất cao .",có các hoạt động mang tính làm việc nhóm rất cao,hoạt động mang tính làm việc nhóm rất cao,Learning environment,có các hoạt động mang tính làm việc nhóm rất cao,Positive
67,"cô giảng nhiệt tình , không gây cảm giác áp lực hay cảm giác chán !","cô giảng nhiệt tình , không gây cảm giác áp lực hay cảm giác chán ",giảng,Teaching quality,"nhiệt tình , không gây cảm giác áp lực hay cảm giác chán ",Positive
68,tụi em cũng là người đóng học phí mà .,tụi em cũng là người đóng học phí mà,tụi em cũng là người đóng học phí mà,General review,tụi em cũng là người đóng học phí mà,Neutral
69,làm nhiều bài tập .,làm nhiều bài tập, bài tập,Workload,làm nhiều,Positive
70,áp dụng .,áp dụng,áp dụng,General review,áp dụng,Neutral
71,đồ án quá khó so với sức của sinh viên .,đồ án quá khó so với sức của sinh viên,đồ án,Test and evaluation,quá khó so với sức của sinh viên,Negative
72,"quá trình giảng dạy luôn lấy ví dụ từ thực tiễn , hài hước tạo nên hứng thú cho sinh viên !",quá trình giảng dạy luôn lấy ví dụ từ thực tiễn,quá trình giảng dạy,Teaching quality,luôn lấy ví dụ từ thực tiễn,Positive
72,"quá trình giảng dạy luôn lấy ví dụ từ thực tiễn , hài hước tạo nên hứng thú cho sinh viên !",hài hước tạo nên hứng thú cho sinh viên,hài hước tạo nên hứng thú cho sinh viên,Teaching quality,hài hước tạo nên hứng thú cho sinh viên,Positive
73,lớp này không phải wzjwz124 hướng dẫn thực hành .,lớp này không phải wzjwz124 hướng dẫn thực hành,lớp này không phải wzjwz124 hướng dẫn thực hành,Organization and management,không phải,Negative
74,"cô dạy dễ hiểu , tận tình .","cô dạy dễ hiểu , tận tình",dạy,Teaching quality,"dễ hiểu , tận tình",Positive
75,môn này là môn em đi học nhiều nhất .,môn này là môn em đi học nhiều nhất,môn này là môn,Course information, em đi học nhiều nhất,Positive
76,cô dạy còn hơi nhanh nhưng tụi em vẫn hiểu .,cô dạy còn hơi nhanh nhưng tụi em vẫn hiểu,dạy,Teaching quality,còn hơi nhanh nhưng tụi em vẫn hiểu,Neutral
77,cách diễn đạt của thầy hay nhưng chưa tạo cảm giác hứng thứ với người nghe .,cách diễn đạt của thầy hay ,cách diễn đạt của thầy,Teaching quality, hay ,Positive
77,cách diễn đạt của thầy hay nhưng chưa tạo cảm giác hứng thứ với người nghe .,chưa tạo cảm giác hứng thứ với người nghe,cảm giác hứng thứ với người nghe,Teaching quality,chưa tạo cảm giác,Negative
78,thực ra em hiểu không nhiều thầy quá đi sâu vào lý thuyết .,thực ra em hiểu không nhiều thầy quá đi sâu vào lý thuyết,thầy quá đi sâu vào lý thuyết,Teaching quality,em hiểu không nhiều,Negative
79,"điều quan trọng là rất chật mà lớp thì đông , làm thầy phải chia ca và có bạn phải làm bài tập ngoài hành lang sau đó mới vào nộp .","điều quan trọng là rất chật mà lớp thì đông , làm thầy phải chia ca và có bạn phải làm bài tập ngoài hành lang sau đó mới vào nộp", lớp ,Learning environment," rất chật mà lớp thì đông , làm thầy phải chia ca và có bạn phải làm bài tập ngoài hành lang sau đó mới vào nộp",Negative
80,"không ít bộ phận giảng viên dạy không đúng giờ , hoặc nghỉ dạy đột suất .","không ít bộ phận giảng viên dạy không đúng giờ , hoặc nghỉ dạy đột suất ","bộ phận giảng viên dạy không đúng giờ , hoặc nghỉ dạy đột suất",Organization and management,"không ít bộ phận giảng viên dạy không đúng giờ , hoặc nghỉ dạy đột suất ",Negative
81,chương trình học quá nhiều và nhiều phần không cần thiết .,chương trình học quá nhiều và nhiều phần không cần thiết,chương trình học,Course information,quá nhiều và nhiều phần không cần thiết,Negative
82,liên hệ thực tế đến các môn lập trình .,liên hệ thực tế đến các môn lập trình ,liên hệ thực tế đến các môn lập trình,Teaching quality,liên hệ thực tế,Positive
83,"em cảm giác như môn vừa học là "" nhập môn lisp và prolog "" .","em cảm giác như môn vừa học là "" nhập môn lisp và prolog "" ","môn vừa học là "" nhập môn lisp và prolog """,Course information,em cảm giác như,Neutral
84,giảng viên chưa phân chia nhóm thực hành hợp lý .,giảng viên chưa phân chia nhóm thực hành hợp lý,phân chia nhóm thực hành,Organization and management,chưa phân chia nhóm thực hành hợp lý,Negative
85,cho điểm thấp .,cho điểm thấp,cho điểm,Test and evaluation,thấp,Negative
86,có cung cấp kiến thức liên quan nhiều hơn so với khi học lý thuyết .,có cung cấp kiến thức liên quan nhiều hơn so với khi học lý thuyết,cung cấp kiến thức liên quan,Teaching quality, nhiều hơn so với khi học lý thuyết,Positive
