"id","Review","Sentence Component","aspect_text","aspect","sentiment_text","sentiment"
"1","thầy dạy nhiệt tình và thân thiện với sinh viên .","thầy dạy nhiệt tình","thầy dạy","Teaching quality"," nhiệt tình","Positive"
"1","thầy dạy nhiệt tình và thân thiện với sinh viên .","thân thiện với sinh viên","thân thiện với sinh viên","General review","thân thiện ","Positive"
"2","không có gì ạ .","không có gì ạ","không có gì ạ","General review","không có gì ạ","Neutral"
"3","giảng hay và rất vui .","giảng hay và rất vui","giảng ","Teaching quality","hay và rất vui","Positive"
"4","giáo án ngắn gọn , dễ hiểu , dạy học nhiệt tình .","giáo án ngắn gọn , dễ hiểu","giáo án ","Course information","ngắn gọn , dễ hiểu","Positive"
"4","giáo án ngắn gọn , dễ hiểu , dạy học nhiệt tình .","dạy học nhiệt tình","dạy học","Teaching quality","nhiệt tình","Positive"
"5","thầy giảng dạy nhiệt tình dễ hiểu , sửa bài tập kỹ .","thầy giảng dạy nhiệt tình dễ hiểu","thầy giảng dạy","Teaching quality","nhiệt tình dễ hiểu","Positive"
"5","thầy giảng dạy nhiệt tình dễ hiểu , sửa bài tập kỹ .","sửa bài tập kỹ","sửa bài tập","Support from lecturers","kỹ","Positive"
"6","môn học vẫn còn là một môn với nhiều lý thuyết trong slide .","môn học vẫn còn là một môn với nhiều lý thuyết trong slide","môn học ","Course information","vẫn còn là một môn với nhiều lý thuyết trong slide","Negative"
"7","mong nhà trường tạo điều kiện cho sinh viên chúng em được nghiên cứu nhiều hơn là phải làm theo .","mong nhà trường tạo điều kiện cho sinh viên chúng em được nghiên cứu nhiều hơn là phải làm theo","tạo điều kiện cho sinh viên chúng em được nghiên cứu nhiều","Course information","hơn là phải làm theo","Negative"
"8","cần tăng số buổi thực hành cũng như trang bị thêm trang thiết bị như mua thêm nhiều switch , router , hub , bridge , trong phòng ngồi học mà ít bụi và nòng đi thì tốt hơn , vdotv .","cần tăng số buổi thực hành ","số buổi thực hành ","Course information","cần tăng ","Negative"
"8","cần tăng số buổi thực hành cũng như trang bị thêm trang thiết bị như mua thêm nhiều switch , router , hub , bridge , trong phòng ngồi học mà ít bụi và nòng đi thì tốt hơn , vdotv ."," cũng như trang bị thêm trang thiết bị như mua thêm nhiều switch , router , hub , bridge , trong phòng ngồi học mà ít bụi và nòng đi thì tốt hơn , vdotv","trang bị thêm trang thiết bị như mua thêm nhiều switch , router , hub , bridge","Learning environment","trang bị thêm trang thiết bị ","Negative"
"9","cần có thêm bài tập về nhà và sửa một vài bài tập đó trên lớp để việc tiếp thu bài được sâu hơn và hiệu quả hơn .","cần có thêm bài tập về nhà ","bài tập về nhà","Workload","cần có thêm","Negative"
"9","cần có thêm bài tập về nhà và sửa một vài bài tập đó trên lớp để việc tiếp thu bài được sâu hơn và hiệu quả hơn .","sửa một vài bài tập đó trên lớp để việc tiếp thu bài được sâu hơn và hiệu quả hơn"," sửa một vài bài tập đó trên lớp","Support from lecturers","sửa một vài bài tập đó trên lớp để việc tiếp thu bài được sâu hơn và hiệu quả hơn","Neutral"
"10","thầy đưa deadline trễ và không rõ ràng .","thầy đưa deadline trễ và không rõ ràng","đưa deadline trễ và không rõ ràng","Organization and management","đưa deadline trễ và không rõ ràng","Negative"
"11","phòng máy vẫn còn nhiều thiếu sót .","phòng máy vẫn còn nhiều thiếu sót","phòng máy ","Learning environment","vẫn còn nhiều thiếu sót","Negative"
"12","lý do doubledot sinh viên mới bắt đầu tiếp cận môn học chưa hiểu rõ các từ chuyên nghành nên không hiểu nội dung bài giảng , dù giảng viên giải thích bằng tiếng việt .","lý do doubledot sinh viên mới bắt đầu tiếp cận môn học chưa hiểu rõ các từ chuyên nghành nên không hiểu nội dung bài giảng , dù giảng viên giải thích bằng tiếng việt","mới bắt đầu tiếp cận môn học chưa hiểu rõ các từ chuyên nghành nên không hiểu nội dung bài giảng , dù giảng viên giải thích bằng tiếng việt","Course information","chưa hiểu rõ các từ chuyên nghành nên không hiểu nội dung bài giảng","Negative"
"13","quá nhiều kiến thức phải học .","quá nhiều kiến thức phải học","kiến thức phải học","Course information","quá nhiều ","Negative"
"14","giảng viên dạy dễ hiểu , dễ tiếp thu .","giảng viên dạy dễ hiểu","giảng viên dạy ","Teaching quality","dễ hiểu","Positive"
"14","giảng viên dạy dễ hiểu , dễ tiếp thu ."," dễ tiếp thu"," dễ tiếp thu","General review"," dễ tiếp thu","Positive"
"15","giảng viên không dạy sinh viên .","giảng viên không dạy sinh viên ","giảng viên","Teaching quality","không dạy sinh viên ","Negative"
"16","không quan tâm đến sinh viên .","không quan tâm đến sinh viên","không quan tâm đến sinh viên","Support from lecturers","không ","Negative"
"17","cách truyền đạt của giảng viên không được thu hút sinh viên lắm ạ .","cách truyền đạt của giảng viên không được thu hút sinh viên lắm ạ ","cách truyền đạt của giảng viên","Teaching quality","không được thu hút sinh viên lắm","Negative"
"18","em đã nán lại thêm nhưng thầy đi qua đi lại bảo 2 , 3 lần nên em đã về .","em đã nán lại thêm nhưng thầy đi qua đi lại bảo 2 , 3 lần nên em đã về"," thầy đi qua đi lại bảo 2 , 3 lần","Teaching quality"," nhưng","Negative"
"19","có nhiều chỗ hơi khó hiểu trong khi thầy dạy nhưng thầy không giải thích nhiều .","có nhiều chỗ hơi khó hiểu trong khi thầy dạy nhưng thầy không giải thích nhiều","thầy dạy","Teaching quality","nhưng thầy không giải thích nhiều","Negative"
"20","bài giảng thu hút , dễ hiểu .","bài giảng thu hút , dễ hiểu","bài giảng ","Course information","thu hút , dễ hiểu","Positive"
"21","giọng của thầy không được hay lắm .","giọng của thầy không được hay lắm","giọng của thầy","General review","không được hay lắm","Negative"
"22","giảng viến quan tâm nhiều đến sinh viên .","giảng viến quan tâm nhiều đến sinh viên","giảng viến","Support from lecturers","quan tâm nhiều đến sinh viên","Positive"
"23","giảng viên tận tụy , giảng dạy dễ hiểu có vận dụng các bài học vào thực tiễn , giúp sinh viên nắm rõ ràng và đầy đủ kiến thức .","giảng viên tận tụy , giảng dạy dễ hiểu "," giảng dạy","Teaching quality"," tận tụy , giảng dạy dễ hiểu","Positive"
"23","giảng viên tận tụy , giảng dạy dễ hiểu có vận dụng các bài học vào thực tiễn , giúp sinh viên nắm rõ ràng và đầy đủ kiến thức .","có vận dụng các bài học vào thực tiễn , giúp sinh viên nắm rõ ràng và đầy đủ kiến thức","vận dụng các bài học vào thực tiễn","Course information","giúp sinh viên nắm rõ ràng và đầy đủ kiến thức","Positive"
"24","giảng viên giảng dạy nhiệt tình , chi tiết , slide bài giảng và bài tập đầy đủ .","giảng viên giảng dạy nhiệt tình , chi tiết","giảng viên giảng dạy","Teaching quality"," nhiệt tình , chi tiết","Positive"
"24","giảng viên giảng dạy nhiệt tình , chi tiết , slide bài giảng và bài tập đầy đủ .","slide bài giảng và bài tập đầy đủ","slide bài giảng và bài tập","Course information","đầy đủ","Positive"
"25","chúc cô thành công !","chúc cô thành công","chúc cô thành công","General review","chúc cô thành công","Positive"
"26","giảng bài khá nhanh .","giảng bài khá nhanh","giảng bài","Teaching quality","khá nhanh","Negative"
"27","nghe kể chuyện hay nhiều trong khi học .","nghe kể chuyện hay nhiều trong khi học","nghe kể chuyện","Support from lecturers"," hay nhiều","Positive"
"28","dạy dễ hiểu , nhiệt tình , vui tính .","dạy dễ hiểu , nhiệt tình , vui tính","dạy ","Teaching quality","dễ hiểu , nhiệt tình , vui tính","Positive"
"29","bài tập thầy cho khá hay và dễ hiểu bài .","bài tập thầy cho khá hay và dễ hiểu bài ","bài tập thầy cho","Workload","khá hay và dễ hiểu bài ","Positive"
"30","theo ý kiến chủ quan của em , việc giảng dạy hoàn toàn bằng tiếng anh cho lớp chất lượng cao là rất thiết thực , nhưng với trình độ tiếng anh hiện nay của lớp thì hiệu quả học tập của lớp vẫn còn kém .","theo ý kiến chủ quan của em ","theo ý kiến chủ quan của em ","General review","theo ý kiến chủ quan của em ","Neutral"
"30","theo ý kiến chủ quan của em , việc giảng dạy hoàn toàn bằng tiếng anh cho lớp chất lượng cao là rất thiết thực , nhưng với trình độ tiếng anh hiện nay của lớp thì hiệu quả học tập của lớp vẫn còn kém ."," việc giảng dạy hoàn toàn bằng tiếng anh cho lớp chất lượng cao là rất thiết thực","giảng dạy hoàn toàn bằng tiếng anh cho lớp chất lượng cao","Course information","là rất thiết thực","Positive"
"30","theo ý kiến chủ quan của em , việc giảng dạy hoàn toàn bằng tiếng anh cho lớp chất lượng cao là rất thiết thực , nhưng với trình độ tiếng anh hiện nay của lớp thì hiệu quả học tập của lớp vẫn còn kém .","nhưng với trình độ tiếng anh hiện nay của lớp thì hiệu quả học tập của lớp vẫn còn kém"," trình độ tiếng anh hiện nay của lớp","General review","hiệu quả học tập của lớp vẫn còn kém","Negative"
"31","đôi khi dạy hơi chán , không thu hút được chú ý của học sinh .","đôi khi dạy hơi chán , không thu hút được chú ý của học sinh","dạy ","Teaching quality","hơi chán , không thu hút được chú ý của học sinh","Negative"
"32","ra đề thi giữa kỳ không bám sát vào bài tập đã làm trên lớp .","ra đề thi giữa kỳ không bám sát vào bài tập đã làm trên lớp","đề thi giữa kỳ ","Test and evaluation","không bám sát vào bài tập đã làm trên lớp","Negative"
"33","giảng viên nên cho bài tập về nhà có nhưng chưa hợp lý , giảng viên nên giành chút thời gian sưu tầm bài tập từ dễ nhất đến khó nhất mỗi chương khoảng 30 bài nhất là các bài có thể thi .","giảng viên nên cho bài tập về nhà có nhưng chưa hợp lý ","bài tập về nhà ","Workload","có nhưng chưa hợp lý","Negative"
"33","giảng viên nên cho bài tập về nhà có nhưng chưa hợp lý , giảng viên nên giành chút thời gian sưu tầm bài tập từ dễ nhất đến khó nhất mỗi chương khoảng 30 bài nhất là các bài có thể thi .","giảng viên nên giành chút thời gian sưu tầm bài tập từ dễ nhất đến khó nhất mỗi chương khoảng 30 bài nhất là các bài có thể thi","giảng viên nên giành chút thời gian sưu tầm bài tập ","Support from lecturers","nên giành chút thời gian sưu tầm bài tập ","Negative"
"34","thầy cần tương tác nhiều với sinh viên .","thầy cần tương tác nhiều với sinh viên ","tương tác","Support from lecturers","cần tương tác nhiều","Negative"
"35","thầy nên chú trọng đến truyền đạt cho sinh viên nhiều hơn .","thầy nên chú trọng đến truyền đạt cho sinh viên nhiều hơn","truyền đạt cho sinh viên","Teaching quality","nên chú trọng","Negative"
"36","tuy nhiên , bài giảng của thầy chưa được bài bản lắm , có phần hơi tùy hứng .","tuy nhiên , bài giảng của thầy chưa được bài bản lắm , có phần hơi tùy hứng","bài giảng của thầy","Course information","chưa được bài bản lắm , có phần hơi tùy hứng","Negative"
"37","cô rất dễ thương , hiền nữa .","cô rất dễ thương , hiền nữa ","cô rất dễ thương , hiền nữa","General review","rất dễ thương , hiền","Positive"
"38","thầy vui vẻ , dạy dễ hiểu .","thầy vui vẻ","thầy vui vẻ","General review","vui vẻ","Positive"
"38","thầy vui vẻ , dạy dễ hiểu ."," dạy dễ hiểu","dạy ","Teaching quality","dễ hiểu","Positive"
"39","giảng viên trình bày slide dễ hiểu , bài tập mức độ vừa phải , chữa bài tập chi tiết , đầy đủ , nhiệt tình .","giảng viên trình bày slide dễ hiểu ","giảng viên trình bày slide","Teaching quality","dễ hiểu","Positive"
"39","giảng viên trình bày slide dễ hiểu , bài tập mức độ vừa phải , chữa bài tập chi tiết , đầy đủ , nhiệt tình .","bài tập mức độ vừa phải","bài tập ","Workload","mức độ vừa phải ","Positive"
"39","giảng viên trình bày slide dễ hiểu , bài tập mức độ vừa phải , chữa bài tập chi tiết , đầy đủ , nhiệt tình .","chữa bài tập chi tiết , đầy đủ , nhiệt tình","chữa bài tập","Support from lecturers","chi tiết , đầy đủ , nhiệt tình","Positive"
"40","thầy rất nhiệt tình , rất quan tâm đến sinh viên .","thầy rất nhiệt tình , rất quan tâm đến sinh viên","thầy","Support from lecturers","rất nhiệt tình , rất quan tâm đến sinh viên","Positive"
"41","giảng viên chỉ nói những gì có trong slide bài giảng mà không giảng thêm .","giảng viên chỉ nói những gì có trong slide bài giảng mà không giảng thêm ","giảng viên chỉ nói những gì có trong slide bài giảng","Teaching quality","mà không giảng thêm","Negative"
"42","hỏi cũng không nhận được câu trả lời chính xác để học .","hỏi cũng không nhận được câu trả lời chính xác để học","câu trả lời chính xác","Support from lecturers"," không nhận được","Negative"
"43","thầy cô nên đưa thêm các đoạn video ngắn để luyện cho học sinh cách nghe được tốt hơn .","thầy cô nên đưa thêm các đoạn video ngắn để luyện cho học sinh cách nghe được tốt hơn ","thầy cô nên đưa thêm các đoạn video ngắn để luyện cho học sinh cách nghe được tốt hơn","General review","nên đưa thêm","Negative"
"44","nội dung nói hay .","nội dung nói hay","nội dung nói","Course information","hay","Positive"
"45","đề thi thì trong vòng 90 phút phải code hoàn chính game 2048 .","đề thi thì trong vòng 90 phút phải code hoàn chính game 2048","đề thi","Test and evaluation","đề thi thì trong vòng 90 phút phải code hoàn chính game 2048","Neutral"
"46","thầy chú trọng trọng tâm và luôn kể chuyện vui .","thầy chú trọng trọng tâm và luôn kể chuyện vui ","thầy chú trọng trọng tâm và luôn kể chuyện vui","General review","chú trọng trọng tâm và luôn kể chuyện vui","Positive"
"47","là người giáo viên quan tâm tới sinh viên nhiều nhất từng biết , giảng dạy tân tình từng chút một , dễ hiểu , lắng nghe sinh viên , tài liệu cập nhật đầy đủ ngay sau buổi học , nhờ đó sinh viên dù tư duy kém nhưng vẫn theo kịp chứ không nản , bỏ bê , ngủ như mấy môn khác .","là người giáo viên quan tâm tới sinh viên nhiều nhất từng biết","người giáo viên ","Support from lecturers","quan tâm tới sinh viên nhiều nhất ","Positive"
"47","là người giáo viên quan tâm tới sinh viên nhiều nhất từng biết , giảng dạy tân tình từng chút một , dễ hiểu , lắng nghe sinh viên , tài liệu cập nhật đầy đủ ngay sau buổi học , nhờ đó sinh viên dù tư duy kém nhưng vẫn theo kịp chứ không nản , bỏ bê , ngủ như mấy môn khác .","giảng dạy tân tình từng chút một , dễ hiểu","giảng dạy ","Teaching quality"," tân tình từng chút một , dễ hiểu","Positive"
"47","là người giáo viên quan tâm tới sinh viên nhiều nhất từng biết , giảng dạy tân tình từng chút một , dễ hiểu , lắng nghe sinh viên , tài liệu cập nhật đầy đủ ngay sau buổi học , nhờ đó sinh viên dù tư duy kém nhưng vẫn theo kịp chứ không nản , bỏ bê , ngủ như mấy môn khác .","lắng nghe sinh viên","lắng nghe sinh viên","Support from lecturers","lắng nghe sinh viên ","Positive"
"47","là người giáo viên quan tâm tới sinh viên nhiều nhất từng biết , giảng dạy tân tình từng chút một , dễ hiểu , lắng nghe sinh viên , tài liệu cập nhật đầy đủ ngay sau buổi học , nhờ đó sinh viên dù tư duy kém nhưng vẫn theo kịp chứ không nản , bỏ bê , ngủ như mấy môn khác .","tài liệu cập nhật đầy đủ ngay sau buổi học","tài liệu ","Course information","cập nhật đầy đủ","Positive"
"47","là người giáo viên quan tâm tới sinh viên nhiều nhất từng biết , giảng dạy tân tình từng chút một , dễ hiểu , lắng nghe sinh viên , tài liệu cập nhật đầy đủ ngay sau buổi học , nhờ đó sinh viên dù tư duy kém nhưng vẫn theo kịp chứ không nản , bỏ bê , ngủ như mấy môn khác .","nhờ đó sinh viên dù tư duy kém nhưng vẫn theo kịp chứ không nản , bỏ bê , ngủ như mấy môn khác"," nhờ đó sinh viên dù tư duy kém nhưng vẫn theo kịp chứ không nản , bỏ bê , ngủ như mấy môn khác","General review"," nhờ đó sinh viên dù tư duy kém nhưng vẫn theo kịp chứ không nản , bỏ bê , ngủ như mấy môn khác","Positive"
"48","rất nhiệt tình giúp đỡ sinh viên , cách giảng dạy hay .","rất nhiệt tình giúp đỡ sinh viên"," giúp đỡ sinh viên","Support from lecturers","rất nhiệt tình","Positive"
"48","rất nhiệt tình giúp đỡ sinh viên , cách giảng dạy hay .","cách giảng dạy hay","cách giảng dạy ","Teaching quality"," hay","Positive"
"49","nhiều kiến thức hơn .","nhiều kiến thức hơn","kiến thức","Course information","nhiều kiến thức hơn","Neutral"
"50","cần tạo kênh liên lạc giữa sinh viên và giảng viên để sinh viên có thể nhận được thông báo từ giảng viên .","cần tạo kênh liên lạc giữa sinh viên và giảng viên để sinh viên có thể nhận được thông báo từ giảng viên","kênh liên lạc giữa sinh viên và giảng viên","Course information","cần tạo ","Negative"
"51","tâm huyết nhiệt tình chu đáo .","tâm huyết nhiệt tình chu đáo","tâm huyết nhiệt tình chu đáo","Teaching quality","tâm huyết nhiệt tình chu đáo","Positive"
"52","nhờ cô em hiểu hơn về nội dung bài học và có động lực hơn .","nhờ cô em hiểu hơn về nội dung bài học và có động lực hơn","nhờ cô ","Teaching quality","hiểu hơn về nội dung bài học và có động lực hơn","Positive"
"53","thầy dạy nhiệt tình , đầu tư cho sinh viên đi tham quan thực tế .","thầy dạy nhiệt tình","thầy dạy","Teaching quality"," nhiệt tình","Positive"
"53","thầy dạy nhiệt tình , đầu tư cho sinh viên đi tham quan thực tế .","đầu tư cho sinh viên đi tham quan thực tế ","cho sinh viên đi tham quan thực tế","Course information","đầu tư","Positive"
"54","slide bài giảng cần chậm hơn , nhất là những chương cuối !","slide bài giảng cần chậm hơn , nhất là những chương cuối ","slide bài giảng","Course information","cần chậm hơn ","Negative"
"55","thầy đi trễ , không cho sinh viên làm bài tập nhiều trên lớp , một dạng bài nào đó thầy nói qua rồi thì cho qua luôn .","thầy đi trễ ","thầy đi trễ ","Organization and management","đi trễ","Negative"
"55","thầy đi trễ , không cho sinh viên làm bài tập nhiều trên lớp , một dạng bài nào đó thầy nói qua rồi thì cho qua luôn .","không cho sinh viên làm bài tập nhiều trên lớp","làm bài tập nhiều trên lớp","Course information","không cho","Negative"
"55","thầy đi trễ , không cho sinh viên làm bài tập nhiều trên lớp , một dạng bài nào đó thầy nói qua rồi thì cho qua luôn .","một dạng bài nào đó thầy nói qua rồi thì cho qua luôn","thầy","Teaching quality","nói qua rồi thì cho qua luôn","Negative"
"56","thầy giảng bài kỹ !","thầy giảng bài kỹ","thầy giảng bài","Teaching quality"," kỹ","Positive"
"57","phần thực hành và lý thuyết phải đi cùng tiến độ .","phần thực hành và lý thuyết phải đi cùng tiến độ","phần thực hành và lý thuyết","Course information","phải đi cùng tiến độ","Negative"
"58","thầy liên hệ thực tiễn rất nhiều .","thầy liên hệ thực tiễn rất nhiều","thầy liên hệ thực tiễn","Teaching quality","rất nhiều","Positive"
"59","thầy chưa biết sử dụng hệ thống courses để thông báo tin tức cho học sinh .","thầy chưa biết sử dụng hệ thống courses để thông báo tin tức cho học sinh","sử dụng hệ thống courses để thông báo tin tức cho học sinh","Teaching quality","chưa biết","Negative"
"60","giảng viên nhiệt tình và tận tâm với sinh viên .","giảng viên nhiệt tình và tận tâm với sinh viên","giảng viên","Teaching quality","nhiệt tình và tận tâm ","Positive"
"61","giáo viên gửi tài liệu hơi chậm .","giáo viên gửi tài liệu hơi chậm"," gửi tài liệu ","Organization and management","hơi chậm","Negative"
"62","giảng viên thân thiện , nhiệt tình trong giảng dạy .","giảng viên thân thiện , nhiệt tình trong giảng dạy"," giảng dạy","Teaching quality","thân thiện , nhiệt tình","Positive"
"63","cho bài tập về thì chỉ biết kêu là làm đi và không hỗ trợ gì nhiều .","cho bài tập về thì chỉ biết kêu là làm đi và không hỗ trợ gì nhiều","hỗ trợ","Support from lecturers","không hỗ trợ gì nhiều","Negative"
"64","đặc thù môn học là phải ghi phấn , nên tiết bài tập tuyệt đối không nên sử dụng máy chiếu để giảng !","đặc thù môn học là phải ghi phấn","đặc thù môn học","Course information"," là phải ghi phấn","Neutral"
"64","đặc thù môn học là phải ghi phấn , nên tiết bài tập tuyệt đối không nên sử dụng máy chiếu để giảng !","nên tiết bài tập tuyệt đối không nên sử dụng máy chiếu để giảng","sử dụng máy chiếu để giảng","Teaching quality","tuyệt đối không nên ","Negative"
"65","thật sự anh văn là một môn rất quan trọng trong lĩnh vực công việc và học tập .","thật sự anh văn là một môn rất quan trọng trong lĩnh vực công việc và học tập"," anh văn","Course information","là một môn rất quan trọng ","Positive"
"66","cô wzjwz93 giảng bài rất hay .","cô wzjwz93 giảng bài rất hay","cô wzjwz93 giảng bài","Teaching quality","rất hay","Positive"
"67","cô dạy rất nhiệt tình , có tâm với nghề , đề nghị trường khen thưởng và tìm kiếm những giảng viên khác như cô .","cô dạy rất nhiệt tình , có tâm với nghề","cô dạy","Teaching quality","rất nhiệt tình , có tâm với nghề","Positive"
"67","cô dạy rất nhiệt tình , có tâm với nghề , đề nghị trường khen thưởng và tìm kiếm những giảng viên khác như cô ."," đề nghị trường khen thưởng và tìm kiếm những giảng viên khác như cô","đề nghị trường khen thưởng và tìm kiếm những giảng viên khác như cô","General review","đề nghị trường khen thưởng và tìm kiếm những giảng viên khác như cô","Positive"
"68","thầy cực kỳ tận tâm và cực kỳ nhiệt tình .","thầy cực kỳ tận tâm","thầy ","Teaching quality","cực kỳ tận tâm","Positive"
"68","thầy cực kỳ tận tâm và cực kỳ nhiệt tình .","cực kỳ nhiệt tình","cực kỳ nhiệt tình","Support from lecturers","cực kỳ nhiệt tình","Positive"
