"id","Review","Sentence Component","aspect_text","aspect","sentiment_text","sentiment"
"69","cập nhật những đổi mới về môn học , nên có chương trình đào tạo phù hợp hơn .","cập nhật những đổi mới về môn học","cập nhật những đổi mới về môn học","Organization and management","cập nhật những đổi mới về môn học","Neutral"
"69","cập nhật những đổi mới về môn học , nên có chương trình đào tạo phù hợp hơn .","nên có chương trình đào tạo phù hợp hơn","chương trình đào tạo","Course information","phù hợp hơn","Negative"
"70","giảng lý thuyết hơi khó hiểu .","giảng lý thuyết hơi khó hiểu","giảng lý thuyết","Teaching quality","hơi khó hiểu","Negative"
"71","giảng viên nên hạn chế dùng slide , hướng dẫn cụ thể hơn cho sinh viên .","giảng viên nên hạn chế dùng slide , hướng dẫn cụ thể hơn cho sinh viên","giảng viên nên hạn chế dùng slide , hướng dẫn cụ thể hơn cho sinh viên","General review","giảng viên nên hạn chế dùng slide , hướng dẫn cụ thể hơn cho sinh viên","Neutral"
"72","điểm danh đúng giờ .","điểm danh đúng giờ","điểm danh","Teaching quality","đúng giờ","Positive"
"73","thầy dạy khá tốt .","thầy dạy khá tốt","thầy dạy","Teaching quality"," khá tốt","Positive"
"74","em xin nhà trường xem lại bài thi anh văn đầu vào .","em xin nhà trường xem lại bài thi anh văn đầu vào","bài thi anh văn đầu vào","Test and evaluation","nhà trường xem lại ","Negative"
"75","cứ mỗi khi có thắc mắc thì lại không thể tìm thấy giáo viên thực hành để được giải đáp .","cứ mỗi khi có thắc mắc thì lại không thể tìm thấy giáo viên thực hành để được giải đáp"," giáo viên thực hành","Support from lecturers","không thể tìm thấy giáo viên thực hành để được giải đáp","Negative"
"76","cô wzjwz304 rất tận tâm , nhiệt tình giảng dạy , giải đáp thắc mắc rất cụ thể .","cô wzjwz304 rất tận tâm , nhiệt tình giảng dạy"," giảng dạy","Teaching quality","rất tận tâm , nhiệt tình","Positive"
"76","cô wzjwz304 rất tận tâm , nhiệt tình giảng dạy , giải đáp thắc mắc rất cụ thể ."," giải đáp thắc mắc rất cụ thể","giải đáp thắc mắc","Support from lecturers","rất cụ thể","Positive"
"77","cô cho bài tập về nhà hơi nhiều .","cô cho bài tập về nhà hơi nhiều","bài tập về nhà","Workload","hơi nhiều","Negative"
"78","nội dung lan man , khó áp dụng vào thực tế .","nội dung lan man , khó áp dụng vào thực tế","nội dung ","Course information","lan man , khó áp dụng vào thực tế","Negative"
"79","thầy dễ thương , đẹp trai , kiến thức chuyên môn cao , tận tâm , nhiệt tình trả lời thắc mắc của sinh viên , em yêu thầy , hy vọng được gặp thầy ở các môn học sau .","thầy dễ thương , đẹp trai , kiến thức chuyên môn cao , tận tâm , nhiệt tình trả lời thắc mắc của sinh viên , em yêu thầy , hy vọng được gặp thầy ở các môn học sau ","thầy dễ thương , đẹp trai , kiến thức chuyên môn cao , tận tâm , nhiệt tình trả lời thắc mắc của sinh viên , em yêu thầy , hy vọng được gặp thầy ở các môn học sau","General review","thầy dễ thương , đẹp trai , kiến thức chuyên môn cao , tận tâm , nhiệt tình trả lời thắc mắc của sinh viên , em yêu thầy , hy vọng được gặp thầy ở các môn học sau","Positive"
"80","cô rất rất nhiệt tình và tận tâm , sẵn sàng giải thích các vấn đề thắc mắc cho sinh viên .","cô rất rất nhiệt tình và tận tâm","cô ","Teaching quality","rất rất nhiệt tình và tận tâm","Positive"
"80","cô rất rất nhiệt tình và tận tâm , sẵn sàng giải thích các vấn đề thắc mắc cho sinh viên .","sẵn sàng giải thích các vấn đề thắc mắc cho sinh viên ","giải thích các vấn đề thắc mắc cho sinh viên","Support from lecturers","sẵn sàng","Positive"
"81","thầy dạy rất nhiệt tình và sẵn sàng giải đáp thắc mắc .","thầy dạy rất nhiệt tình","thầy dạy","Teaching quality"," rất nhiệt tình","Positive"
"81","thầy dạy rất nhiệt tình và sẵn sàng giải đáp thắc mắc .","sẵn sàng giải đáp thắc mắc"," giải đáp thắc mắc","Support from lecturers","sẵn sàng","Positive"
"82","thú vị , cải thiện khả năng giao tiếp bằng tiếng anh .","thú vị , cải thiện khả năng giao tiếp bằng tiếng anh","khả năng giao tiếp bằng tiếng anh","Course information","thú vị , cải thiện ","Positive"
"83","chúc thầy thành công .","chúc thầy thành công","chúc thầy thành công","General review","thành công","Positive"
"84","đối với em thì cách thầy giảng khá là dễ hiểu nên thầy đừng lo quá về vấn đề đó ạ , với lại sinh viên đa phần thụ động nên nếu không hiểu lại càng không dám hỏi .","đối với em thì cách thầy giảng khá là dễ hiểu nên thầy đừng lo quá về vấn đề đó ạ","cách thầy giảng ","Teaching quality","khá là dễ hiểu","Positive"
"84","đối với em thì cách thầy giảng khá là dễ hiểu nên thầy đừng lo quá về vấn đề đó ạ , với lại sinh viên đa phần thụ động nên nếu không hiểu lại càng không dám hỏi ."," với lại sinh viên đa phần thụ động nên nếu không hiểu lại càng không dám hỏi ","sinh viên đa phần thụ động nên nếu không hiểu lại càng không dám hỏi ","General review","thụ động nên nếu không hiểu lại càng không dám hỏi","Negative"
"85","giảng viên nhiệt tình thân thiện , vui tính , trình độ cao .","giảng viên nhiệt tình thân thiện , vui tính , trình độ cao","giảng viên ","Teaching quality","nhiệt tình thân thiện , vui tính , trình độ cao","Positive"
"86","giảng viên giúp sinh viên nắm bắt được những kỹ năng làm việc nhóm cơ bản .","giảng viên giúp sinh viên nắm bắt được những kỹ năng làm việc nhóm cơ bản","giảng viên","Teaching quality","giúp sinh viên","Positive"
"87","tận tình , nhiệt tình giúp đỡ sinh viên .","tận tình , nhiệt tình giúp đỡ sinh viên","giúp đỡ sinh viên","Support from lecturers","tận tình , nhiệt tình","Positive"
"88","cô dạy nhiệt tình , tạo được động lực cho sinh viên .","cô dạy nhiệt tình","cô dạy ","Teaching quality","nhiệt tình","Positive"
"88","cô dạy nhiệt tình , tạo được động lực cho sinh viên .","tạo được động lực cho sinh viên","tạo được động lực cho sinh viên","Support from lecturers","tạo được động lực ","Positive"
"89","phương pháp dạy phải cụ thể chi tiết hơn .","phương pháp dạy phải cụ thể chi tiết hơn","phương pháp dạy","Teaching quality","phải cụ thể chi tiết hơn","Negative"
"90","ngoài ra cũng cần có tiết học để sinh viên được nói tiếng anh với nhau nhiều hơn !","ngoài ra cũng cần có tiết học để sinh viên được nói tiếng anh với nhau nhiều hơn ","ngoài ra cũng cần có tiết học để sinh viên được nói tiếng anh với nhau nhiều hơn","General review","cần có tiết học","Negative"
"91","giảng viên dạy rất hay .","giảng viên dạy rất hay","giảng viên dạy ","Teaching quality","rất hay","Positive"
"92","nên để sinh viên tự tìm hiểu lý thuyết trước ở nhà đến trường giảng viên chỉ cần giải thích các vấn đề không rõ sau đó đi thẳng vào giải các bài tập .","nên để sinh viên tự tìm hiểu lý thuyết trước ở nhà","nên để sinh viên tự tìm hiểu lý thuyết trước ở nhà","General review","nên để sinh viên tự tìm hiểu lý thuyết trước ở nhà","Neutral"
"92","nên để sinh viên tự tìm hiểu lý thuyết trước ở nhà đến trường giảng viên chỉ cần giải thích các vấn đề không rõ sau đó đi thẳng vào giải các bài tập .","đến trường giảng viên chỉ cần giải thích các vấn đề không rõ sau đó đi thẳng vào giải các bài tập","giảng viên chỉ cần giải thích ","Teaching quality","đến trường giảng viên chỉ cần giải thích các vấn đề không rõ sau đó đi thẳng vào giải các bài tập","Neutral"
"93","nhập tâm .","nhập tâm","nhập tâm","Teaching quality","nhập tâm","Positive"
"94","nên cho bài tập hàng tuần sát với nội dung bài học và nội dung thi , giảng viên cần giảng chậm lại , làm bài tập vận dụng chứ không nên nói một lèo cho hết slide rồi mới làm bài tập .","nên cho bài tập hàng tuần sát với nội dung bài học và nội dung thi ","bài tập","Workload","nên cho bài tập hàng tuần sát với nội dung bài học và nội dung thi","Negative"
"94","nên cho bài tập hàng tuần sát với nội dung bài học và nội dung thi , giảng viên cần giảng chậm lại , làm bài tập vận dụng chứ không nên nói một lèo cho hết slide rồi mới làm bài tập .","giảng viên cần giảng chậm lại","giảng viên cần giảng chậm lại ","Teaching quality","cần giảng chậm lại","Negative"
"94","nên cho bài tập hàng tuần sát với nội dung bài học và nội dung thi , giảng viên cần giảng chậm lại , làm bài tập vận dụng chứ không nên nói một lèo cho hết slide rồi mới làm bài tập .","làm bài tập vận dụng chứ không nên nói một lèo cho hết slide rồi mới làm bài tập ","làm bài tập vận dụng chứ không nên nói một lèo cho hết slide rồi mới làm bài tập","Teaching quality","không nên nói một lèo cho hết slide rồi mới làm bài tập","Negative"
"95","cô giải ít bài tập .","cô giải ít bài tập","cô","Teaching quality","giải ít bài tập","Negative"
"96","hơi khó tính về chuyện điểm danh .","hơi khó tính về chuyện điểm danh"," điểm danh","Teaching quality","hơi khó tính ","Negative"
"97","lớp thực hành nhóm 2 bảo quản thiết bị quá yếu , do chia thiết bị không theo nhóm cố định , đến nhóm 1 thực hành là thiết bị trong bộ kit phân cho nhóm mình thiếu hụt , hư hỏng linh tinh .","lớp thực hành nhóm 2 bảo quản thiết bị quá yếu","bảo quản thiết bị ","Learning environment","quá yếu","Negative"
"97","lớp thực hành nhóm 2 bảo quản thiết bị quá yếu , do chia thiết bị không theo nhóm cố định , đến nhóm 1 thực hành là thiết bị trong bộ kit phân cho nhóm mình thiếu hụt , hư hỏng linh tinh .","do chia thiết bị không theo nhóm cố định , đến nhóm 1 thực hành là thiết bị trong bộ kit phân cho nhóm mình thiếu hụt , hư hỏng linh tinh"," thiết bị trong bộ kit phân cho nhóm","Learning environment","thiếu hụt , hư hỏng linh tinh","Negative"
"98","thầy rất có tâm huyết với sinh viên , thầy cũng giảng và hướng dẫn rất đầy đủ tuy lớp mất tiết khá nhiều .","thầy rất có tâm huyết với sinh viên","thầy","Support from lecturers","tâm huyết ","Positive"
"98","thầy rất có tâm huyết với sinh viên , thầy cũng giảng và hướng dẫn rất đầy đủ tuy lớp mất tiết khá nhiều ."," thầy cũng giảng và hướng dẫn rất đầy đủ tuy lớp mất tiết khá nhiều","giảng và hướng dẫn","Teaching quality","rất đầy đủ ","Positive"
"99","thầy cần giao bài tập mỗi buổi lên lớp .","thầy cần giao bài tập mỗi buổi lên lớp"," giao bài tập","Workload","cần giao bài tập mỗi buổi lên lớp","Negative"
"100","phòng học còn nóng và bụi bặm , máy chiếu tuy vẫn nhìn được nhưng vẫn mờ , nếu ngồi xa hay hôm nào sáng quá sẽ không thấy rõ .","phòng học còn nóng và bụi bặm","phòng học ","Learning environment","nóng và bụi bặm","Negative"
"100","phòng học còn nóng và bụi bặm , máy chiếu tuy vẫn nhìn được nhưng vẫn mờ , nếu ngồi xa hay hôm nào sáng quá sẽ không thấy rõ .","máy chiếu tuy vẫn nhìn được nhưng vẫn mờ , nếu ngồi xa hay hôm nào sáng quá sẽ không thấy rõ","máy chiếu","Learning environment","mờ , nếu ngồi xa hay hôm nào sáng quá sẽ không thấy rõ","Negative"